name,url,description,datePublished,imagen,pais,Fuente
HONDURAS / PERIODISTAS SERÁN VACUNADOS CON SPUTNIK,http://www.web.ellibertador.hn/index.php/noticias/nacionales/2928-honduras-periodistas-seran-vacunados-con-sputnik,"Tegucigalpa. Las autoridades de la Secretaría de Salud (Sesal) y el Colegio de Periodistas de Honduras (CPH), han acordado que en los próximos días se aplicará el fármaco Sputnik V a los comunicadores",18-05-2021 19:39,https://www.bing.com/th?id=OVFT.awQNi62DvsuKj_9bAZw-fy,Chile,El Libertador
Mañana inicia jornada de vacunación para mayores de 75 años,https://www.vtv.com.hn/video/manana-inicia-jornada-de-vacunacion-para-mayores-de-75-anos/,¿Dónde y cómo se realizará la jornada? Este miércoles inicia jornada de vacunación contra la covid-19 en personas mayores de 75 años de edad.,18-05-2021 23:02,https://www.bing.com/th?id=OVFT.QkAtnCv_GWpjQPyQ3k-dXy,Chile,VTV
Gobierno alcanza acuerdo con Pfizer para adquirir 4.4 millones de dosis de vacuna anticovid-19,http://www.eldiario.hn/gobierno-alcanza-acuerdo-con-pfizer-para-adquirir-4-4-millones-de-dosis-de-vacuna-anticovid-19/,"Tegucigalpa. - El presidente Juan Orlando Hernández informó hoy martes sobre el acuerdo alcanzado con la farmacéutica Pfizer para adquirir 4.4 millones de dosis de vacuna anticovid-19, con las que tot",19-05-2021 00:16,https://www.bing.com/th?id=OVFT.zOgOp6lIZEv0lF2ArwVR5C,Chile,El Diario
Brigadas de Salud vacunan adultos mayores en barrios y colonias de SPS,http://www.elsoldehonduras.com/salud/brigadas-de-salud-vacunan-adultos-mayores-en-barrios-y-colonias-de-sps/,"Como parte de la cuarta jornada nacional de vacunación, la Secretaría de Salud (Sesal) inició este martes en San Pedro Sula la inmunización comunitaria contra la covid-19 a adultos mayores de 75 años",19-05-2021 03:54,https://www.bing.com/th?id=OVFT.CBt97rWEKtwuR_E-FiJg2S,Chile,El Sol de Honduras
Cientos de adultos mayores acuden a vacunarse contra la COVID-19 mediante autoservicio en la capital,https://proceso.hn/cientos-de-adultos-mayores-acuden-a-vacunarse-contra-la-covid-19-mediante-autoservicio-en-la-capital/,"Las filas de vehículos son interminables esta mañana en los tres centros de “autoservicio” de Tegucigalpa, asignados para vacunar contra la COVID-19 a los mayores de 75 años.",19-05-2021 14:07,https://www.bing.com/th?id=OVFT.yHTpQeA4BNQS6Hril4yfly,Chile,Proceso
Positividad de COVID-19 baja un 9 % durante el mes de mayo en Choluteca,https://tiempo.hn/pacientes-contagiados-covid-19-en-choluteca/,La positividad de casos en el departamento de Choluteca esta comenzando a registrar un descenso en las últimas dos semanas de mayo.,19-05-2021 15:39,https://www.bing.com/th?id=OVFT.7sABZM6cprNkJRywMfpNvy,Chile,Tiempo
VARIAS ORGANIZACIONES HONDUREÑAS ENVÍAN CARTA AL PRESIDENTE BIDEN PARA QUE DONE VACUNAS Al PAÍS,https://ultimahora.hn/varias-organizaciones-hondurenas-envian-carta-al-presidente-biden-para-que-done-vacunas-al-pais/,"La Asociación para una Sociedad más Justa (ASJ) y 194 organizaciones más; entre iglesias, la academia, empresa privada y sociedad civil, han enviado una carta de solicitud a la administración del",19-05-2021 16:29,https://www.bing.com/th?id=OVFT.4z8AUnMqzG5a1sUVqKIY4C,Chile,Ultima Hora
Aduanas pretende recuperar más de un millón de lempiras en Subasta Pública en Línea,https://www.latribuna.hn/2021/05/19/aduanas-pretende-recuperar-mas-de-un-millon-de-lempiras-en-subasta-publica-en-linea/,La Administración Aduanera de Honduras a la vanguardia en sus procedimientos pone a disposición la primera subasta pública en línea,19-05-2021 18:01,https://www.bing.com/th?id=OVFT.Qiv5X0zU_iJrRn0Z-XIoky,Chile,La Tribuna
