name,url,description,datePublished,imagen,pais,Fuente
Hijo de Chelato Uclés relata sus últimos momentos y la preciada 'herencia' que le dejó,https://www.diez.hn/liganacionaldehonduras/1460451-498/muere-chelato-ucles-hijo-rudy-urbina-ultimos-momentos-chelato-ihss,"Rudy Urbina, uno de los hijos de Chelato Uclés revela que intentarán hacer un museo de fútbol en honor a su padre en la casa donde vivió largo tiempo.",29-04-2021 23:09,https://www.bing.com/th?id=OVFT.68eNlVB951Midi_870l3fS,Chile,diez.hn
HONDURAS / ¡YA A SU ALCANCE! EL LIBERTADOR IMPRESO,http://www.web.ellibertador.hn/index.php/noticias/nacionales/2880-honduras-ya-a-su-alcance-nueva-edicion-impresa-el-libertador-5,"En la primera edición impresa de 2021, en formato digital, EL LIBERTADOR pone en sus manos artículos que sólo leerá en el “Primer Auditor Social de Honduras”, estos son algunos de nuestros titulares:",30-04-2021 00:06,https://www.bing.com/th?id=OVFT.4wC9Rt9VxOyFfhG4y50kBy,Chile,El Libertador
HONDURAS / UNAH GESTIONA VACUNAS PARA ESTUDIANTES ANTE TARDANZA DEL GOBIERNO,http://www.web.ellibertador.hn/index.php/noticias/nacionales/2881-honduras-unah-gestiona-vacunas-para-estudiantes-ante-tardanza-del-gobierno,"El vicerrector de la Universidad Nacional Autónoma de Honduras (UNAH) asegura que ya existen pláticas con universidades de Rusia, Chile y China para poder adquirir el biológico y así lograr que se vue",30-04-2021 00:59,https://www.bing.com/th?id=OVFT.Orm_FYXkcaTx7QdyP-wYoC,Chile,El Libertador
"'Que la población hondureña no esté vacunada retrasa la normalidad económica del país': Federico Álvarez, expresidente del BCIE",https://www.radiohrn.hn/que-la-poblacion-hondurena-no-este-vacunada-retrasa-la-normalidad-economica-del-pais-federico-alvarez-expresidente-del-bcie,"El experto en temas económicos aseguró que, mientras la ciudadanía no esté inmunizada contra el covid-19, la normalidad económica continuará retrasándose",30-04-2021 01:38,https://www.bing.com/th?id=OVFT.ebfRjPbfVsJW9-JH8NkrBC,Chile,Radio HRN
Honduras supera los 211 mil contagios de coronavirus tras aplicar más de 5 mil PCR,https://hondudiario.com/2021/04/29/honduras-supera-los-211-mil-contagios-de-coronavirus-tras-aplicar-mas-de-5-mil-pcr/,"Honduras sumó este jueves 1,586 nuevos casos de coronavirus, alcanzando así un total de 211,076 contagios a nivel nacional, según el último recuento del Sistema Nacional de Gestión de Riesgos (Sinager",30-04-2021 03:17,https://www.bing.com/th?id=OVFT.awBfxMPCF0zPE_DOBEcHTS,Chile,Hondudiario
"Los nuevos casos de covid-19 son más agresivos, explica el doctor Gunther Torres",https://www.elheraldo.hn/pais/1460589-466/nueva-cepa-covid-honduras-salud-paz,"Las autoridades de la Secretaría de Salud informaron que se analizaron 134 muestras de pacientes positivos de covid-19, de las cuales 33 resultaron positivas a la detección de alguna de las nuevas var",30-04-2021 11:29,https://www.bing.com/th?id=OVFT.S-N3e4WgS582Zi3VMTM6JC,Chile,El Heraldo
"Nueva ola de covid-19 golpea a niños, jóvenes y embarazadas",https://www.elheraldo.hn/pais/1460583-466/nueva-ola-covid-19-menores-honduras-2021,"TEGUCIGALPA, HONDURAS.-En las últimas semanas, los médicos han detectado que el covid-19 se está volviendo más agresivo contra las poblaciones jóvenes, sin dejar por un lado a los niños, desde sus pri",30-04-2021 14:34,https://www.bing.com/th?id=OVFT.1O140v_oE6WhmIQB19H2ky,Chile,El Heraldo
SALUD Y MÉDICOS DEL MUNDO LANZAN PROYECTO DE FORTALECIMIENTO ANTE LA COVID-19,https://ultimahora.hn/salud-y-medicos-del-mundo-lanzan-proyecto-de-fortalecimiento-ante-la-covid-19/,"— El proyecto tendrá una duración de dos años, dentro de los cuales se invertirán 513.900 € (aproximadamente 15 millones de lempiras) en acciones que permitan ampliar y mejorar la cobertura",30-04-2021 15:51,https://www.bing.com/th?id=OVFT.p5RjJJ3t0n8_fF9KyCt45C,Chile,Ultima Hora
SALUD RECOMIENDA EXTREMAR MEDIDAS DE BIOSEGURIDAD ANTE NUEVA VARIANTE DEL COVID-19,https://ultimahora.hn/salud-recomienda-extremar-medidas-de-bioseguridad-ante-nueva-variante-del-covid-19/,— Honduras cuenta con el equipo para la detección de esta nueva variante de preocupación del Sars-Cov-2. Ante el surgimiento de la nueva variante de preocupación del Sars-Cov-2 autoridades,30-04-2021 16:42,https://www.bing.com/th?id=OVFT.9N6-yDEcvx2Jyr3yDhyX9C,Chile,Ultima Hora
"La pobreza en Honduras subió a 70% en 2020 por culpa de Eta, Iota y la covid",https://www.laprensa.hn/honduras/1460750-410/pobreza-honduras-subio-70-2020-culpa-eta-iota-covid,"La pobreza es el 'reflejo de la debilidad estructural de la economía del país, la que siempre ha afectado a un alto porcentaje de la población, pero con la crisis del año 2020 se ha acentuado.",30-04-2021 17:27,https://www.bing.com/th?id=OVFT.sSdF5ZNPCLecYckvrcvZQS,Chile,La Prensa Chicos
"Muere de covid vicealcalde hondureño del municipio de Protección, Santa Bárbara",https://www.radiohrn.hn/muere-de-covid-vicealcalde-hondureno-del-municipio-de-proteccion-santa-barbara,"El vicealcalde del municipio de Protección, en el departamento de Santa Bárbara, occidente de Honduras, falleció el jueves (29.04.2021) a causa del coronavirus, informaron sus familiares a HRN. Se tra",30-04-2021 18:52,https://www.bing.com/th?id=OVFT.ftdAZ07wtWsAV3rziCMG4S,Chile,Radio HRN
"“Pueden traer cualquier vacuna de agua churria y que no tenga un registro sanitario”, alerta el ex diputado, Liberato Madrid",https://www.vtv.com.hn/noticia/pueden-traer-cualquier-vacuna-de-agua-churria-y-que-no-tenga-un-registro-sanitario-alerta-el-ex-diputado-liberato-madrid/,"Tras la aprobación del Congreso Nacional CN, con respecto a la Ley de Regulación de Vacunas y Medicamentos contra el Covid-19, el médico y ex diputado Liberato Madrid muestra descontento. Además expre",30-04-2021 20:58,https://www.bing.com/th?id=OVFT.UkKl4zPxAxzGihEoEH4YVC,Chile,VTV
Bonos de Solidaridad Productiva y Cafetalero brindan seguridad alimentaria en todo el país,http://www.elsoldehonduras.com/agricultura/bonos-de-solidaridad-productiva-y-cafetalero-brindan-seguridad-alimentaria-en-todo-el-pais/,"Los bonos de Solidaridad Productiva y Cafetalero brindan seguridad alimentaria en todas las regiones del país, gracias a la visión del presidente Juan Orlando Hernández. En menos de siete años de ejec",30-04-2021 21:01,https://www.bing.com/th?id=OVFT.M6avkNUpyswBvjlOfAmivy,Chile,El Sol de Honduras
Variante del COVID-19 que ya circula en el país podría ser la brasileña,https://hondudiario.com/2021/04/30/variante-del-covid-19-que-ya-circula-en-el-pais-podria-ser-la-brasilena/,"El científico hondureño, Marco Tulio Medina indicó que la nueva variante de la Covid-19 SARS-CoV-2 que circula en Honduras, podría proceder de Brasil. Medina comentó que, es más probable que esta vari",30-04-2021 21:39,https://www.bing.com/th?id=OVFT.LUa9dDVOJFbCrJksIEiqqC,Chile,Hondudiario
Lotes de Sputnik V continuarán llegando a Honduras,https://www.vtv.com.hn/noticia/lotes-de-sputnik-v-continuaran-llegando-a-honduras/,"El ministro de Finanzas, Marco Midence, pidió a un sector de la oposición no politizar el tema de las vacunas contra el Covid-19 que en las próximas semanas llegarán más lotes de Sputnik V, al país pa",30-04-2021 21:46,https://www.bing.com/th?id=OVFT.a3ulV5TN2JOMdeJ8upQhwS,Chile,VTV
Forbes: Honduras es el país de CA que menos ha vacunado contra la COVID-19,https://tiempo.hn/forbes-honduras-menos-vacunados-covid-19/,"TEGUCIGALPA, HONDURAS. Según datos de Our World In Data, de la reconocida revista Forbes de Centroamérica, Honduras es el país que menos ha vacunado a la población contra la COVID-19. Con un total de",01-05-2021 01:16,https://www.bing.com/th?id=OVFT.jBPIUiUYrEIWQMu3eP7bsC,Chile,Tiempo
Ministra de Salud: variante de COVID que circula en Honduras “no mata»,https://www.latribuna.hn/2021/04/30/ministra-de-salud-variante-de-covid-que-circula-en-honduras-no-mata/,"La ministra de la Secretaría de Salud, Alba Consuelo Flores, expresó este viernes que la nueva variante del COVID-19 que",01-05-2021 01:53,https://www.bing.com/th?id=OVFT.pAwt65zmyT9VVNhnjhz8SS,Chile,La Tribuna
"Proveniente de México retornan al país 136 personas, entre ellas 50 niños no acompañados",http://www.eldiario.hn/proveniente-de-mexico-retornan-al-pais-136-personas-entre-ellas-50-ninos-no-acompanados/,"San Pedro Sula. - El Centro de Atención al Migrante Retornado de San Pedro Sula (CAMR-SPS) recibió este viernes un vuelo proveniente de México con 136 personas, entre ellas 50 Niños No Acompañados (NN",01-05-2021 02:25,https://www.bing.com/th?id=OVFT._tm4mbkKzIosEGbxw8Y0RC,Chile,El Diario
Vacunas contra COVID-19: ¿qué tan efectivas son ante nuevas cepas?,https://tiempo.hn/efectividad-vacunas-nuevas-variantes-covid-19/,"TEGUCIGALPA, HONDURAS.- Las nuevas variantes de la COVID-19 que surgieron en diferentes partes del mundo preocupan y amenazan la efectividad de las vacunas para hacerle frente a a pandemia, expresan e",01-05-2021 02:42,https://www.bing.com/th?id=OVFT.BQuGhHnBsuArkMiBucibUS,Chile,Tiempo
Honduras acumula 212 mil 333 casos y 5 mil 281 defunciones por COVID-19,https://proceso.hn/honduras-acumula-212-mil-333-casos-y-5-mil-281-defunciones-por-covid-19/,"El Laboratorio de Virología procesó este viernes cuatro mil 225 pruebas PCR, de las cuales, mil 257 resultaron positivas.",01-05-2021 03:07,https://www.bing.com/th?id=OVFT.ge4c3EftPnJoLoyyw8jGVC,Chile,Proceso
