name,url,description,datePublished,imagen,pais,Fuente
Honduras confirma el primer caso de hongo negro en un paciente con COVID-19,https://es-us.noticias.yahoo.com/honduras-confirma-caso-hongo-negro-210902402.html,"Las autoridades sanitarias de Honduras confirmaron la aparición del primer caso de hongo negro en un paciente recuperado de COVID-19, enfermedad que ha azotado en las últimas semanas a la India. “Pued",08-06-2021 21:09,https://www.bing.com/th?id=OVFT.hfKNKMfH6wKb9vtOD2TVFy,Chile,Yahoo Noticias en Español
Caen los números de hospitalizaciones por COVID-19 en Rhode Island,https://www.msn.com/es-us/noticias/otras/caen-los-n%C3%BAmeros-de-hospitalizaciones-por-covid-19-en-rhode-island/ar-AAKXdhM,"Solo hay 37 personas en los hospitales de Rhode Island con casos confirmados del coronavirus según los últimos datos del Departamento de Salud del estado publicados el jueves, el total de un solo día",11-06-2021 18:26,https://www.bing.com/th?id=OVFT.Qf9qhLs9wRKpxOjPqs1EbS,Chile,MSN
"En 30 municipios se reanudarán clases; médicos dicen que sería un ""suicidio""",https://www.radiohrn.hn/en-30-municipios-se-reanudaran-clases-medicos-dicen-que-seria-un-suicidio,"La pandemia covid-19 ha puesto al descubierto todas las debilidades del sistema de enseñanza-aprendizaje, referidas a la cobertura, acceso y calidad",12-06-2021 16:42,https://www.bing.com/th?id=OVFT.ekFFqzK8684K54vYvKpYiS,Chile,Radio HRN
MÉXICO CONFIRMA QUE ENVIARÁ VACUNAS A HONDURAS EN LOS PRÓXIMOS DÍAS,https://ultimahora.hn/mexico-confirma-que-enviara-vacunas-a-honduras-en-los-proximos-dias/,"México confirmó este sábado que en los próximos días enviará a Honduras vacunas de AstraZeneca contra la covid-19 como parte de un aporte a varios países de América Latina y el Caribe “Inicia hoy,",12-06-2021 18:05,https://www.bing.com/th?id=OVFT.evSxYVD99I7sbSj-av8UnS,Chile,Ultima Hora
"Honduras acumula 6,606 muertos por covid-19 y 247,074 contagios",https://www.laprensa.hn/honduras/1470356-410/honduras-acumula-6606-muertos-por-covid-19-y-247074-contagios,"El organismo sumó a sus registros siete nuevos casos de fallecidos, con los que la cifra se elevó a 6,606 en quince meses de pandemia.",12-06-2021 23:53,https://www.bing.com/th?id=OVFT.awgsxFqHkT2iYnY9VTiegy,Chile,La Prensa Chicos
Honduras suma mil 379 nuevos casos y acumula 247 mil 074 contagios de COVID-19,https://proceso.hn/honduras-suma-mil-379-nuevos-casos-y-acumula-247-mil-074-contagios-de-covid-19/,"Honduras sumó este sábado mil 379 nuevos casos positivos de la COVID-19, con los que contabiliza 247 mil 074 contagios desde que se declaró una emergencia sanitaria por la pandemia en marzo de",13-06-2021 02:39,https://www.bing.com/th?id=OVFT.Mg1Un2WGJcqS9D-5DH7bzC,Chile,Proceso
"A 247,074 asciende la cifra de casos de covid en Honduras",https://www.radiohrn.hn/a-247074-asciende-la-cifra-de-casos-de-covid-en-honduras,"Honduras acumula un total de 247,074 casos de covid-19 desde el año anterior cuando inició la pandemia hasta a la fecha, según informó el sábado (12.06.2021) el Sistema Nacional de Gestión de Riesgos",13-06-2021 03:44,https://www.bing.com/th?id=OVFT.yEyVf2sZHAt9Y2Dzmd2SsC,Chile,Radio HRN
"Vacunar docentes, clave para retornar a clases semipresenciales en Honduras",https://www.laprensa.hn/honduras/1470367-410/vacunacion-docentes-estudiantes-clave-retorno-clases-semipresenciales-honduras,"Tegucigalpa, Honduras. El ministro de Educación, Arnaldo Bueso, reconoció que vacunar contra el covid-19 a los docentes es fundamental para un retorno seguro a clases semipresen",13-06-2021 08:05,https://www.bing.com/th?id=OVFT.-IOJXLbE__hpfLAGpo5xZS,Chile,La Prensa Chicos
"Honduras registra 247,074 contagios y 6,606 muertos a causa del COVID",https://hondudiario.com/covid-19/honduras-registra-247074-contagios-y-6606-muertos-a-causa-del-covid/,"El Sistema Nacional de Gestión de Riesgos (Sinager), informó que de 1,379 nuevos casos positivos de Covid-19, sumando así 247, 074 contagios desde que se declaró una emergencia sanitaria por la pandem",13-06-2021 15:29,https://www.bing.com/th?id=OVFT.9tX6IbP8UN-8-T4ILhtjii,Chile,Hondudiario
Reportan 10 decesos por sospecha de COVID-19 en Tegucigalpa,https://proceso.hn/reportan-10-decesos-por-sospecha-de-covid-19-en-tegucigalpa-2/,"Al menos 10 personas perdieron la vida bajo sospecha del COVID-19 en hospitales de Tegucigalpa, informaron este domingo fuentes de los centros asistenciales.",13-06-2021 17:38,https://www.bing.com/th?id=OVFT.o7qpUTWK1Mf168dJWcuiQS,Chile,Proceso
Municipios del sur piden vacunas anticovid al presidente Nayib Bukele,https://www.elheraldo.hn/pais/1470535-466/municipios-vacunas-anticovid-bukele-sur-honduras,"En el departamento de Choluteca van más de 2,300 casos positivos y 93 muertes este año con una letalidad del 3.9%. Además, varios municipios luchan por mantener abiertos los triajes",13-06-2021 19:38,https://www.bing.com/th?id=OVFT.Vkoq2gQi5EGjxmot9pfwJi,Chile,El Heraldo
Maynor Figueroa busca al aficionado catracho que invadió el Honduras-México para regalarle su camisa,https://www.diez.hn/laseleccion/1470392-498/maynor-figueroa-aficionado-busca-regalarle-camisa-honduras-amistoso-mexico-gesto,Maynor Alexis Figueroa Róchez (38 años) es el gran líder y capitán de la selección de Honduras que dirige el entrenador Fabián Coito. Te puede interesar: Henry Figueroa reaparece jugando al fútbol lue,13-06-2021 21:11,https://www.bing.com/th?id=OVFT.liry57zWlzIy2GuMLZLoVC,Chile,diez.hn
"Huérfanos del covid: 1,300 niños hondureños sin sus padres por el virus",https://www.elheraldo.hn/pais/1470576-466/huerfanos-covid-ninos-hondurenos-2021,"Una estimación de la Unidad de Datos de EL HERALDO Plus calcula que hay 1,300 niños que perdieron al menos a uno de sus padres",13-06-2021 23:05,https://www.bing.com/th?id=OVFT.ZjJGH7Mpi1oO3MU-QQNUGS,Chile,El Heraldo
7 alcaldes sureños piden vacunas contra el COVID-19 a Bukele,https://www.latribuna.hn/2021/06/13/7-alcaldes-surenos-piden-vacunas-contra-el-covid-19-a-bukele/,"CHOLUTECA. Un grupo de alcaldes de la zona sur del país que conforman la Mancomunidad de Municipios del Sur (Nasmar),",14-06-2021 01:23,https://www.bing.com/th?id=OVFT.qB3EDfqM-yKNI-Fn_FMj6i,Chile,La Tribuna
La Mesa Multisectorial acuerda crear comisión para conocer cronograma de vacunación a docentes,http://www.elsoldehonduras.com/nacionales/la-mesa-multisectorial-acuerda-crear-comision-para-conocer-cronograma-de-vacunacion-a-docentes/,"En la reunión de este día, los miembros de la Mesa Multisectorial lograron importantes acuerdos, dentro de los cuales se destaca el tema de vacunación contra el Covid-19 a los docentes del sector públ",14-06-2021 04:54,https://www.bing.com/th?id=OVFT.olSfbfE3-3H7soPP2raIci,Chile,El Sol de Honduras
Más de 400 mil hondureños han sido vacunados contra la Covid-19,http://www.elsoldehonduras.com/nacionales/mas-de-400-mil-hondurenos-han-sido-vacunados-contra-la-covid-19/,"Un total de 447,023 hondureños se han vacunado contra la Covid-19 desde el mes de febrero hasta el 10 de junio, así lo informó este día la jefa del Programa Ampliado de Inmunizaciones (PAI), Ida Beren",14-06-2021 04:58,https://www.bing.com/th?id=OVFT.xEumewzFjXBNvIv5FDwzUy,Chile,El Sol de Honduras
La sostenibilidad de la deuda y el sacrificio del gasto social,https://www.latribuna.hn/2021/06/14/la-sostenibilidad-de-la-deuda-y-el-sacrificio-del-gasto-social/,"La pandemia de la COVID-19 deja en Honduras varios desafíos; salud y educación precarias, empleos perdidos y un alto endeudamiento",14-06-2021 09:01,https://www.bing.com/th?id=OVFT.DmfFJaJ3RUjk3NFyivILZy,Chile,La Tribuna
COVID-19 pone de rodillas a El Paraíso: Salud y Sinager dan nuevas medidas,https://tiempo.hn/el-paraiso-casos-covid-19/,"De acuerdo con datos del SINAGER, el departamento de El Paraíso actualmente registra 13,364 casos de COVID-19. HONDURAS. Ante el incremento casos de COVID-19 en el departamento de El Paraíso y la alta",14-06-2021 12:50,https://www.bing.com/th?id=OVFT.N4A7m_Otv_wvgk4C_x9hOS,Chile,Tiempo
COVID-19: sitios y horarios donde continúa vacunación en Honduras,https://tiempo.hn/vacunacion-hoy-honduras-covid-19/,"Desde el pasado mes de mayo, comenzó la campaña de vacunación contra la COVID-19 en varios sectores de Honduras. Según las autoridades de Salud, durante ese proceso, un total de 447 mil 023 hondureños",14-06-2021 13:19,https://www.bing.com/th?id=OVFT.ZrFXXK540AbpTbcCFT9oYC,Chile,Tiempo
"Honduras alcanza 6,631 muertes por coronavirus y 247,728 contagios",https://hondudiario.com/covid-19/honduras-alcanza-6631-muertes-por-coronavirus-y-247728-contagios/,"*** Las muertes sólo en 2021 suman un total de 3,397 a nivel nacional. Honduras registró en las últimas horas 654 nuevos casos de coronavirus, alcanzando así un total de 247,728 contagios a nivel naci",14-06-2021 14:31,https://www.bing.com/th?id=OVFT.lUYk2Zc4zPFK4ZRaSgCPyi,Chile,Hondudiario
"GOBIERNO POSTERGA LA APLICACIÓN DE LA SEGUNDA DOSIS DE LA VACUNA ANTICOVID, SPUTNIK V Y ASTRAZENECA HASTA LOS TRES MESES",https://ultimahora.hn/gobierno-posterga-la-aplicacion-de-la-segunda-dosis-de-la-vacuna-anticovid-sputnik-v-y-astrazeneca-hasta-los-tres-meses/,"La Secretaría de Salud de Honduras informó, que la segunda dosis de la vacuna contra el covid-19, Sputnik V y AstraZeneca, será aplicada a los tres meses después de haberse inmunizado la primera",14-06-2021 14:40,https://www.bing.com/th?id=OVFT.jdN7c9Qg_Yd3VotBlaYvyC,Chile,Ultima Hora
Kevin Álvarez: Dejamos buenas sensaciones,https://www.diariomas.hn/2021/06/14/kevin-alvarez-dejamos-buenas-sensaciones/,"Luego de cerrar la gira por Estados Unidos donde jugaron las semifinales de la Liga de Naciones y un duelo amistoso contra México, la selección nacional regresó al país y los futbolistas se mostraron",14-06-2021 15:08,https://www.bing.com/th?id=OVFT.SYuAsKRI0rRMkZTRS1xjyi,Chile,Mas
