name,url,description,datePublished,imagen,pais,Fuente
"Honduras supera los 5,500 fallecidos por COVID-19 y los contagios suman 217,595",https://www.latribuna.hn/2021/05/07/honduras-supera-los-5500-fallecidos-por-covid-19-y-los-contagios-suman-217595/,"Tegucigalpa, may (EFE).- Honduras superó ayer jueves los 5.500 muertos por covid-19, mientras que los contagios ya suman 217.595 en",07-05-2021 18:06,https://www.bing.com/th?id=OVFT.QyT6eQr6bz3r8WTp9jGB0i,Chile,La Tribuna
"Choco Lozano habla de su futuro en Cádiz y las secuelas que le dejó el Covid-19: ""Me gustaría quedarme""",https://www.diez.hn/legionarios/1462241-498/choco-lozano-habla-futuro-cadiz-secuelas-vivir-coronavirus-honduras,El delantero hondureño revela todo lo vivido en esta temporada con los gaditanos donde lograron salvar la categoría. Revela como las secuelas del Covid le afectaron,07-05-2021 18:28,https://www.bing.com/th?id=OVFT.YQ5hPpvNDx5ec_3imNV77i,Chile,diez.hn
En incertidumbre Juegos Olímpicos de Tokio debido a nuevas restricciones por altos contagios de COVID-19,https://www.diez.hn/juegosolimpicostokio2021/1462295-498/incertidumbre-juegos-olimpicos-tokio-debido-nuevas-restricciones-coronavirus,"El estado de emergencia se traduce en el cierre temporal de bares y restaurantes o en una prohibición de que vendan alcohol bajo pena de multa, y en instar a algunos comercios",07-05-2021 19:50,https://www.bing.com/th?id=OVFT.X05wc-ve6-P08tazQyLGjC,Chile,diez.hn
CIENTÍFICO MARCO TULIO MEDINA SUGIERE QUE HONDURAS BUSQUE ADQUIRIR LA VACUNA CHINA SINOPHARM,https://ultimahora.hn/cientifico-marco-tulio-medina-sugiere-que-honduras-busque-adquirir-la-vacuna-china-sinopharm/,"El gobierno de Honduras debe de buscar adquirir las vacunas de Sinopharm contra la COVID-19, sugirió el científico hondureño Marco Tulio Medina. “Esta debería ser una de las vacunas a la cual el",07-05-2021 20:08,https://www.bing.com/th?id=OVFT.uc85bQdLPrJb2lRRCVXmIy,Chile,Ultima Hora
Director ejecutivo de ASJ lamenta que la población hondureña no tenga acceso a la vacuna contra el Covid-19,https://www.vtv.com.hn/noticia/director-ejecutivo-de-asj-lamenta-que-la-poblacion-hondurena-no-tenga-acceso-a-la-vacuna-contra-el-covid-19/,"El director ejecutivo de la Asociación para una Sociedad más Justa ASJ, Carlos Hernández, tras la crisis hospitalaria y el atraso de vacunas, lamenta que la población hondureña no tenga acceso a la va",07-05-2021 20:18,https://www.bing.com/th?id=OVFT.SghRe2YLSun3cUrE2Z11xC,Chile,VTV
"Honduras registra 83 muertes por covid-19, la cifra más alta desde que comenzó la pandemia",https://www.elheraldo.hn/pais/1462405-466/honduras-registra-cifra-mas-alta-muertes-covid-19-pandemia,Estas alarmantes cifras son el claro reflejo de que mayo se está convirtiendo en el mes de alarma para el país ante el evidente aumento en la curva de fallecidos,07-05-2021 20:51,https://www.bing.com/th?id=OVFT.5JhFO05dD501Ad7pMZLMGy,Chile,El Heraldo
HONDURAS / CEUTEC PLANTEA REACTIVACIÓN DE PAÍS REFORZANDO CARRERAS DE SALUD,http://www.web.ellibertador.hn/index.php/noticias/nacionales/2898-honduras-ceutec-plantea-reactivacion-de-pais-reforzando-carreras-de-salud,"Tras pasar más de un año con una condición crítica debido a la pandemia Covid-19, el Centro Universitario Tecnológico (Ceutec), se ha enfocado en fortalecer sus propuestas académicas del área de la sa",07-05-2021 20:54,https://www.bing.com/th?id=OVFT.X3FgtOSJCndQVdJCasMc9S,Chile,El Libertador
Caos y descontrol reportan en la segundo día de vacunación,https://www.vtv.com.hn/noticia/caos-y-descontrol-reportan-en-la-segundo-dia-de-vacunacion/,Decenas de personas han acudido al polideportivo de la Universidad Nacional Autónoma de Honduras para intentar colocarse la vacuna contra la covid-19.,07-05-2021 21:14,https://www.bing.com/th?id=OVFT.I2AnjxkPCFb9OqzcPHkeHC,Chile,VTV
Medina: Liberación de patentes de la vacuna anticovid beneficiará a Honduras,https://tiempo.hn/marco-medina-patentes-de-las-vacunas-covid-19-honduras/,"Honduras debería sumarse a la campaña que exige liberar las patentes de las vacunas contra el COVID-19, a criterio del científico Marco Medina",08-05-2021 00:26,https://www.bing.com/th?id=OVFT.usz6KI_mJCWgAJlcF89xsi,Chile,Tiempo
"Honduras suma 218,330 contagios y 5,585 muertes por covid-19",https://www.radiohrn.hn/honduras-suma-218330-contagios-y-5585-muertes-por-covid-19,"Las nuevas defunciones se registraron en los departamentos de Valle, Olancho, Yoro, Cortés, Olancho, Lempira, Francisco Morazán, Santa Bárbara y Copán",08-05-2021 02:00,https://www.bing.com/th?id=OVFT.kftj4WQpctYlR-iU7hwEpy,Chile,Radio HRN
Honduras acumula 218 mil 330 infectados y 5 mil 585 defunciones por COVID-19,https://proceso.hn/honduras-acumula-218-mil-330-infectados-y-5-mil-585-defunciones-por-covid-19/,"Tegucigalpa – Honduras alcanzó este viernes un total de 218 mil 300 infectados y cinco mil 585 defunciones por COVID-19, establece reporte divulgado por el Sistema Nacional de Gestión de Riesgos (Sina",08-05-2021 02:07,https://www.bing.com/th?id=OVFT.YUe6Kh9oUmHOgUyTI6o1Py,Chile,Proceso
Letalidad por COVID-19 sigue en aumento tras confirmarse otras 83 muertes,https://hondudiario.com/2021/05/07/letalidad-por-covid-19-sigue-en-aumento-tras-confirmarse-otras-83-muertes/,"Los casos de Covid-19 en Honduras ascendieron este viernes a 218.330 desde el inicio de la pandemia con la confirmación de otros 735 contagios, mientras que los pacientes recuperados se incrementaron",08-05-2021 02:38,https://www.bing.com/th?id=OVFT.EC5pDwYJ9CdJH0KI4l9OaC,Chile,Hondudiario
Casos de covid-19 aumentan a 218.330,https://www.latribuna.hn/2021/05/07/casos-de-covid-19-aumentan-a-218-330/,"Los casos de COVID-19 en Honduras ascendieron a 218,330 desde el inicio de la pandemia con la confirmación de otros",08-05-2021 02:41,https://www.bing.com/th?id=OVFT.z3E10TKf85Yal5ZEnQtzxS,Chile,La Tribuna
Aplican primera dosis de vacuna contra la covid-19 a miembros de los cuerpos de socorro en SPS,http://www.eldiario.hn/aplican-primera-dosis-de-vacuna-contra-la-covid-19-a-miembros-de-los-cuerpos-de-socorro-en-sps/,"San Pedro Sula. - La Secretaría de Salud inició este viernes en San Pedro Sula la aplicación de la primera dosis de AstraZeneca a miembros de los cuerpos de socorro como bomberos, Cruz Roja, Cruz Verd",08-05-2021 02:50,https://www.bing.com/th?id=OVFT.knWjsDGY6mYpPCI57FL6Ri,Chile,El Diario
La entrada de remesas familiares a Honduras aumenta casi en 44%,https://www.elheraldo.hn/economia/1462390-466/aumentan-remesas-familiares-divisas-honduras-pib-migracion,Los hondureños que radican en el exterior han enviado alrededor de $700 millones en relación al 4 de mayo de 2020. Recuperación de la economía de EE UU está impactando en las remesas,08-05-2021 07:59,https://www.bing.com/th?id=OVFT.IasbdEEg8HAQ-oNQf-sTuC,Chile,El Heraldo
Proponen que UNAH compre vacunas para inmunizar a estudiantes,https://www.laprensa.hn/honduras/1462491-410/piden-unah-compre-vacunas-inmunizar-estudiantes,"La carta sugiere que UNAH adquiera, al menos, 280,000 dosis del fármaco, que servirían para inmunizar a la comunidad universitaria, diseminada en diversas zonas del país y centros universitarios regio",08-05-2021 12:56,https://www.bing.com/th?id=OVFT.o4GkHu3twDZckErtgimi-i,Chile,La Prensa Chicos
CUERPOS DE SOCORRO RECIBEN PRIMERA DOSIS DE VACUNA CONTRA LA COVID-19,https://ultimahora.hn/cuerpos-de-socorro-reciben-primera-dosis-de-vacuna-contra-la-covid-19/,"La Secretaría de Salud inició desde ayer  viernes en San Pedro Sula la aplicación de la primera dosis de AstraZeneca a miembros de los cuerpos de socorro como bomberos, Cruz Roja, Cruz Verde,",08-05-2021 14:19,https://www.bing.com/th?id=OVFT.k2FPUJTFRYxy79vv3rF7sC,Chile,Ultima Hora
Zona occidental de Honduras alcanza una tasa de letalidad por covid de un 5%,https://www.radiohrn.hn/zona-occidental-de-honduras-alcanza-una-tasa-de-letalidad-por-covid-de-un-5,"En la primera semana de mayo se han producido, en promedio, entre 36 y 40 muertes diarias; estos son los departamentos más afectados",08-05-2021 14:33,https://www.bing.com/th?id=OVFT.6QAGQix9tnMComZIORhAbC,Chile,Radio HRN
El covid le arrebata la vida a candidata a diputada hondureña,https://www.laprensa.hn/honduras/1462526-410/covid-arrebata-vida-candidata-diputada-hondure%C3%B1a,"Intibucá, Honduras. En las últimas horas se confirmó la muerte de María de La Paz Cantarero, abogada y candidata a diputada por el Partido Liberal, en el departamento de Intib",08-05-2021 16:21,https://www.bing.com/th?id=OVFT.2wPYN9jkEaqwD0YJMErQIS,Chile,La Prensa Chicos
Más de 17 mil 400 niños se han contagiado y 37 murieron por la COVID en Honduras,https://proceso.hn/mas-de-17-mil-400-ninos-se-han-contagiado-y-37-murieron-por-la-covid-en-honduras/,"Más de 17 mil 400 niños hondureños se han contagiado y 37 murieron por la COVID-19, según los reportes oficiales del Sistema Nacional de Gestión de Riesgos (Sinager).",08-05-2021 20:05,https://www.bing.com/th?id=OVFT.gx6LAFlF2Lb6K5Dx7--Fxy,Chile,Proceso
NO HAY ORDEN NI PARA ENTREGAR CÉDULA A TERCERA EDAD EN HONDURAS,http://www.web.ellibertador.hn/index.php/noticias/nacionales/2901-no-hay-orden-ni-para-entregar-cedula-a-tercera-edad-en-honduras,"Tegucigalpa.- El primer día entrega del Documento Nacional de Identificación (DNI) para adultos mayores se desarrolló en el total caos en la Villa Olímpica de Tegucigalpa, no faltaron las aglomeracion",08-05-2021 21:10,https://www.bing.com/th?id=OVFT.CrNo-KBo-faYSM1yYDSqqS,Chile,El Libertador
Más de 17 mil niños contagiados y 37 han muerto por COVID-19 en Honduras,https://hondudiario.com/2021/05/08/mas-de-17-mil-ninos-contagiados-y-37-han-muerto-por-covid-19-en-honduras/,"La funcionaria del Programa de Políticas Públicas de la Dirección Nacional de la Niñez, Adolescencia y la Familia (Dinaf), Debbie Gómez, aseguró que, más de 17,400 niños hondureños se han contagiado y",08-05-2021 21:47,https://www.bing.com/th?id=OVFT.7ciR3bELX7qB2fBoEBX_Xi,Chile,Hondudiario
"Científico: Ante falta de vacunas, hondureños viajarán a El Salvador a vacunarse",https://tiempo.hn/hondurenos-viajaran-a-vacunarse-a-el-salvador/,"TEGUCIGALPA, HONDURAS. El científico hondureño, Marco Tulio Medina, vaticinó que muchos hondureños viajarán a El Salvador a vacunarse contra la covid-19, ante la falta de este fármaco en el país. El c",08-05-2021 23:21,https://www.bing.com/th?id=OVFT.bfeb1ptV4foosUaFBrVD3y,Chile,Tiempo
