name,url,description,datePublished,imagen,pais,Fuente
"El corazón de los deportistas contagiados de covid-19, objeto de estudio",https://www.elheraldo.hn/deportes/1452510-466/corazon-deportistas-contagiados-covid-19-objeto-estudio-oms,"TEGUCIGALPA, HONDURAS.- Ya en el punto de mira en tiempo normal, el corazón de los deportistas contagiados de covid-19 es objeto de estrecha vigilancia cuando recuperan su actividad habitual, ya que p",26-03-2021 14:46,https://www.bing.com/th?id=OVFT.1XHixKcqQxXIRwVJOMMtJy,Chile,El Heraldo
"Ministro de Educación, reafirma:",https://www.vtv.com.hn/noticia/ministro-de-educacion-reafirma/,"Tablets electrónicas adquiridas son de última generación y aptas para el proceso de aprendizaje de estudiantes Arnaldo Bueso señala que esos componentes son totalmente nuevos, y cuentan con procesador",26-03-2021 16:58,https://www.bing.com/th?id=OVFT.4l4qdOhZwgxQHfStLwLyxC,Chile,VTV
"Honduras frente a tercera ola de COVID-19, advierten autoridades",https://proceso.hn/honduras-frente-a-tercera-ola-de-covid-19-advierten-autoridades/,"Si la población no asume su responsabilidad durante el asueto de Semana Santa (29 marzo-4 abril), Honduras podría enfrentar su tercera ola de la COVID-19, advirtieron hoy autoridades de la",26-03-2021 17:03,https://www.bing.com/th?id=OVFT.nORQiAh7Wr8Y19OAlSBeKC,Chile,Proceso
En 30% podrían aumentar los contagios de Covid-19 tras la Semana Santa,https://hondudiario.com/2021/03/26/en-30-podrian-aumentar-los-contagios-de-covid-19-tras-la-semana-santa/,"La portavoz de Colegio de Microbiólogos y Químicos Clínicos de Honduras, Miriam Aguilera calculó que, después de la Semana Santa, habrá un repunte de casos de Covid-19 del 30 por ciento. La vocera ase",26-03-2021 17:04,https://www.bing.com/th?id=OVFT.T4PlEwc-DRT37HhPK-zqiC,Chile,Hondudiario
Semana Santa abre la puerta a una tercera oleada de coronavirus en Honduras,https://hondudiario.com/2021/03/26/semana-santa-abre-la-puerta-a-una-tercera-oleada-de-coronavirus-en-honduras/,"El viceministro de Salud, Roberto Cosenza, advirtió este viernes que Honduras se encuentra amenazada por una tercera ola de coronavirus. Las declaraciones del funcionario se dan en un escenario previo",26-03-2021 17:53,https://www.bing.com/th?id=OVFT.7Y4ahZCRu9g1pJMF6jDhai,Chile,Hondudiario
Gobierno reitera que no hay autorización para celebración de conciertos y espectáculos públicos,http://www.elsoldehonduras.com/nacionales/gobierno-reitera-que-no-hay-autorizacion-para-celebracion-de-conciertos-y-espectaculos-publicos/,"Secretaría de Gobernación cancela concierto de RIC HASSANI y ASPIRANTE programados en Trujillo, Colón para Semana Santa.Las 18 Gobernaciones Departamentales tienen instrucción para prohibir espectácul",26-03-2021 18:48,https://www.bing.com/th?id=OVFT.NgLCe1yWBxgLCJ6v0Ki3qy,Chile,El Sol de Honduras
Aduanas de Frontera y Guardaturas Aéreas laborarán en horario normal durante la Semana Santa,http://www.elsoldehonduras.com/nacionales/aduanas-de-frontera-y-guardaturas-aereas-laboraran-en-horario-normal-durante-la-semana-santa/,Con la finalidad de brindar una óptima atención a los exportadores e importadores y de esta forma continuar con la fluidez del comercio en la región la Administración Aduanera de Honduras da a conocer,26-03-2021 19:03,https://www.bing.com/th?id=OVFT.2B09xl6UsYgL7_FrP9Q0eS,Chile,El Sol de Honduras
"Un año después de la primera muerte, pandemia del COVID sigue en Honduras",https://tiempo.hn/primera-muerte-pandemia-en-honduras/,"Actualmente los casos de COVID-19 siguen en alza, mientras los hondureños aguardan por una vacuna. TEGUCIGALPA, HONDURAS. Marzo de 2020 es un mes que estará grabado en la memoria de varios hondureños.",26-03-2021 22:03,https://www.bing.com/th?id=OVFT.loELFtGZWki6AF_HVFsU1i,Chile,Tiempo
Covid-19 reduce ventas de palmas para Domingo de Ramos en Honduras,https://www.radiohrn.hn/covid-19-reduce-ventas-de-palmas-para-domingo-de-ramos-en-honduras,"La pandemia de covid-19 que afecta a Honduras desde marzo de 2020 ha reducido este año las ventas de tiras palmas para su bendición el Domingo de Ramos en los templos católicos. ""Por ese virus uno viene con miedo a vender y han estado diciendo que no ...",26-03-2021 22:39,https://www.bing.com/th?id=OVFT.CY5q589GTWhDxzxBCJcXUC,Chile,Radio HRN
El covid-19 reduce ventas de palmas para Domingo de Ramos en Honduras,https://www.laprensa.hn/honduras/1452638-410/pandemia-covid-19-ventas-palmas-domingo-ramos-honduras,"La venta de palmas es una vieja tradición en muchos de los templos católicos de Honduras, marcada por decenas de campesinos, entre hombres, mujeres y niños, que llegan desde comunidades rurales del pa",26-03-2021 23:06,https://www.bing.com/th?id=OVFT.wT98jK52C92zlEfCwUYRRC,Chile,La Prensa Chicos
"Las variantes del COVID-19: ¿más contagiosas, más resistentes, más temibles?",https://tiempo.hn/variantes-del-covid-19-contagiosas-mortales/,La emergencia de variantes del COVID-19 preocupa tanto a los científicos como al gran público por el riesgo de que sean más,27-03-2021 00:16,https://www.bing.com/th?id=OVFT.0pOwe_xj6YgxBhwDQqnKfy,Chile,Tiempo
El BCIE dispone de 500 mil dólares para un centro de contención de covid-19 en Honduras,https://www.radiohrn.hn/el-bcie-dispone-de-500-mil-dolares-para-un-centro-de-contencion-de-covid-19-en-honduras,"Con este donativo, el BCIE ha otorgado a Honduras 2,4 millones de dólares en apoyo a las medidas de mitigación de la covid-19, añadió Mossi El Banco Centroamericano de Integración Económica (BCIE) informó este viernes sobre una nueva donación de ...",27-03-2021 03:32,https://www.bing.com/th?id=OVFT.ykDCzUbpDgdZkFjMBWrpWi,Chile,Radio HRN
"Suben a 4,536 los decesos por covid en Honduras y contagios llegan a 186,337",https://www.latribuna.hn/2021/03/27/suben-a-4536-los-decesos-por-covid-en-honduras-y-contagios-llegan-a-186337/,"Tegucigalpa, mar (EFE).- La cifra de muertos en Honduras a causa de la pandemia de covid-19 que sufre desde marzo",27-03-2021 14:12,https://www.bing.com/th?id=OVFT.UaPNev03ilQBxeuhHMsRJC,Chile,La Tribuna
PERSONAL DE SALUD DE SPS YA ESTÁN INMUNIZADOS AL 100% TRAS RECIBIR SEGUNDA DOSIS Y AGRADECE AL GOBIERNO Y A ISRAEL,https://ultimahora.hn/personal-de-salud-de-sps-ya-estan-inmunizados-al-100-tras-recibir-segunda-dosis-y-agradece-al-gobierno-y-a-israel/,"El personal de primera línea contra la covid-19 de los hospitales Mario Catarino Rivas, Leonardo Martínez y regional del Instituto Hondureño de Seguridad Social (IHSS), de San Pedro Sula,",27-03-2021 14:16,https://www.bing.com/th?id=OVFT.vCM-HETKklR8g2cw6674ji,Chile,Ultima Hora
OFICIAL: Héctor Castellon es el nuevo entrenador de la Real Sociedad para el resto del Clausura 2021,https://www.diez.hn/liganacionaldehonduras/1452729-498/hector-castellon-entrenador-real-sociedad-tocoa-honduras-clausura-2021-liga-nacional,"Con pruebas de covid-19 en proceso, el equipo de Tocoa espera contar con su presencia en su próximo juego donde ganar podrían dar un paso adelante para permanecer en Liga Nacional, pues son últimos en la tabla general y tienen pocos partidos para ...",27-03-2021 14:40,https://www.bing.com/th?id=OVFT.Tv3esA8ag7j-K1bnD1zcni,Chile,diez.hn
Se anuncia pírrica rebaja en los precios de los combustibles,https://www.elheraldo.hn/economia/1452674-466/se-anuncia-pirrica-rebaja-precios-combustibles-honduras,Lo anterior se derivará en leves rebajas de los precios de los combustibles que se consumen en Honduras. Así lo anunciaron los representantes de la cadena de comercialización del país. “Con las caídas,27-03-2021 14:47,https://www.bing.com/th?id=OVFT.y_ouJGSeFpTSXmm6MLuWIy,Chile,El Heraldo
"Cifra de muertos por covid en Honduras supera los 4,500",https://www.laprensa.hn/honduras/1452740-410/muetos-honduras-covid-pandemia-contagios-hondurenos-hospitalizados,"La cifra de muertos en Honduras a causa de la pandemia de covid-19 que sufre desde marzo de 2020, se elevó este viernes a 4.536 y la de contagios a 186.337, según el informe diario del Sistema Nacional de Gestión de Riesgos (Sinager). El organismo sanit ...",27-03-2021 16:01,https://www.bing.com/th?id=OVFT.XhRU-9Ca40341aPRjxUVIC,Chile,La Prensa Chicos
Enfermera pierde la batalla contra la COVID-19 en SPS,https://www.latribuna.hn/2021/03/27/enfermera-pierde-la-batalla-contra-la-covid-19-en-sps-2/,"Una enfermera más ha perdido la batalla contra la COVID-19 en Honduras. Se trata de Suyapa Castillo, quien falleció este",27-03-2021 16:19,https://www.bing.com/th?id=OVFT.UikDm1dQoP0QD0sz4fvOAC,Chile,La Tribuna
Liga Triunfeña de Béisbol concluye primera vuelta,https://www.diariomas.hn/2021/03/27/liga-triunfena-de-beisbol-concluye-primera-vuelta/,"La Liga Mayor de Béisbol Triunfeña Carlos y Emilio Martínez, finaliza este fin de semana la primera vuelta del Campeonato Benito “La Pinta” Argeñal,",27-03-2021 16:30,https://www.bing.com/th?id=OVFT.Hzw2-tbRR_R_GIsmsljTJy,Chile,Mas
"Fallece por COVID-19, otra licenciada en enfermería en SPS",https://proceso.hn/fallece-por-covid-19-otra-licenciada-en-enfermeria-en-sps/,"Castillo estuvo ingresada por 20 días en el Instituto Hondureño del Seguro Social (IHSS), de San Pedro Sula, batallando contra la enfermedad, pero perdió la vida.",27-03-2021 17:51,https://www.bing.com/th?id=OVFT.e6QT0yDQrEwa2B4V2rundi,Chile,Proceso
