name,url,description,datePublished,imagen,pais,Fuente
Honduras confirma el primer caso de hongo negro en un paciente con COVID-19,https://es-us.noticias.yahoo.com/honduras-confirma-caso-hongo-negro-210902402.html,"Las autoridades sanitarias de Honduras confirmaron la aparición del primer caso de hongo negro en un paciente recuperado de COVID-19, enfermedad que ha azotado en las últimas semanas a la India. “Pued",08-06-2021 21:09,https://www.bing.com/th?id=OVFT.hfKNKMfH6wKb9vtOD2TVFy,Chile,Yahoo Noticias en Español
Caen los números de hospitalizaciones por COVID-19 en Rhode Island,https://www.msn.com/es-us/noticias/otras/caen-los-n%C3%BAmeros-de-hospitalizaciones-por-covid-19-en-rhode-island/ar-AAKXdhM,"Solo hay 37 personas en los hospitales de Rhode Island con casos confirmados del coronavirus según los últimos datos del Departamento de Salud del estado publicados el jueves, el total de un solo día",11-06-2021 18:26,https://www.bing.com/th?id=OVFT.Qf9qhLs9wRKpxOjPqs1EbS,Chile,MSN
Tokio cancela las 'fan-zones' para seguir las competiciones olímpicas debido a riesgo de contaminación,https://www.diez.hn/juegosolimpicostokio2021/1471886-498/tokio-cancela-las-fan-zones-para-seguir-las-competiciones-ol%C3%ADmpicas-debido-a-riesgo,"Como consecuencia de la pandemia, Tokio ya prohibió la presencia de espectadores procedentes del extranjero y también se ha reducido drásticamente el número de invitados y voluntarios.",19-06-2021 14:22,https://www.bing.com/th?id=OVFT.IumB7IEqpV3r-xdZ9Hub4i,Chile,diez.hn
"La condición de los equipos de la Liga Nacional para disputar el Apertura 2021: Si no hay público, no se juega",https://www.diez.hn/liganacionaldehonduras/1471953-498/publico-apertura-2022-liga-nacional-honduras-real-espana-olimpia-sinager-coronavirus,"El próximo torneo de la Liga Nacional está establecido para arrancar el 7 de agosto y finalizar a más tardar el último día del 2021, sin embargo, para que este inicie debe cumplirse un factor fulminan",19-06-2021 22:00,https://www.bing.com/th?id=OVFT.x0AlY_VVbl-V5jRUcwDqvi,Chile,diez.hn
"Honduras supera los 253,000 casos de covid-19 desde el inicio de la pandemia",https://www.laprensa.hn/honduras/1472041-410/honduras-supera-los-25300-casos-de-covid-19-desde-el-inicio-de-la-pandemia-hondurenos,"Tegucigalpa, Honduras. Las autoridades de Honduras detectaron 1.162 nuevos casos de covid-19 en las últimas horas, con lo que la cifra total se elevó a 253.128 desde el inicio d",20-06-2021 00:33,https://www.bing.com/th?id=OVFT.kJ7TS7Nn8JkFAY4kJqGrTC,Chile,La Prensa Chicos
Honduras suma 11 nuevas muertes por coronavirus y más de mil 100 contagios,https://hondudiario.com/covid-19/honduras-suma-11-nuevas-muertes-por-coronavirus-y-mas-de-mil-100-contagios-2/,"*** La cifra total de personas recuperadas de la enfermedad es de 91,650 en el acumulado. Honduras registró este sábado 1,162 nuevos casos de coronavirus, alcanzando así un total de 253,128 contagios",20-06-2021 02:29,https://www.bing.com/th?id=OVFT.1KhvDb--XDutGx_y9Y8D9i,Chile,Hondudiario
"Cifras del coronavirus| «Uñas COVID», ¿otra consecuencia del virus?",https://tiempo.hn/unas-covid-consecuencia-virus/,"REDACCIÓN. A lo largo del año pasado, han surgido reportes de muchos síntomas inusuales del coronavirus, algunos de los cuales podrían aparecer mucho después de la recuperación. Desde el mal sabor alt",20-06-2021 04:10,https://www.bing.com/th?id=OVFT.5Y1-4ukg4sJvs1tuZ2HKri,Chile,Tiempo
Salud inmuniza personal de apoyo para masiva jornada de vacunación en Cortés,http://www.eldiario.hn/salud-inmuniza-personal-de-apoyo-para-masiva-jornada-de-vacunacion-en-cortes/,"San Pedro Sula. - Como parte de los preparativos de la quinta jornada de vacunación contra la covid-19 que inicia el próximo lunes para toda la población, la Secretaría de Salud inmunizó este sábado e",20-06-2021 04:40,https://www.bing.com/th?id=OVFT.u46nB9T8g0DM3pCco19yxy,Chile,El Diario
Segunda dosis de Sputnik V ahora será aplicada tres meses después de la primera,https://www.elheraldo.hn/pais/1472078-466/segunda-dosis-vacuna-rusa-sputnik-v-aplicacion-tres-meses-despues-primera-honduras,La medida fue anunciada por la Secretaría de Salud. Las autoridades pidieron a la población que recibió la vacuna rusa hacer caso omiso a la fecha indicada en sus carnés de vacunación,20-06-2021 10:47,https://www.bing.com/th?id=OVFT.nlfP0sHFqrvrbbD2qo8ajy,Chile,El Heraldo
"Vacunación COVID-19: ¿A quiénes les toca hoy, domingo?",https://tiempo.hn/vacunacion-covid-19-domingo/,Las jornadas de inmunización de los hondureños contra el COVID-19 siguen en marcha. Las autoridades sanitarias responsables de la aplicación de las vacunas anunciaron que seguirán ampliando las jornad,20-06-2021 13:50,https://www.bing.com/th?id=OVFT.QWmxExHuJ4Ia9rV6MaLOzy,Chile,Tiempo
Por COVID-19 fallece el reconocido periodista Carlos Riedel,https://hondudiario.com/covid-19/por-covid-19-fallece-el-reconocido-periodista-carlos-riedel/,"Familiares y amigos confirmaron este domingo la muerte del periodista hondureño, Carlos Riedel, por complicaciones relacionadas a la COVID-19. Desde hace varios días se informó de su problema de salud",20-06-2021 14:40,https://www.bing.com/th?id=OVFT.eX-HQ6WtKIMdt1tTmgWfFS,Chile,Hondudiario
Fallece el periodista hondureño Carlos Riedel tras secuelas por covid-19,https://www.radiohrn.hn/fallece-el-periodista-hondureno-carlos-riedel-tras-secuelas-por-covid-19,"Carlos Riedel es considerado una institución del periodismo, su muerte deja un vació en el gremio periodístico",20-06-2021 14:55,https://www.bing.com/th?id=OVFT.91E-dA7ExBcZC3cT-Amf3S,Chile,Radio HRN
"'Dios le ama', era la frase que usaba Carlos Riedel con sus invitados de programa, amigos y colegas",https://www.radiohrn.hn/dios-le-ama-era-la-frase-que-usaba-carlos-riedel-con-sus-invitados-de-programa-amigos-y-colegas,"Carlos Riedel usaba un peluquín debido a su calvicie y lo tomaba con buen humor, narró analista político Tras el fallecimiento el domingo (20.06.2021) del periodista hondureño Carlos Riedel debido a c",20-06-2021 16:56,https://www.bing.com/th?id=OVFT.opvhllgOiVWvLpQZO7c3Mi,Chile,Radio HRN
Quinta jornada de vacunación espera inmunizar a más de 418 mil hondureños contra covid-19,https://www.laprensa.hn/honduras/1472182-410/quinta-jornada-vacunacion-covid-19-san-pedro-sula-tegucigalpa,"Tegucigalpa, Honduras. Este lunes 21 de junio arranca la quinta jornada de vacunación contra la covid-19 en las dos ciudades principales del país. Autoridades de la Secretaría",20-06-2021 17:38,https://www.bing.com/th?id=OVFT.G-tFwBCFDanB11jgjKqEIi,Chile,La Prensa Chicos
Cardenal Rodríguez pregunta cuándo estará vacunado todo el país (Video),https://www.latribuna.hn/2021/06/20/cardenal-rodriguez-pregunta-cuando-estara-vacunado-todo-el-pais-video/,"Tegucigalpa, 20 jun (EFE).- El cardenal de Honduras, Óscar Andrés Rodríguez, dijo este domingo que su país está viviendo una",20-06-2021 18:42,https://www.bing.com/th?id=OVFT.Yc1NG_C1YN8eDqk_61iZcS,Chile,La Tribuna
Uruguay busca curar sequía de gol ante enturbiado Chile,https://www.elheraldo.hn/deportes/1472228-466/uruguay-busca-curar-sequ%C3%ADa-de-gol-ante-enturbiado-chile-copa-america,"CUIABÁ, BRASIL.- El equipo con más títulos de la Copa América se mide con el que ha ganado dos de las últimas tres ediciones, pero que podría acusar los efectos de un caso de indisciplina. Uruguay lle",20-06-2021 19:39,https://www.bing.com/th?id=OVFT.UqGmki7gTlGStaQrb2YqRi,Chile,El Heraldo
Guatemala añade 49 muertes más por la COVID-19 y suma 167 en cuatro días,https://proceso.hn/guatemala-anade-49-muertes-mas-por-la-covid-19-y-suma-167-en-cuatro-dias/,"Desde marzo de 2020 Guatemala suma 8,694 fallecimientos debido a la COVID-19 y también 280,507 contagios confirmados.",21-06-2021 00:54,https://www.bing.com/th?id=OVFT.jOLvcODWVVB7z8ToQEeUry,Chile,Proceso
Honduras alcanza 6.766 muertos por COVID-19 y roza los 254.000 contagios,https://www.latribuna.hn/2021/06/20/honduras-alcanza-6-766-muertos-por-covid-19-y-roza-los-254-000-contagios/,"Tegucigalpa.- Honduras sumó este domingo siete decesos por la COVID-19, hasta alcanzar los 6.766 muertos, mientras los casos confirmados del",21-06-2021 04:13,https://www.bing.com/th?id=OVFT.1H9frn1f0UKiJnEiYJxSzy,Chile,La Tribuna
Conversaciones con un padre: Bicentenario pandémico sin modelo,https://proceso.hn/conversaciones-con-un-padre-bicentenario-pandemico-sin-modelo/,"Jp Carías Chaverri Elecciones con cero propuestas no es en realidad un fenómeno nuevo en Honduras. Sin embargo, en pleno bicentenario pandémico resulta, en realidad, alarmante. No se necesita ser",21-06-2021 05:45,https://www.bing.com/th?id=OVFT.koldfbCaSDbPheh1O7vcCy,Chile,Proceso
