name,url,description,datePublished,imagen,pais,Fuente
Honduras cerca de alcanzar los 199 mil contagios y las 5 mil muertes por coronavirus,https://hondudiario.com/2021/04/16/honduras-cerca-de-alcanzar-los-199-mil-contagios-y-las-5-mil-muertes-por-coronavirus/,"El Sistema Nacional de Gestión de Riesgos (Sinager), confirmó en las últimas horas 761 nuevos casos de Covid-19, sumando así un total de 198,975 contagios a nivel nacional. De 3,056 pruebas PCR proces",16-04-2021 15:23,https://www.bing.com/th?id=OVFT.O4BJ07mzcJINmbc5ftO5XS,Chile,Hondudiario
"Varias cepas de la COVID-19 ya podrían estar circulando en Honduras, advierte epidemióloga",https://proceso.hn/varias-cepas-de-la-covid-19-ya-podrian-estar-circulando-en-honduras-advierte-epidemiologa/,"Tegucigalpa – En Honduras, país que no tiene capacidad para identificar las nuevas variantes del coronavirus SARS-CoV-2, ya podrían estar circulando varias cepas, advirtió este",16-04-2021 16:15,https://www.bing.com/th?id=OVFT.U-u6PDx6qWt3s9BmAH7wey,Chile,Proceso
"Es oficial, América solicitó un fuerte castigo para Yustin Arboleda por la lesión de Chucho López",https://www.diez.hn/liganacionaldehonduras/1457278-498/america-oficial-solicitud-concacaf-fuerte-castigo-yustin-arboleda-cuatro-meses-lesion-chucho-lopez,"Santiago Baños, presidente deportivo del América, explicó que exigieron a Concacaf una sanción para Yustin Arboleda y el árbitro del partido.",16-04-2021 16:45,https://www.bing.com/th?id=OVFT.LWwRRRUZL0-hQU0Qn__ZNi,Chile,diez.hn
EPIDEMIÓLOGA SILVIA PORTILLO ADVIERTE QUE VARIAS CEPAS DE LA COVID-19 YA PODRÍAN CIRCULAR EN HONDURAS,https://ultimahora.hn/epidemiologa-silvia-portillo-advierte-que-varias-cepas-de-la-covid-19-ya-podrian-circular-en-honduras/,"Según la patóloga y epidemióloga, Silvia Portillo, en el país ya podrían estar circulando varias cepas de covid pero Honduras, no tiene capacidad para identificar estas nuevas variantes. La",16-04-2021 18:03,https://www.bing.com/th?id=OVFT.5mni-jr7P6r0QgE3-nij8C,Chile,Ultima Hora
Liga Nacional de Honduras analiza compra de vacunas de covid-19 para futbolistas y sus familiares,https://www.diez.hn/liganacionaldehonduras/1457308-498/liga-nacional-compra-vacunas-covid-19-futbolistas,"El tema de adquisición de las dosis ha sido considerado en las últimas reuniones de los clubes junto a la Liga Nacional, aunque hasta la fecha no hay nada claro.",16-04-2021 18:21,https://www.bing.com/th?id=OVFT.5Q-dUcEGVoj4jTHXaXdvEy,Chile,diez.hn
BM dará 70 millones de dólares a El Salvador y Honduras para comprar vacunas,https://www.latribuna.hn/2021/04/16/bm-dara-70-millones-de-dolares-a-el-salvador-y-honduras-para-comprar-vacunas/,San Salvador.- El Banco Mundial (BM) aprobó un monto de 70 millones de dólares para El Salvador y Honduras para,16-04-2021 19:27,https://www.bing.com/th?id=OVFT.j-DUISZNeiQ9uRglvqWJZC,Chile,La Tribuna
Suspenden clases semi presenciales por el covid-19 en Choluteca,https://www.elheraldo.hn/pais/1457402-466/suspenden-clases-semi-presenciales-por-el-covid-19-en-choluteca,"El director municipal de educación, Fidel Bardales, manifestó que esta determinación es nada más preventiva por las altas incidencias que hay, pero que no hay contagios en los escolares",16-04-2021 19:47,https://www.bing.com/th?id=OVFT.0ZK8iAtn5F0ga8_myBYGWy,Chile,El Heraldo
Ya llegó el primer lote de vacunas rusas Sputnik-V contra el Covid-19 a Honduras,https://www.vtv.com.hn/noticia/ya-llego-el-primer-lote-de-vacunas-rusas-sputnik-v-contra-el-covid-19-a-honduras/,"El primer lote de las vacunas Sputnik-V para combatir el virus del Covid-19, llegó a Honduras en un vuelo comercial que partió de Rusia hacía el aeropuerto Ramón Villeda Morales en Lima Cortés a las 1",16-04-2021 19:55,https://www.bing.com/th?id=OVFT.765i-NI0XYbkrGyH0X0Jii,Chile,VTV
"BCH: Pese al COVID-19, remesas enviadas a Honduras aumentaron 29 %",https://tiempo.hn/bch-covid-19-remesas-enviadas-a-honduras-29/,El presidente del BCH detalló que las remesas enviadas a Honduras presentan un alza de 29 % respecto al mismo período de 2020.,16-04-2021 20:53,https://www.bing.com/th?id=OVFT.yQXePbHUpTfW25mW56G9mi,Chile,Tiempo
2.9 millones de hondureños en inseguridad alimentaria,https://www.elheraldo.hn/pais/1457434-466/hondurenos-en-inseguridad-alimentaria,"Covid-19 y Eta y Iota duplicaron de 7% a 15% la migración, significa seis millones de personas en CA con intención de migrar",16-04-2021 21:34,https://www.bing.com/th?id=OVFT.zoaYazG8s51zKxXiA0m5qC,Chile,El Heraldo
Falta de ventilación impide abrir el tercer triaje en San Pedro Sula,https://www.laprensa.hn/sanpedro/1457445-410/falta-de-ventilacion-impide-abrir-el-tercer-triaje-en-san-pedro-sula-honduras,"El triaje que funcionará en el bulevar del norte en San Pedro Sula aún no se ha habilitado para la atención de pacientes con síntomas de covid-19 por la falta de climatización. Julio Quiñónez, directo",16-04-2021 22:58,https://www.bing.com/th?id=OVFT.BF_34oC74UbMISwCWC37Ii,Chile,La Prensa Chicos
El BM dará 70 millones de dólares a El Salvador y Honduras para comprar vacunas,https://www.radiohrn.hn/el-bm-dara-70-millones-de-dolares-a-el-salvador-y-honduras-para-comprar-vacunas,"El nuevo préstamo amplía el ""Proyecto de respuesta a la emergencia covid-19 en El Salvador"" de 20 millones de dólares, aprobado en abril de 2020 para fortalecer el sistema nacional de salud pública",17-04-2021 00:08,https://www.bing.com/th?id=OVFT.rzEJZ2diwkTsbicTcRWOay,Chile,Radio HRN
"Gobierno de Honduras y USAID, inauguran nuevo laboratorio de virología en La Ceiba",https://www.vtv.com.hn/noticia/gobierno-de-honduras-y-usaid-inauguran-nuevo-laboratorio-de-virologia-en-la-ceiba/,"Antes la alta demanda de pruebas para detectar el Covid-19, el gobierno de Honduras y la Agencia de los Estados Unidos apara el Desarrollo Internacional, inauguraron un nuevo laboratorio de virología,",17-04-2021 01:52,https://www.bing.com/th?id=OVFT.i8tSGu-ydYZ__5qcTenmGy,Chile,VTV
Hospital de Gracias llega a su capacidad máxima de atención,https://www.laprensa.hn/honduras/1457452-410/hospital-de-gracias-llega-a-su-capacidad-maxima-de-atencion-honduras,"Gracias, Lempira. Las autoridades del principal centro asistencial de Lempira anunciaron que en las últimas horas llegó a su capacidad máxima de atención para pacientes con co",17-04-2021 02:15,https://www.bing.com/th?id=OVFT.oz1Qz6cnqBpsCCbRJMgG3i,Chile,La Prensa Chicos
"Honduras suma 74,125 casos positivos de covid-19 de enero al 16 de abril de 2021",https://www.radiohrn.hn/honduras-suma-74125-casos-positivos-de-covid-19-de-enero-al-16-de-abril-de-2021,Honduras reportó el viernes (16.04.2021) a través del Sistema Nacional de Gestión de Riesgos (Sinager) un acumulado de casos positivos de covid-19 desde el inicio de la pandemia de 199 mil 682. Este v,17-04-2021 04:20,https://www.bing.com/th?id=OVFT.ZdrgbMgW6hzZH-clixzQsy,Chile,Radio HRN
Honduras supera los 199.000 contagios y los 4.900 muertos por la covid-19,https://www.latribuna.hn/2021/04/16/honduras-supera-los-199-000-contagios-y-los-4-900-muertos-por-la-covid-19/,La cifra de contagios por el coronavirus SARS-CoV-2 en Honduras ascendió este viernes a 199.682 y los muertos a 4.934,17-04-2021 04:56,https://www.bing.com/th?id=OVFT.86ezTZ0T_4dYdeuBlJhO1S,Chile,La Tribuna
"Honduras se acerca a los 200 mil contagios y 5 mil muertes por COVID, según Sinager",https://hondudiario.com/2021/04/17/honduras-se-acerca-a-los-200-mil-contagios-y-5-mil-muertes-por-covid-segun-sinager/,"***Hasta ahora reporta 76,235 recuperados, 4,934 muertos y 1,151 hospitalizados. El Sistema Nacional de Gestión de Riesgo (Sinager), informó en las ultimas horas, que los casos de COVID-19 en Honduras",17-04-2021 15:00,https://www.bing.com/th?id=OVFT.Orqkqux9E3I1_gsauoWl6S,Chile,Hondudiario
Reportan seis decesos con sospecha de COVID-19 en hospitales capitalinos,https://proceso.hn/reportan-seis-decesos-con-sospecha-de-covid-19-en-hospitales-capitalinos/,"Al menos seis personas perdieron la vida en las últimas 24 horas, bajo sospecha de la COVID-19 en hospitales de Tegucigalpa, confirmaron fuentes hospitalarias.",17-04-2021 17:06,https://www.bing.com/th?id=OVFT.HiG2hgjmm2oPkT7ufoYNMy,Chile,Proceso
"FALLECE POR COVID-19 ESPERANZA ZELAYA, ENFERMERA DEL HOSPITAL «EL TÓRAX”, MIENTRAS ESTE CENTRO ESTA ABARROTADO Y BUSCA AMPLIAR CUPOS",https://ultimahora.hn/fallece-por-covid-19-esperanza-zelaya-enfermera-del-hospital-el-torax-mientras-este-centro-esta-abarrotado-y-busca-ampliar-cupos/,"Profesionales de la salud del Instituto Nacional Cardiopulmonar (Hospital del Tórax) le dan el último adiós a Esperanza Zelaya, enfermera del Hospital tras fallecer por Covid-19. Compañeros entre",17-04-2021 18:30,https://www.bing.com/th?id=OVFT.QQTbnaEsYh9JYHDbCMJO8i,Chile,Ultima Hora
Epidemióloga explica por qué los pacientes COVID-19 están muriendo más rápido,https://tiempo.hn/epidemiologa-pacientes-covid-19-muerte-rapida/,La doctora Portillo dijo que en los últimos días los pacientes con COVID-19 están muriendo más rápido que en el inicio de la pandemia.,17-04-2021 19:35,https://www.bing.com/th?id=OVFT.EGmxbwH3xB75rC_5RYqiVi,Chile,Tiempo
