name,url,description,datePublished,imagen,pais,Fuente
'Honduras pagará las consecuencias después de Semana Santa con casos covid' advierte infectólogo,https://www.radiohrn.hn/honduras-pagara-las-consecuencias-despues-de-semana-santa-con-casos-covid-advierte-infectologo,"El infectólogo hondureño, Tito Alvarado, advirtió el jueves (25.03.2021) que Honduras pagará las consecuencias con una masiva y mortal cifra de contagios del covid-19, tras conceder feriados de Semana",25-03-2021 00:52,https://www.bing.com/th?id=OVFT.urEpBZKOGySulhgT42nnCS,Chile,Radio HRN
"Honduras alcanza 184,821 contagios y supera las 4,500 muertes por coronavirus",https://hondudiario.com/2021/03/24/honduras-alcanza-184821-contagios-y-supera-las-4500-muertes-por-coronavirus/,"El Sistema Nacional de Gestión de Riesgos (Sinager), confirmó este miércoles 790 nuevos casos de Covid-19, sumando así un total de 184,821 contagios a nivel nacional. De 2,827 pruebas PCR procesadas p",25-03-2021 03:55,https://www.bing.com/th?id=OVFT._6s1T0zaPpGlc5dHbF87my,Chile,Hondudiario
ESTUDIANTES DE 5 MUNICIPIOS DE COPÁN RECIBEN TABLETAS ELECTRÓNICAS,https://ultimahora.hn/estudiantes-de-5-municipios-de-copan-reciben-tabletas-electronicas/,"El programa presidencial Transformación Educativa Digital, impulsado por el Gobierno del presidente Juan Orlando Hernández, entregó este miércoles tabletas electrónicas a unos 200 estudiantes de",25-03-2021 14:08,https://www.bing.com/th?id=OVFT.MH5yKjSZLLn1wkhqYzFlIS,Chile,Ultima Hora
"Alerta roja por COVID-19: ¿Qué dígitos circulan hoy, jueves?",https://tiempo.hn/honduras-covid-19-que-digitos-circulan-hoy-jueves/,La Secretaría de Seguridad determinó qué dígitos circulan hoy en toda Honduras y sobre las medidas de atención en comercios.,25-03-2021 14:08,https://www.bing.com/th?id=OVFT.TSknDU32X9yZMsQVqJ4gAS,Chile,Tiempo
Captarán casos de covid-19 en centros turísticos durante la Semana Santa,https://www.elheraldo.hn/pais/1452229-466/feriado-captaran-casos-covid-semana-santa-honduras,"TEGUCIGALPA, HONDURAS.-Una búsqueda de casos positivos de covid-19 se hará en los diferentes destinos turísticos durante el asueto de Semana Santa. Con esa medida se busca captar temprano los casos qu",25-03-2021 14:30,https://www.bing.com/th?id=OVFT.FgqCkmiZRgv3hivLjPftxi,Chile,El Heraldo
"COVID-19: Tras casi dos meses interna, fallece reconocida pastora en la capital",https://tiempo.hn/pastora-fallece-por-covid-19-en-la-capital/,"Durante dos meses, la reconocida pastora Olga Linares de Vijil permaneció en la sala de Cuidados Intensivos del Hospital San Felipe.",25-03-2021 14:50,https://www.bing.com/th?id=OVFT.ZU0Ru4Y1hCcIrmIJJhdzRy,Chile,Tiempo
Fallece médico grave por COVID-19 cuando era trasladado desde Puerto Lempira,https://www.latribuna.hn/2021/03/25/fallece-medico-grave-por-covid-19-cuando-era-trasladado-en-avioneta-desde-puerto-lempira/,"El médico Daniel Walter Willy de 70 años de edad, murió por COVID-19 este jueves mientras era trasladado en una",25-03-2021 15:36,https://www.bing.com/th?id=OVFT.yZGGmp8_VT0c93IEL8D-VC,Chile,La Tribuna
Fallece médico con COVID-19 cuando era trasladado vía aérea a Tegucigalpa desde Puerto Lempira,https://proceso.hn/fallece-medico-con-covid-19-cuando-era-trasladado-via-aerea-a-tegucigalpa-desde-puerto-lempira/,"Tegucigalpa- Esta mañana lamentablemente falleció un médico que sufría de insuficiencia respiratoria por el Covid-19 cuando era trasladado desde Puerto Lempira, Gracias a Dios, Caribe de Honduras. La noticia fue confirmada por el director del hospital ...",25-03-2021 15:57,https://www.bing.com/th?id=OVFT.cU-CKCe_AGE_0vND8JrgYi,Chile,Proceso
Muere el doctor Walter Willy durante traslado desde Puerto Lempira a Tegucigalpa,https://www.elheraldo.hn/pais/1452311-466/honduras-muere-doctor-walter-willy-traslado-puerto-lempira,"Willy tenía severas complicaciones a causa del covid-19, por lo que su familia pidió que se realizara el traslado, pero mientras sobrevolaban el departamento de Olancho el galeno falleció, según detal",25-03-2021 16:47,https://www.bing.com/th?id=OVFT.JRriFCJmeHl5p--GFtd6oi,Chile,El Heraldo
FALLECE OTRO MÉDICO POR COVID-19 CUANDO ERA TRASLADADO DE GRACIAS A DIOS A TEGUCIGALPA,https://ultimahora.hn/fallece-otro-medico-por-covid-19-cuando-era-trasladado-de-gracias-a-dios-a-tegucigalpa/,"El médico Daniel Walter Willy de 70 años de edad, murió por COVID-19 este jueves mientras era trasladado en una avioneta de la Fuerza Aérea Hondureña (FAH) desde el departamento de Gracias a Dios a Tegucigalpa, capital de Honduras. La vocera del Siste ...",25-03-2021 16:50,https://www.bing.com/th?id=OVFT.CsMMUcTrQ7ZZNkQhr7LsTy,Chile,Ultima Hora
Arrancan las inscripciones para el Rey del Fifón 2021 que viene cargado de mucha emoción y sorpresas,https://www.diez.hn/liganacionaldehonduras/1452378-498/arrancan-inscripciones-fifon-2021-san-pedro-sula-mall-multiplaza-premios,"Los actuales monarcas del Fifón en Honduras El evento está de regreso tras el parón del 2020 por la pandemia de covid-19. El actual campeón en San Pedro Sula es Mauricio Salomón, quien venció 3-1 en la final a Carlos Tábora. En Tegucigalpa el actual ...",25-03-2021 17:26,https://www.bing.com/th?id=OVFT.nJ-5ziHO497w7bjNMKD7bi,Chile,diez.hn
Inauguran tercer triaje en SPS,https://www.vtv.com.hn/noticia/inauguran-tercer-triaje-en-sps/,"Previo a la Semana Santa y para enfrentar una posible tercera ola de contagios de Covid-19, la secretaría de Salud inaugurará ... en funcionamiento en el Colegio de Ingenieros Civiles de Honduras y en el Instituto Nacional de Formación Profesional ...",25-03-2021 18:25,https://www.bing.com/th?id=OVFT.YJBftUdeyiuB9nMyfw-FWC,Chile,VTV
Médico enfermo con covid de La Mosquitia no soportó traslado a la capital,https://www.laprensa.hn/honduras/1452474-410/medico-enfermo-covid-la-mosquitia-no-soporto-traslado-capital-honduras,"Otro médico perdió la batalla contra el covid-19 en Honduras.La víctima es Daniel Walter Willy (de 70 años de edad), quien fue trasladado de Puerto Lempira, Gracias a Dios, hacia la capital por la Fuerza Aérea Hondureña (FAH) en un avión ambulancia.",25-03-2021 22:00,https://www.bing.com/th?id=OVFT.cUCK432__AHwOIY72FqEsS,Chile,La Prensa Chicos
"Honduras suma 663 nuevos casos de coronavirus; la cifra de contagios se eleva a 185,484",https://www.radiohrn.hn/honduras-suma-663-nuevos-casos-de-coronavirus-la-cifra-de-contagios-se-eleva-a-185484,"Las autoridades de Sinager confirmaron el fallecimiento de 21 personas más, elevándose la cifra de muerto a cuatro mil 527",25-03-2021 22:35,https://www.bing.com/th?id=OVFT.mxYffIJ8wpViY1IKAiSZcy,Chile,Radio HRN
HONDURAS / GOBIERNO NIEGA MÁS PLAZO A BANCOS PARA RENEGOCIAR DEUDAS CON CLIENTES,http://www.web.ellibertador.hn/index.php/noticias/nacionales/2803-honduras-gobierno-niega-mas-plazo-a-bancos-para-renegociar-deudas-con-clientes,"En una misiva enviada al vicepresidente de los banqueros, la Comisión de Bancos, lo informa que no habrá una tercera prórroga para que renegocien su mora. El problema radica en que los créditos que ca",25-03-2021 23:38,https://www.bing.com/th?id=OVFT.BmLvZ4wtjoEGV_A80q0uZy,Chile,El Libertador
"Honduras ya supera los 185 mil casos de COVID-19, al confirmarse 663 nuevos contagios",https://proceso.hn/honduras-ya-supera-los-185-mil-casos-de-covid-19-al-confirmarse-663-nuevos-contagios/,"Tegucigalpa – Los casos de COVID-19 en Honduras se elevaron este jueves a 185 mil 484 desde que se declaró la emergencia sanitaria por la pandemia con la confirmación de otros 663 contagios, informó e",26-03-2021 03:35,https://www.bing.com/th?id=OVFT.f45X8uv67C2etCq_IauXpi,Chile,Proceso
"Coronavirus en Honduras ya deja 185,484 contagios y 4,527 muertes",https://hondudiario.com/2021/03/25/coronavirus-en-honduras-ya-deja-185484-contagios-y-4527-muertes/,"El Sistema Nacional de Gestión de Riesgos (Sinager), confirmó este jueves 663 nuevos casos de Covid-19, sumando así un total de 185,484 contagios a nivel nacional. De 2,309 pruebas PCR procesadas por",26-03-2021 04:18,https://www.bing.com/th?id=OVFT.mxias5hzwtOdxHrV_FDSBC,Chile,Hondudiario
"Los casos de COVID-19 ascienden a 185,484 con 663 nuevos contagios",https://www.latribuna.hn/2021/03/25/los-casos-de-covid-19-ascienden-a-185484-con-663-nuevos-contagios/,"Los casos de COVID-19 en Honduras se elevaron a 185,484 desde el inicio de la pandemia con la confirmación de otros 663 contagios, mientras que los pacientes recuperados aumentaron a 70,427, informó e",26-03-2021 05:20,https://www.bing.com/th?id=OVFT.r9XMCBpWQmBru6cpEnKP7S,Chile,La Tribuna
Piden redoblar protección en Semana Santa por el covid-19,https://www.laprensa.hn/sanpedro/1452419-410/piden-redoblar-proteccion-semana-santa-covid-19-honduras,"Diario LA PRENSA, la Asociación Hondureña de Maquiladores y Gildan incentivan el uso correcto de la mascarilla.",26-03-2021 05:53,https://www.bing.com/th?id=OVFT.8hAr0pmOxiJf0RoTX0TB0i,Chile,La Prensa Chicos
