name,url,description,datePublished,imagen,pais,Fuente
"Proveniente de México retornan al país 136 personas, entre ellas 50 niños no acompañados",http://www.eldiario.hn/proveniente-de-mexico-retornan-al-pais-136-personas-entre-ellas-50-ninos-no-acompanados/,"San Pedro Sula. - El Centro de Atención al Migrante Retornado de San Pedro Sula (CAMR-SPS) recibió este viernes un vuelo proveniente de México con 136 personas, entre ellas 50 Niños No Acompañados (NN",01-05-2021 02:25,https://www.bing.com/th?id=OVFT._tm4mbkKzIosEGbxw8Y0RC,Chile,El Diario
Honduras: Trabajadores piden que la vacuna sea gratuita y mejoras salariales,https://www.elheraldo.hn/tegucigalpa/1460762-466/dia-trabajador-honduras,"En el marco de la convocatoria para la tradicional marcha de los obreros, que este año es voluntaria, llaman a sostener los empleos. Unos 20 sindicatos no participarán de manera presencial",01-05-2021 08:13,https://www.bing.com/th?id=OVFT.w5EdDEw407r0CKJwIT8hay,Chile,El Heraldo
Salud asegura que tiene listo el plan para la jornada de vacunación,https://www.elheraldo.hn/pais/1460783-466/vacuna-coronavirus-honduras,Las vacunas que sí estarían arribando entre el lunes y martes de la próxima semana son las donadas por el mecanismo Covax-GAVI,01-05-2021 08:32,https://www.bing.com/th?id=OVFT.9CHj6pcY20ljIbTyyelIaC,Chile,El Heraldo
"Honduras suma 1,257 nuevos casos de Covid-19",https://hondudiario.com/2021/05/01/honduras-suma-1257-nuevos-casos-de-covid-19/,"El Sistema Nacional de Gestión de Riesgos (Sinager), informó que Honduras acumuló 212,333 casos positivos de coronavirus, tras reportarse 1,257 nuevos contagios a nivel nacional. Los nuevos pacientes",01-05-2021 14:11,https://www.bing.com/th?id=OVFT.q3nuka1c5AMmQSLyRYbo-S,Chile,Hondudiario
Según científico hondureño: Nueva variante de COVID-19 en el país podría ser brasileña,https://www.latribuna.hn/2021/04/30/segun-cientifico-hondureno-nueva-variante-de-covid-19-en-el-pais-podria-ser-brasilena/,"La nueva variante del COVID-19 que circula en el país, desde el punto de vista epidemiológico, es más probable que",01-05-2021 16:34,https://www.bing.com/th?id=OVFT.ztJs8BdY_pUkc2m59VToOi,Chile,La Tribuna
Día del Trabajador en Honduras,https://www.vtv.com.hn/noticia/dia-del-trabajo-en-honduras/,"Con manifestaciones pacíficas se ha celebrado el Día del Trabajador en Tegucigalpa y en Honduras. Las distintas organizaciones obreras, campesinas y también de grupos étnicos han desfilado por las pri",01-05-2021 16:59,https://www.bing.com/th?id=OVFT.emKd67xzgpEghU1t2uJtbi,Chile,VTV
"Falleció ex preparador de porteros de la Selección Nacional, Roy Posas",https://www.diariomas.hn/2021/05/01/fallecio-ex-preparador-fisico-de-la-seleccion-roy-posas/,"Fuentes cercanas a la familia de Roy Orlando Posas, ex portero de Marathon y Atlético Indio, informaron que falleció esta mañana en el Seguro",01-05-2021 19:52,https://www.bing.com/th?id=OVFT.5_r7-7TzFsVSJdTTl-5iiS,Chile,Mas
EN VIVO: Olimpia y Real España llegan al estadio Olímpico para enfrentarse por la final de grupos,https://www.diez.hn/liganacionaldehonduras/1460794-498/real-espana-olimpia-en-vivo-online-transmision-liga-nacional-honduras-pedro-troglio,"4:15 PM: DIEZ ha confirmado el 11 del Olimpia, Edrick Menjívar aparece bajo los tres palos. Línea de cuatro con Maylor Núñez como carrilero derecho, Elvin Casildo y Jhony Leverón en la zaga central y",01-05-2021 22:31,https://www.bing.com/th?id=OVFT.x56UKTwR39MonfNpG1WKJy,Chile,diez.hn
COVID-19 en niños: ¿cuántos menores han muerto por el virus en Honduras?,https://tiempo.hn/menores-muertos-por-covid-19-honduras/,"TEGUCIGALPA, HONDURAS. Según el Sistema Nacional de Gestión de Riesgos (Sinager), en Honduras, hasta el jueves 29 de abril, 106 menores habrían fallecido a causa del covid-17, pero el con el deceso de",02-05-2021 02:38,https://www.bing.com/th?id=OVFT.J6cIykwM8dSpOh9bpZ8IQy,Chile,Tiempo
"Sinager reporta un total de 213,167 casos de covid-19 en Honduras",https://www.radiohrn.hn/sinager-reporta-un-total-de-213167-casos-de-covid-19-en-honduras,"Según reporte del Sinager para el 1 de mayo de 2021, en Honduras se registran un total de 213,167 casos de covid-19. El informe detalla que se confirmaron 834 nuevos casos del virus que sigue enlutand",02-05-2021 03:19,https://www.bing.com/th?id=OVFT.Q4JR_q-vGXQT6yFClSKebi,Chile,Radio HRN
COVID-19| Hay más de 212 mil casos: ¿cuál ha sido el mes con más contagios?,https://tiempo.hn/mes-casos-covid-honduras-212-mil-casos/,"TEGUCIGALPA, HONDURAS. El mes de enero del 2021 es el mes con mayor número de contagios y fallecimientos por covid-19, según el investigador Efraín Farach. Asimismo, informó que los casos aumentaron u",02-05-2021 05:16,https://www.bing.com/th?id=OVFT.X0nqbu-SEIWZzogKhZ9Qwy,Chile,Tiempo
Honduras supera las cinco mil 300 muertes por Covid-19,https://www.laprensa.hn/honduras/1461016-410/honduras-muertos-covid-contagios-covid-pandemia-coronavirus,"Honduras sumó este sábado 834 nuevos contagios de la covid-19 y registró 37 muertes más por la enfermedad, lo que eleva a 213.167 contagios confirmados y 5.318 los fallecidos, informaron las autoridad",02-05-2021 10:03,https://www.bing.com/th?id=OVFT.jj8_DJ-DkY-ZYfE2v6YlBi,Chile,La Prensa Chicos
Fallece por Covid-19 esposa del pastor y expositor Arturo López Malumbres,https://www.laprensa.hn/honduras/1461023-410/muere-covid-esposa-arturo-lopez-malumbres-expositor-partor-honduras-covid-olga-carolina-villalobos,"El virus atacó al matrimonio y a sus dos hijas, situación que los mantuvo en una constante lucha por varias semanas.",02-05-2021 10:51,https://www.bing.com/th?id=OVFT.t72O_JlnxIiuwjZqvZRn-y,Chile,La Prensa Chicos
Honduras acumula 5.318 muertes y 213.167 casos de la Covid-19,https://hondudiario.com/2021/05/02/honduras-acumula-5-318-muertes-y-213-167-casos-de-la-covid-19/,"El Sistema Nacional de Gestión de Riesgos (Sinager), informó que los casos de COVID-19 en Honduras ascendieron a 213, 167. Para diagnosticar los nuevos casos, el Laboratorio Nacional de Virología proc",02-05-2021 15:27,https://www.bing.com/th?id=OVFT.xD2e4vhJ8o6n84XQvxlXDC,Chile,Hondudiario
Reportan nueve decesos con sospecha de la COVID-19 en hospitales de la capital,https://proceso.hn/reportan-nueve-decesos-con-sospecha-de-la-covid-19-en-hospitales-de-la-capital/,"Al menos nueve personas perdieron la vida en las últimas 24 horas, bajo sospecha de la COVID-19 en hospitales de Tegucigalpa, informaron este domingo fuentes de los centros asistenciales.",02-05-2021 16:59,https://www.bing.com/th?id=OVFT.Fa4OONLb6IkAocKb4uB4wC,Chile,Proceso
Cardenal hondureño critica a quienes buscan enriquecerse en medio de pandemia,https://www.radiohrn.hn/cardenal-hondureno-critica-a-quienes-buscan-enriquecerse-en-medio-de-pandemia,"El cardenal Rodríguez criticó a quienes se han aprovechado de la pandemia del covid-19 para ""enriquecerse"" El cardenal de Honduras, Óscar Andrés Rodríguez, criticó este domingo la codicia, el robo y a",02-05-2021 19:12,https://www.bing.com/th?id=OVFT.08k7vNwWXJJU4M8WsP1ffi,Chile,Radio HRN
Unos ocho mil niños han dado positivo al COVID-19 en los últimos meses en Honduras,https://proceso.hn/unos-ocho-mil-ninos-han-dado-positivo-al-covid-19-en-los-ultimos-meses-en-honduras/,"El coordinador de Vigilancia de virus y otras enfermedades de la Secretaría de Salud de la Secretaría de Salud, Homer Mejía reveló que al menos unos ocho mil niños se han contagiado con el virus",02-05-2021 21:06,https://www.bing.com/th?id=OVFT.R8tCDaEEgIjOe80g-nNAfy,Chile,Proceso
