name,url,description,datePublished,imagen,pais,Fuente
Gobernador pedirá extensión de sus poderes de emergencia de COVID-19,https://www.elsolnews.com/2021/07/07/gobernador-pedira-extension-de-sus-poderes-de-emergencia-de-covid-19/,"El Gobernador, que ha operado con mayores poderes desde marzo pasado, esbozó algunas razones para mantener sus poderes de emergencia en su lugar. Señaló la flexibilidad necesaria para administrar un l",07-07-2021 19:56,https://www.bing.com/th?id=OVFT.i1TXN8zJHpik2iCaiqz7VS,Chile,El Sol News
Honduras ahora sufre dos bajas por COVID-19,https://www.msn.com/es-us/deportes/other/honduras-ahora-sufre-dos-bajas-por-covid-19/ar-AAMgA5O,Las pruebas protocolarias de CONCACAF arrojaron positivos por coronavirus de Edwin Solano y Carlos Fernández; estos no podrán jugar el domingo ante Panamá.,17-07-2021 16:15,https://www.bing.com/th?id=OVFT.b3T6GUmfqbBA-eGmYEQrXC,Chile,MSN
Llamado de Kevin López fue por cambio en el reglamento de la Copa Oro,https://www.diariomas.hn/2021/07/19/llamado-de-kevin-lopez-fue-por-cambio-en-el-reglamento-de-la-copa-oro/,La Concacaf anunció que los equipos que avancen a la fase eliminatoria de la Copa Oro 2021 tendrán la oportunidad de realizar cambios médicos en su lista de 23 jugadores. Esto se debe principalmente a,19-07-2021 18:30,https://www.bing.com/th?id=OVFT.WY7BulbTxPEgvpYrvfIMZS,Chile,Mas
Este día inicia vacunación de más de un millón de hondureños con segundas dosis,http://www.elsoldehonduras.com/salud/este-dia-inicia-vacunacion-de-mas-de-un-millon-de-hondurenos-con-segundas-dosis/,"Ampliando la quinta campaña de vacunación contra la covid-19, la Secretaría de Salud realizará desde mañana y hasta el próximo 4 de agosto la aplicación de la segunda dosis de las vacunas de Pfizer y",19-07-2021 19:33,https://www.bing.com/th?id=OVFT.N1MSW-TTmWRyAQTUtqOAwy,Chile,El Sol de Honduras
Falta de cifras oficiales deslumbra rumbo de pandemia en Honduras,https://proceso.hn/falta-de-cifras-oficiales-deslumbra-rumbo-de-pandemia-en-honduras/,"La falta de datos oficiales desde la noche del jueves deslumbra el rumbo de la pandemia en Honduras, es una de las principales conclusiones a la que han llegado expertos médicos este lunes.",19-07-2021 19:39,https://www.bing.com/th?id=OVFT.MShPdnzqbnATHC4i0Ebi5C,Chile,Proceso
Grave situación de hospitales desbordados por COVID-19 en el país,https://hondudiario.com/covid-19/grave-situacion-de-hospitales-desbordados-por-covid-19-en-el-pais/,"La presidenta del Colegio Médico de Honduras (CMH), Suyapa Figueroa, lamentó que los hospitales hondureños sigan desbordados por COVID-19, lo que ocasiona que muchos pacientes hondureños se estén mane",19-07-2021 19:46,https://www.bing.com/th?id=OVFT.V3AI3g5tVL3AJYL0tk_85y,Chile,Hondudiario
Aumenta en 30 % demanda de ataúdes en Honduras a causa de la pandemia,https://tiempo.hn/aumenta-demanda-de-ataudes-honduras/,La industria funeraria reporta un aumento del 30 % en consumos de ataúdes en Honduras a causa de decesos por la COVID-19.,19-07-2021 20:00,https://www.bing.com/th?id=OVFT.P76PeWEUzee_9pTn8AN_MC,Chile,Tiempo
Honduras recibirá esta semana 1.5 millones de vacunas bajo el mecanismo Covax,https://www.radiohrn.hn/honduras-recibira-esta-semana-1-5-millones-de-vacunas-bajo-el-mecanismo-covax,"Desde febrero, el 13 % de la población hondureña, más 1.2 millones, ha recibido al menos una dosis, frente al 0.8 % que ya cuenta con la pauta completa",19-07-2021 21:01,https://www.bing.com/th?id=OVFT.F5UgMvUamYyW5tJtbyuXty,Chile,Radio HRN
"Ihss inoculará a 20,000 docentes con la primera dosis contra el covid-19",https://www.laprensa.hn/honduras/1479122-410/ihss-secretaria-salud-educacion-inoculacion-docentes-pandemia-primera-dosis-honduras,"La aplicación de la dosis se desarrollará de manera escalonada en nueve departamentos del país. Tegucigalpa, Honduras. Este día inició la vacunación contra el covid-19 de 20,000 docentes afiliados al",19-07-2021 21:13,https://www.bing.com/th?id=OVFT.O8M0qEmbDUyfsnv9r8-W8S,Chile,La Prensa Chicos
INICIA APLICACIÓN DE SEGUNDAS DOSIS DE PFIZER Y MODERNA A MÁS DE UN MILLÓN DE HONDUREÑOS,https://ultimahora.hn/inicia-aplicacion-de-segundas-dosis-de-pfizer-y-moderna-a-mas-de-un-millon-de-hondurenos/,"-Capitalinos se sienten más tranquilos y seguros al completar ciclo de vacunación. -Hay suficientes vacunas para las segundas dosis, afirma jefe de Región Metropolitana de Salud del Distrito",19-07-2021 22:03,https://www.bing.com/th?id=OVFT.0ORdyJuKzZpgKwGuW1w7DC,Chile,Ultima Hora
Esperan que por fin se agilice la vacunación en Honduras,https://www.laprensa.hn/honduras/1479245-410/esperan-que-por-fin-se-agilice-la-vacunaci%C3%B3n-en-honduras,"Tegucigalpa, Honduras. Más vacunas contra el covid-19 estarán llegando al país a través del Mecanismo Covax, que es liderado por la Organización Mundial de la Salud (OMS). Lu",19-07-2021 23:03,https://www.bing.com/th?id=OVFT.KTuvfFiF2P-JrrwoL9WRky,Chile,La Prensa Chicos
“Honduras es un equipo muy completo”: DT de Qatar,https://www.diariomas.hn/2021/07/19/honduras-es-un-equipo-muy-completo-dt-de-qatar/,"El técnico de la selección de Qatar, el español Félix Sánchez, habló en la previa del juego ante Honduras donde buscan avanzar a cuartos de final de la Copa Oro y en sus declaraciones tuvo muchos elog",19-07-2021 23:50,https://www.bing.com/th?id=OVFT.eWIVSoRJTVeLuwdKuiru3C,Chile,Mas
"DT de Qatar Félix Sánchez sobre Honduras: ""No pierden potencial sin Alberth Elis;",https://www.diez.hn/copaoro/1479186-498/felix-sanches-opina-de-honduras-no-pierde-potencial-sin-alberth-elis,El timonel español dijo que 'esperamos un partido competitivo ante un rival que será duro para nosotros' este martes ante Honduras en la última jornada de la fase de grupos de la Copa Oro.,20-07-2021 00:50,https://www.bing.com/th?id=OVFT.YVXlfSBrsgIvOpwtXjM4GS,Chile,diez.hn
Edwin Solani y 'Muma' Fernández no viajarán a Arizona con la Selección de Honduras,https://www.diez.hn/copaoro/1479205-498/edwin-solani-muma-fernandez-seleccion-honduras-arizona-coronavirus-covid-19-copaoro,"Los futbolistas Edwin Solani Solano y Carlos ""Muma"" Fernández no podrán viajar el miércoles con la Selección de Honduras hacia la ciudad de Glendale, Arizona, donde se disputarán los cuartos de final",20-07-2021 01:43,https://www.bing.com/th?id=OVFT.6_fV6m-OVkqkwianPCMPZy,Chile,diez.hn
Urge inmunizar contra la Covid a embarazadas ante alto índice de mortalidad,https://hondudiario.com/covid-19/urge-inmunizar-contra-la-covid-a-embarazadas-ante-alto-indice-de-mortalidad/,"El jefe de pediatría del Hospital Escuela (HE), Carlos Maldonado, instó este lunes a las autoridades de Salud, que es necesario vacunar contra la Covid-19 a las mujeres en estado de gestación para evi",20-07-2021 02:10,https://www.bing.com/th?id=OVFT.AJ7QZIdDm43OMKkRK3OuRy,Chile,Hondudiario
Advierte Roberto Cosenza: la población no debe relajar las medidas de bioseguridad por la vacuna,http://www.eldiario.hn/advierte-roberto-cosenza-la-poblacion-no-debe-relajar-las-medidas-de-bioseguridad-por-la-vacuna/,"San Pedro Sula. - Las autoridades de Salud en la zona norte del país advirtieron este lunes que, debido a la vacuna contra la covid-19, la población se está relajando y no mantiene las medidas de bios",20-07-2021 02:30,https://www.bing.com/th?id=OVFT.HPrCUeosxSxwWP0UI6AArC,Chile,El Diario
Honduras refirma compromiso con la agenda 2030 y reitera llamado a la cooperación internacional para respaldar reconstrucción nacional,http://www.elsoldehonduras.com/nacionales/honduras-refirma-compromiso-con-la-agenda-2030-y-reitera-llamado-a-la-cooperacion-internacional-para-respaldar-reconstruccion-nacional/,"Honduras, a través de representantes del Gobierno, reafirmó su compromiso con el cumplimiento de los Objetivos de Desarrollo Sostenible (ODS) de la Agenda 2030 y reiteró su llamado a la cooperación in",20-07-2021 03:35,https://www.bing.com/th?id=OVFT.LXW86ERLYjDvG4ZiC6RYTi,Chile,El Sol de Honduras
Bebé de seis meses y niño de 10 años mueren por COVID-19 en Hospital María,https://tiempo.hn/bebe-nino-mueren-covid-19-hospital-maria/,"TEGUGILPA, HONDURAS.- Dos menores de edad son las nuevas víctimas del covid-19. Se trata de un bebé de seis meses y un niño de 10 años que murieron por sospechas del mortal virus en el Hospital María,",20-07-2021 04:22,https://www.bing.com/th?id=OVFT.ovNwSxZTnrXT3rZKSMI8Py,Chile,Tiempo
Tras silencio de tres días gobierno hondureño notifica 2 mil 347 nuevos casos y 55 decesos por COVID,https://proceso.hn/tras-silencio-de-tres-dias-gobierno-hondureno-notifica-2-mil-347-nuevos-casos-y-55-decesos-por-covid/,"Una mujer camina frente a un mural en el Hospital Escuela Universitario, donde son atendidas personas que se han contagiado de la covid-19, este miércoles en Tegucigalpa (Honduras). EFE/Gustavo Amador Tegucigalpa – Tras un silencio de tres días ...",20-07-2021 04:25,https://www.bing.com/th?id=OVFT.DzKw06v4DkWiw7bIzMwgqy,Chile,Proceso
Honduras suma 2.347 nuevos contagios y 55 fallecidos por la covid-19,https://www.latribuna.hn/2021/07/19/honduras-suma-2-347-nuevos-contagios-y-55-fallecidos-por-la-covid-19/,"Honduras sumó 2.347 nuevos casos y 55 fallecidos por la covid-19, con lo que llegó a un total de 281.604 infectados y 7.482 decesos desde que la pandemia llegó al país, en marzo de 2020, informó este",20-07-2021 04:32,https://www.bing.com/th?id=OVFT.VMH3FuPWGWclwrLWItl6Oi,Chile,La Tribuna
Población descuida su bioseguridad luego de vacunarse,https://www.latribuna.hn/2021/07/20/poblacion-descuida-su-bioseguridad-luego-de-vacunarse/,"SAN PEDRO SULA, Cortés. Las autoridades de Salud en la zona norte del país advirtieron este lunes que, debido a",20-07-2021 10:48,https://www.bing.com/th?id=OVFT.OVs39frZr_iqxjP9HFHBfS,Chile,La Tribuna
