name,url,description,datePublished,imagen,pais,Fuente
HONDURAS / LIBERADA “ENGELS” SIN “PECES GORDOS” DEL GOBIERNO HERNÁNDEZ,http://www.web.ellibertador.hn/index.php/noticias/nacionales/3027-honduras-liberada-engels-sin-peces-gordos-del-gobierno-hernandez,"Después de generar altas expectativas con el listado “Engels”, finalemente este jueves el Departamento de Estado de los Estados Unidos, ha liberado los nombres de políticos corruptos del Triángulo Norte; en el caso de Honduras, no aparece ningún ...",01-07-2021 17:26,https://www.bing.com/th?id=OVFT.T36qXh1-jR96tMdJl0T6Pi,Chile,El Libertador
Curazao se retiraría de la Copa Oro por brote de covid-19 en su plantilla; hoy confirmaría su continuidad,https://www.diez.hn/internacionales/1476783-498/curazao-retiraria-copa-oro-concacaf-brote-covid-19-plantilla-guatemala-invitada,Concacaf podría sufrir la baja de Curazao en la Copa Oro tras brote de coronavirus en la plantilla caribeña. Un brote de covid-19 en su plantilla deja a la ... edición de la Copa Oro tras dejar fuera a Honduras en la fase de grupos.,09-07-2021 20:32,https://www.bing.com/th?id=OVFT.AiUQOyjr1kz7XsaALtSczy,Chile,diez.hn
Honduras: Imprudencia y la lenta vacunación causan colapso de triajes y hospitales,https://www.elheraldo.hn/pais/1476852-466/vacunas-coronavirus-honduras-proceso-lento-pandemia,"Solo 67,549 personas han sido inmunizadas con las dos dosis anticovid, mientras los casos positivos por el virus superan los 271,000 y hay más de 7,000 muertes. Hoy llegan 180,200 dosis de AstraZeneca",09-07-2021 21:05,https://www.bing.com/th?id=OVFT.0WZSwex2I4VqWk9dC_w8tC,Chile,El Heraldo
EMPRENDEDORES DE OLANCHO AGRADECEN APOYO DEL GOBIERNO PARA REACTIVAR ECONOMÍA Y GENERAR EMPLEOS,https://ultimahora.hn/emprendedores-de-olancho-agradecen-apoyo-del-gobierno-para-reactivar-economia-y-generar-empleos/,"Con el propósito de reactivar la economía del país, el presidente Juan Orlando Hernández entregó este viernes capital semilla a 170 microempresarios de 5 cadenas productivas focalizadas en varios",09-07-2021 21:25,https://www.bing.com/th?id=OVFT.Fl9CMEo3rFin-gKQuroiCS,Chile,Ultima Hora
Las Altas y Bajas de los 10 clubes de Liga Nacional de Honduras para el torneo Apertura 2021,https://www.diez.hn/liganacionaldehonduras/1475485-498/altas-y-bajas-del-apertura-2021-marathon-olimpia-motagua-real-espana-platense-vida-honduras-victoria,Los clubes de Liga Nacional continúan armando sus plantillas para el Apertura 2021. Conocé las altas y bajas de cada equipo hondureño.,09-07-2021 22:41,https://www.bing.com/th?id=OVFT.JkdRW4f85jARuOHY_hWu-S,Chile,diez.hn
Gobierno llama nuevamente al sector transporte al diálogo y No al paro,http://www.elsoldehonduras.com/nacionales/gobierno-llama-nuevamente-al-sector-transporte-al-dialogo-y-no-al-paro/,"Para este próximo lunes 12 de julio, autoridades llaman a una reunión entre gobierno y transportistas.Ante el anuncio de un posible paro nacional que anuncia el sector transporte público en general, e",10-07-2021 00:08,https://www.bing.com/th?id=OVFT.iBHqB3f-ddspeUXR_TgoLy,Chile,El Sol de Honduras
Salud vacuna contra la Covid-19 a locatarios de mercados capitalinos,http://www.elsoldehonduras.com/nacionales/salud-vacuna-contra-la-covid-19-a-locatarios-de-mercados-capitalinos/,"En la extensión de la V campaña de vacunación la Secretaría de Salud a través de la Región Metropolitana del Distrito central se continúa con la vacunación de los 18, 200 adjudicatarios de los diferen",10-07-2021 00:10,https://www.bing.com/th?id=OVFT.y73dEdwoLAbdD8_P3e3dpy,Chile,El Sol de Honduras
Cepal señala que 5.2% crecerá la economía en la región en el 2021,https://hondudiario.com/economia/cepal-senala-que-5-2-crecera-la-economia-en-la-region-en-el-2021/,"La secretaria ejecutiva de la Comisión Especial Para América Latina (Cepal), Alicia Bárcena, informó que para el 2021 proyectan un crecimiento económico en la región de 5.2 por ciento. Todo el mundo s",10-07-2021 00:20,https://www.bing.com/th?id=OVFT.RIrtAJU77i1UEq-G3yyGnC,Chile,Hondudiario
"Honduras reporta 29 nuevas muertes por covid y suma 7,221 decesos",https://www.radiohrn.hn/honduras-reporta-29-nuevas-muertes-por-covid-y-suma-7221-decesos,"Las autoridades del Laboratorio Nacional de Virología realizaron, un total de tres mil ocho pruebas para detectar el nuevo virus, de las cuales 1,111 resultaron positivas",10-07-2021 01:29,https://www.bing.com/th?id=OVFT.m05yjJNsFW-z5LrN5UIxOC,Chile,Radio HRN
"Casos de COVID-19 aumentan a 272,730",https://www.latribuna.hn/2021/07/09/casos-de-covid-19-aumentan-a-272730/,"Los casos de COVID-19 en Honduras ascendieron a 272,730 desde el inicio de la pandemia con la confirmación de otros",10-07-2021 03:36,https://www.bing.com/th?id=OVFT.sQPZIsMm0xEIcrMuUB237C,Chile,La Tribuna
Sin oxígeno triajes tras alta demanda de pacientes en el Distrito Central,https://www.elheraldo.hn/tegucigalpa/1476857-466/falta-oxigeno-triajes-distrito-central-coronavirus,"Los centros de atención temprana solicitan de 50 a 75 tanques de oxígeno a diario, pero el proveedor está saturado y eso genera una tardía respuesta",10-07-2021 08:24,https://www.bing.com/th?id=OVFT.eRzAmRk9iP_Yu7Pl27GpWC,Chile,El Heraldo
Muere el periodista y abogado Mauricio Torres Molinero,https://www.laprensa.hn/honduras/1476914-410/muere-periodista-abogado-mauricio-torres-molinero-covid-pandemia,"De acuerdo a la información que trasciende, el comunicador forma parte de las víctimas del Covid-19. Este sábado murió el reconocido periodista y abogado Mauricio Torres Molinero (74), su familia y am",10-07-2021 10:53,https://www.bing.com/th?id=OVFT.QjL1O9UL6xL-qgKK7abnHy,Chile,La Prensa Chicos
PRESIDENTE DE ANEEAH: VACUNA BAJA EN 86% CONTAGIOS DE COVID-19 EN ENFERMERAS,https://ultimahora.hn/presidente-de-aneeah-vacuna-baja-en-86-contagios-de-covid-19-en-enfermeras/,"El presidente de la Asociación Nacional de Enfermeras y Enfermeros Auxiliares de Honduras (Anneah), Josué Orellana, afirmó que la vacunación ha bajado en un 86% los contagios del COVID-19 entre",10-07-2021 13:42,https://www.bing.com/th?id=OVFT.6eB-3nFHxvRUHT2dDyhvai,Chile,Ultima Hora
Presidente Hernández advierte que cierre a la economía “sería devastador para el país”,https://hondudiario.com/covid-19/presidente-hernandez-advierte-que-cierre-a-la-economia-seria-devastador-para-el-pais/,"***“Un nuevo cierre a la economía sería devastador para el país, porque sólo traerá más desempleo”, indicó el presidente Hernández. El presidente de Honduras, Juan Orlando Hernández, aseguró que ante",10-07-2021 13:47,https://www.bing.com/th?id=OVFT.6W0BNLBMMTQIclH3hvEIFy,Chile,Hondudiario
"Honduras: dónde y quiénes se vacunan hoy, sábado, contra la COVID-19",https://tiempo.hn/honduras-quienes-se-vacunan-hoy-sabado-covid-19/,"Este sábado, 10 de julio, la Sesal continúa con la quinta jornada de vacunación contra la COVID-19 en las principales ciudades de Honduras.",10-07-2021 13:55,https://www.bing.com/th?id=OVFT.lVgoT_R4zh6sopEpUe3vGS,Chile,Tiempo
Hondureño Teófimo López desaprueba fecha de pelea ante George Kambosos,https://www.diariomas.hn/2021/07/10/teofimo-lopez-desaprueba-fecha-de-pelea-ante-george-kambosos/,"Triller está haciendo planes para organizar la pelea reprogramada por el campeonato de peso Ligero indiscutible entre Teofimo López y George Kambosos el 17 de octubre en el Bankwest Stadium en Sydney,",10-07-2021 14:04,https://www.bing.com/th?id=OVFT.S0bEV96aEol_q6fhywJg0i,Chile,Mas
Por exclusión en educación Honduras lamentará consecuencias en un futuro: Daniel Esponda,https://proceso.hn/por-exclusion-en-educacion-honduras-lamentara-consecuencias-en-un-futuro-daniel-esponda/,"La crisis en educación se agudiza y si antes de la pandemia del Covid-19, ya era difícil ahora la situación es prácticamente una tragedia ya que la crisis sanitaria a provocado que los niveles de",10-07-2021 14:54,https://www.bing.com/th?id=OVFT.RNhrMlWW8EhdLjEbGX7OUS,Chile,Proceso
Honduras acumula 7.221 muertes y 272.730 contagios por la covid-19,https://www.latribuna.hn/2021/07/10/honduras-acumula-7-221-muertes-y-272-730-contagios-por-la-covid-19/,"La cifra de muertes por covid-19 en Honduras se elevó este viernes a 7.221 y la de contagios a 272.730, informó el estatal Sistema Nacional de Gestión de Riesgos (Sinager). En un comunicado, el organi",10-07-2021 14:54,https://www.bing.com/th?id=OVFT.Mh31MGHVWfGbdkT0Joi44C,Chile,La Tribuna
"Contagios bajaron 86% en el gremio tras vacunación contra el COVID, según Aneeah",https://proceso.hn/contagios-bajaron-86-en-el-gremio-tras-vacunacion-contra-el-covid-segun-aneeah/,"El presidente de la Asociación Nacional de Enfermeras y Enfermeros Auxiliares de Honduras (Aneeah), Josué Orellana, aseguró que el nivel de contagio de COVID-19 en este gremio, se ha reducido en",10-07-2021 16:20,https://www.bing.com/th?id=OVFT.r7pGL471EJX_AkE1G5X_1C,Chile,Proceso
Técnico de la Selección Femenina de Honduras hace visorias en Miami,https://www.diariomas.hn/2021/07/10/tecnico-de-la-seleccion-femenina-de-honduras-hace-visorias-en-miami/,"El técnico de la selección Femenina de Honduras, el mexicano Juan Carlos Tenorio, junto a su cuerpo técnico iniciaron con la visoria de futbolistas en la ciudad de Miami, Florida, Estados Unidos. Teno",10-07-2021 17:16,https://www.bing.com/th?id=OVFT.1l0SmJTNDkHCp4b3NZQegC,Chile,Mas
Mesa Multisectorial desestima cierre de economía y pide aumentar vacunación,https://tiempo.hn/mesa-multisectoral-no-cierre-de-honduras-2021/,"Mediante un comunicado, la Mesa Multisectorial dijo que no puede haber un cierre en Honduras en 2021 pues la economía no soportaría.",10-07-2021 19:38,https://www.bing.com/th?id=OVFT.ZVS9SJeLTuoNfc33dtBfry,Chile,Tiempo
