name,url,description,datePublished,imagen,pais,Fuente
Bonos de Solidaridad Productiva y Cafetalero brindan seguridad alimentaria en todo el país,http://www.elsoldehonduras.com/agricultura/bonos-de-solidaridad-productiva-y-cafetalero-brindan-seguridad-alimentaria-en-todo-el-pais/,"Los bonos de Solidaridad Productiva y Cafetalero brindan seguridad alimentaria en todas las regiones del país, gracias a la visión del presidente Juan Orlando Hernández. En menos de siete años de ejec",30-04-2021 21:01,https://www.bing.com/th?id=OVFT.M6avkNUpyswBvjlOfAmivy,Chile,El Sol de Honduras
BONOS DE SOLIDARIDAD PRODUCTIVA Y CAFETALERO BRINDAN SEGURIDAD ALIMENTARIA EN TODO EL PAÍS,https://ultimahora.hn/bonos-de-solidaridad-productiva-y-cafetalero-brindan-seguridad-alimentaria-en-todo-el-pais/,• El Bono de Seguridad Productiva ha mejorado la vida de 118.590 familias en 17 departamentos. • Con el Bono Cafetalero se han entregado 300 millones de lempiras en fertilizantes a 91.778,30-04-2021 21:41,https://www.bing.com/th?id=OVFT.XpiuCxRGReHfClAx8RhKGi,Chile,Ultima Hora
Lotes de Sputnik V continuarán llegando a Honduras,https://www.vtv.com.hn/noticia/lotes-de-sputnik-v-continuaran-llegando-a-honduras/,"El ministro de Finanzas, Marco Midence, pidió a un sector de la oposición no politizar el tema de las vacunas contra el Covid-19 que en las próximas semanas llegarán más lotes de Sputnik V, al país pa",30-04-2021 21:46,https://www.bing.com/th?id=OVFT.a3ulV5TN2JOMdeJ8upQhwS,Chile,VTV
"Proveniente de México retornan al país 136 personas, entre ellas 50 niños no acompañados",http://www.eldiario.hn/proveniente-de-mexico-retornan-al-pais-136-personas-entre-ellas-50-ninos-no-acompanados/,"San Pedro Sula. - El Centro de Atención al Migrante Retornado de San Pedro Sula (CAMR-SPS) recibió este viernes un vuelo proveniente de México con 136 personas, entre ellas 50 Niños No Acompañados (NN",01-05-2021 02:25,https://www.bing.com/th?id=OVFT._tm4mbkKzIosEGbxw8Y0RC,Chile,El Diario
Expertos creen que es la variante brasileña la que está en Honduras,https://www.laprensa.hn/honduras/1460805-410/expertos-creen-que-es-la-variante-brasilena-la-que-esta-en-honduras-coronavirus,"Médicos señalan que variantes causarán más muertes, contrario a mensaje de la ministra. Tegucigalpa, Honduras. La variante del covid-19 que está presente en el país puede ser la brasileña o la británi",01-05-2021 02:31,https://www.bing.com/th?id=OVFT.bMEb6E_dYjlMrNKSZDRW4C,Chile,La Prensa Chicos
Extreman medidas en Comayagua por el coronavirus,https://www.laprensa.hn/honduras/1460809-410/extreman-medidas-en-comayagua-honduras-coronavirus-salud,"Comayagua, Honduras. Este departamento es el tercero en índice de letalidad del covid-19 (3.5%) en Honduras y además circula una variante del virus más contagiosa por lo que la",01-05-2021 04:50,https://www.bing.com/th?id=OVFT.4TkdKcTazVBWpvypMh4avi,Chile,La Prensa Chicos
UNAH: Pobreza en Honduras subió al 70 por ciento en 2020 por pandemia del covid-19 y tormentas Eta e Iota,https://www.radiohrn.hn/unah-pobreza-en-honduras-subio-al-70-por-ciento-en-2020-por-pandemia-del-covid-19-y-tormentas-eta-e-iota,La pandemia del covid-19 y las tormentas tropicales Eta e Iota impulsaron un alza de 10.7 porcentuales en el índice de pobreza,01-05-2021 06:13,https://www.bing.com/th?id=OVFT.8wXgqKi9BfqQN7xC1J78Di,Chile,Radio HRN
Honduras: Trabajadores piden que la vacuna sea gratuita y mejoras salariales,https://www.elheraldo.hn/tegucigalpa/1460762-466/dia-trabajador-honduras,"En el marco de la convocatoria para la tradicional marcha de los obreros, que este año es voluntaria, llaman a sostener los empleos. Unos 20 sindicatos no participarán de manera presencial",01-05-2021 08:13,https://www.bing.com/th?id=OVFT.w5EdDEw407r0CKJwIT8hay,Chile,El Heraldo
El próximo lunes se reanuda entrega de 2.9 millones de DNI,https://www.elheraldo.hn/pais/1460765-466/entrega-nueva-identidad-honduras,El pasado 27 de marzo se anunció la suspensión del proceso ante la aglomeración y el riesgo de contagios de covid-19,01-05-2021 08:24,https://www.bing.com/th?id=OVFT.ponZuGctaSB5kl_TEGjfjC,Chile,El Heraldo
"Honduras suma 1,257 nuevos casos de Covid-19",https://hondudiario.com/2021/05/01/honduras-suma-1257-nuevos-casos-de-covid-19/,"El Sistema Nacional de Gestión de Riesgos (Sinager), informó que Honduras acumuló 212,333 casos positivos de coronavirus, tras reportarse 1,257 nuevos contagios a nivel nacional. Los nuevos pacientes",01-05-2021 14:11,https://www.bing.com/th?id=OVFT.q3nuka1c5AMmQSLyRYbo-S,Chile,Hondudiario
Presentan iniciativa para comprar vacuna contra Covid-19 fabricada en Cuba,https://hondudiario.com/2021/05/01/presentan-iniciativa-para-comprar-vacuna-contra-covid-19-fabricada-en-cuba/,"La diputada del Partido Libertad y Refundación (Libre), Scherly Arriaga, informó que presentó una iniciativa en el Congreso Nacional (CN), para la compra de la vacuna contra el Covid-19, Soberana-02 q",01-05-2021 16:39,https://www.bing.com/th?id=OVFT.I-HNe4tM1EsBsnIh3DooUC,Chile,Hondudiario
Día del Trabajador en Honduras,https://www.vtv.com.hn/noticia/dia-del-trabajo-en-honduras/,"Con manifestaciones pacíficas se ha celebrado el Día del Trabajador en Tegucigalpa y en Honduras. Las distintas organizaciones obreras, campesinas y también de grupos étnicos han desfilado por las pri",01-05-2021 16:59,https://www.bing.com/th?id=OVFT.emKd67xzgpEghU1t2uJtbi,Chile,VTV
Mujeres las que más se contagian y hombres los que más mueren por COVID en Honduras,https://proceso.hn/mujeres-las-que-mas-se-contagian-y-hombres-los-que-mas-mueren-por-covid-en-honduras/,"Según las estadísticas oficiales que maneja el Sistema Nacional de Gestión de Riesgos (Sinager), las mujeres son las que más se están contagiando, sin embargo, son los hombres los que más fallecen",01-05-2021 18:22,https://www.bing.com/th?id=OVFT.mvon4n43tbhjJoh2zn_WJC,Chile,Proceso
"Falleció ex preparador de porteros de la Selección Nacional, Roy Posas",https://www.diariomas.hn/2021/05/01/fallecio-ex-preparador-fisico-de-la-seleccion-roy-posas/,"Fuentes cercanas a la familia de Roy Orlando Posas, ex portero de Marathon y Atlético Indio, informaron que falleció esta mañana en el Seguro",01-05-2021 19:52,https://www.bing.com/th?id=OVFT.5_r7-7TzFsVSJdTTl-5iiS,Chile,Mas
EN VIVO: Olimpia y Real España llegan al estadio Olímpico para enfrentarse por la final de grupos,https://www.diez.hn/liganacionaldehonduras/1460794-498/real-espana-olimpia-en-vivo-online-transmision-liga-nacional-honduras-pedro-troglio,"4:15 PM: DIEZ ha confirmado el 11 del Olimpia, Edrick Menjívar aparece bajo los tres palos. Línea de cuatro con Maylor Núñez como carrilero derecho, Elvin Casildo y Jhony Leverón en la zaga central y",01-05-2021 22:31,https://www.bing.com/th?id=OVFT.x56UKTwR39MonfNpG1WKJy,Chile,diez.hn
Honduras supera los 213 mil contagios y suma 37 decesos para acumular cinco mil 318 muertes,https://proceso.hn/honduras-supera-los-213-mil-contagios-y-suma-37-decesos-para-acumular-cinco-mil-318-muertes/,"Los casos de COVID-19 en Honduras ascendieron este sábado a 213 mil 167 desde que se declaró una emergencia sanitaria por la pandemia en marzo de 2020, con la confirmación de otros 834 contagios,",02-05-2021 01:41,https://www.bing.com/th?id=OVFT.uvWoGehmufsWm-NF0Rm6sC,Chile,Proceso
COVID-19 en niños: ¿cuántos menores han muerto por el virus en Honduras?,https://tiempo.hn/menores-muertos-por-covid-19-honduras/,"TEGUCIGALPA, HONDURAS. Según el Sistema Nacional de Gestión de Riesgos (Sinager), en Honduras, hasta el jueves 29 de abril, 106 menores habrían fallecido a causa del covid-17, pero el con el deceso de",02-05-2021 02:38,https://www.bing.com/th?id=OVFT.J6cIykwM8dSpOh9bpZ8IQy,Chile,Tiempo
"Sinager reporta un total de 213,167 casos de covid-19 en Honduras",https://www.radiohrn.hn/sinager-reporta-un-total-de-213167-casos-de-covid-19-en-honduras,"Según reporte del Sinager para el 1 de mayo de 2021, en Honduras se registran un total de 213,167 casos de covid-19. El informe detalla que se confirmaron 834 nuevos casos del virus que sigue enlutand",02-05-2021 03:19,https://www.bing.com/th?id=OVFT.Q4JR_q-vGXQT6yFClSKebi,Chile,Radio HRN
COVID-19| Hay más de 212 mil casos: ¿cuál ha sido el mes con más contagios?,https://tiempo.hn/mes-casos-covid-honduras-212-mil-casos/,"TEGUCIGALPA, HONDURAS. El mes de enero del 2021 es el mes con mayor número de contagios y fallecimientos por covid-19, según el investigador Efraín Farach. Asimismo, informó que los casos aumentaron u",02-05-2021 05:16,https://www.bing.com/th?id=OVFT.X0nqbu-SEIWZzogKhZ9Qwy,Chile,Tiempo
Masiva vacunación piden trabajadores en su día,https://www.latribuna.hn/2021/05/02/masiva-vacunacion-piden-trabajadores-en-su-dia/,"Pese a los llamados y advertencias de especialistas como de empresarios de no congregarse para evitar contagios de coronavirus, parte",02-05-2021 10:26,https://www.bing.com/th?id=OVFT.SySuBUqo2EDrOZQaKSB3-S,Chile,La Tribuna
Exministro de Salud: Población no relajarse ante la nueva cepa,https://www.latribuna.hn/2021/05/02/exministro-de-salud-poblacion-no-relajarse-ante-la-nueva-cepa/,"El exministro de Salud, Carlos Aguilar, sugirió a la población que debe mantener la calma y la prudencia ante la",02-05-2021 11:00,https://www.bing.com/th?id=OVFT.QNYwKZ3uKS_sdsMSXzAmXy,Chile,La Tribuna
