name,url,description,datePublished,imagen,pais,Fuente
Honduras reporta primer caso de hongo negro en paciente recuperado de Covid,https://bajopalabra.com.mx/honduras-reporta-primer-caso-de-hongo-negro-en-paciente-recuperado-de-covid,"Ciudad de México.-Las autoridades sanitarias de Honduras confirmaron este lunes el primer caso de mucormicosis, una infección potencialmente mortal que",07-06-2021 22:53,https://www.bing.com/th?id=OVFT.3NZMDP_zXwPdk_fuB1ipnC,Chile,bajopalabra
Seleccionados de Honduras vacunados contra la Covid-19,https://www.diariomas.hn/2021/06/07/seleccionados-de-honduras-vacunados-contra-la-covid-19/,"Tras el partido donde la selección de Honduras derrotó a Costa Rica y se adjudicó el tercer lugar de la Liga de Naciones de la Concacaf, los",08-06-2021 18:09,https://www.bing.com/th?id=OVFT.HawWPjr_Q-5LlLzg_V5cSC,Chile,Mas
"El Salvador envía unas 16,000 vacunas anticovid a dos localidades hondureñas",https://www.laprensa.hn/honduras/1469384-410/el-salvador-envia-unas-16000-vacunas-anticovid-a-dos-localidades-hondurenas-coronavirus,"El ministro de Salud, Francisco Alabí, señaló que 'en esta ocasión' se han enviado vía terrestre a las localidades de Ocotepeque y Choluteca",08-06-2021 18:38,https://www.bing.com/th?id=OVFT.RRnK3Uzr9epNBNEYLwExJy,Chile,La Prensa Chicos
Salud asegura que en Honduras se reportan 10 casos de hongo negro al año,https://tiempo.hn/casos-de-hongo-negro-en-honduras-salud/,"En Honduras, al año, se reportan 10 casos de hongo negro aseguró la Secretaría de Salud (SESAL), luego de que se confirmara el",08-06-2021 20:34,https://www.bing.com/th?id=OVFT.cm993WK-m8ug2LtrWDu9CC,Chile,Tiempo
Honduras confirma el primer caso de hongo negro en un paciente con COVID-19,https://es-us.noticias.yahoo.com/honduras-confirma-caso-hongo-negro-210902402.html,"Las autoridades sanitarias de Honduras confirmaron la aparición del primer caso de hongo negro en un paciente recuperado de COVID-19, enfermedad que ha azotado en las últimas semanas a la India. “Pued",08-06-2021 21:09,https://www.bing.com/th?id=OVFT.hfKNKMfH6wKb9vtOD2TVFy,Chile,Yahoo Noticias en Español
No es el covid-19 el problema de la educación,https://www.vtv.com.hn/noticia/no-es-el-covid-19-el-problema-de-la-educacion/,"Especialistas en la zona norte afirman que el problema de la educación no es el Covid-19, sino que en Honduras el 64% de los centros educativos solo tienen un maestro para 120 alumnos, Kenia Chinchill",08-06-2021 23:04,https://www.bing.com/th?id=OVFT.TcGhl96x8nQevxVCh8feJi,Chile,VTV
Por el COVID-19: Los CDC califican de alto riesgo viajar a Honduras,https://tiempo.hn/cdc-alto-riesto-viajar-a-honduras/,"En el caso de Honduras se encuentra en el nivel 3  ""de riesgo alto"" y estas son las recomendaciones que brindan a los viajeros. ESTADOS UNIDOS. Los Centros de Control de Enfermedades (CDC) de Estados",09-06-2021 01:11,https://www.bing.com/th?id=OVFT.Q2YXhs0MEd6Qrwh_YpmQ5i,Chile,Tiempo
México donará 100 mil dosis de vacunas contra la Covid-19 a Honduras,https://www.vtv.com.hn/noticia/mexico-donara-100-mil-dosis-de-vacunas-contra-la-covid-19-a-honduras/,"El presidente Juan Orlando Hernández, aseguró que México donará 100 mil dosis de vacunas anticovid al país. El presidente Juan Orlando Hernández, aseguró que México donará 100 mil dosis de vacunas ant",09-06-2021 01:21,https://www.bing.com/th?id=OVFT.U5A0tsSwxDNRV5c7KO1eKy,Chile,VTV
Confirman 37 fallecimientos y 419 contagios más de COVID-19 en Honduras,https://proceso.hn/confirman-37-fallecimientos-y-419-contagios-mas-de-covid-19-en-honduras/,"El Sistema Nacional de Gestión de Riesgos (Sinager), confirmó este martes el fallecimiento de 37 personas y 419 nuevos contagios del COVID-19 en Honduras.",09-06-2021 01:49,https://www.bing.com/th?id=OVFT._o51yrt_W2wBpwxIkBMpEC,Chile,Proceso
Honduras suma 6.532 fallecidos por covid y 242.796 contagios desde 2020,https://www.latribuna.hn/2021/06/08/honduras-suma-6-532-fallecidos-por-covid-y-242-796-contagios-desde-2020/,"Honduras registra 6.532 fallecidos por covid-19 desde 2020, en tanto que los contagios ya suman 242.796, informó este martes el",09-06-2021 04:18,https://www.bing.com/th?id=OVFT.dUll5TGO7pIqwGDzOdUPYi,Chile,La Tribuna
Gobierno continúa trabajando en beneficio del sector campesino,http://www.elsoldehonduras.com/agricultura/gobierno-continua-trabajando-en-beneficio-del-sector-campesino/,"Autoridades del Instituto Nacional Agrario (INA), dieron a conocer que en el primer trimestre del año han emitido un total de 328 títulos definitivos de propiedad, en beneficio de 390 familias campesi",09-06-2021 04:55,https://www.bing.com/th?id=OVFT.r9qLwZc6nnAHhODWE8E7qi,Chile,El Sol de Honduras
México confirma la donación de 100.000 dosis de vacunas contra la covid-19 a Honduras,http://www.eldiario.hn/mexico-confirma-la-donacion-de-100-000-dosis-de-vacunas-contra-la-covid-19-a-honduras/,Tegucigalpa. - El presidente Juan Orlando Hernández anunció este martes que México confirmó la donación de 100.000 dosis de vacunas a Honduras para continuar la campaña de inmunización nacional contra,09-06-2021 04:59,https://www.bing.com/th?id=OVFT.0sg5ylMB1KF323gMd3fV8C,Chile,El Diario
Personal de salud recibe segunda dosis de Sputnik V,http://www.elsoldehonduras.com/salud/personal-de-salud-recibe-segunda-dosis-de-sputnik-v/,"El proceso de inoculación contra la covid-19 con una segunda dosis de la vacuna Sputnik V se realizó este martes en el Centro de Salud Alonso Suazo, de Tegucigalpa, bajo un ambiente de comodidad, tran",09-06-2021 05:01,https://www.bing.com/th?id=OVFT.I_AMvADJbIHhfmlje6sa9i,Chile,El Sol de Honduras
El hongo negro no se transmite de una persona a otra,https://www.latribuna.hn/2021/06/09/el-hongo-negro-no-se-transmite-de-una-persona-a-otra/,"El coordinador del programa contra el COVID-19, Homer Mejía, aclaró a la población que la enfermedad del hongo negro no",09-06-2021 10:20,https://www.bing.com/th?id=OVFT.oNjm66O0d9YuUskdkYgwPC,Chile,La Tribuna
