name,url,description,datePublished,imagen,pais,Fuente
HONDURAS / CEUTEC PLANTEA REACTIVACIÓN DE PAÍS REFORZANDO CARRERAS DE SALUD,http://www.web.ellibertador.hn/index.php/noticias/nacionales/2898-honduras-ceutec-plantea-reactivacion-de-pais-reforzando-carreras-de-salud,"Tras pasar más de un año con una condición crítica debido a la pandemia Covid-19, el Centro Universitario Tecnológico (Ceutec), se ha enfocado en fortalecer sus propuestas académicas del área de la sa",07-05-2021 20:54,https://www.bing.com/th?id=OVFT.X3FgtOSJCndQVdJCasMc9S,Chile,El Libertador
Caos y descontrol reportan en la segundo día de vacunación,https://www.vtv.com.hn/noticia/caos-y-descontrol-reportan-en-la-segundo-dia-de-vacunacion/,Decenas de personas han acudido al polideportivo de la Universidad Nacional Autónoma de Honduras para intentar colocarse la vacuna contra la covid-19.,07-05-2021 21:14,https://www.bing.com/th?id=OVFT.I2AnjxkPCFb9OqzcPHkeHC,Chile,VTV
EN SAN PEDRO SULA: CUERPOS DE SOCORRO RECIBEN PRIMERA DOSIS DE VACUNA CONTRA LA COVID-19,https://ultimahora.hn/en-san-pedro-sula-cuerpos-de-socorro-reciben-primera-dosis-de-vacuna-contra-la-covid-19/,"• “No vamos a bajar la guardia y vamos a seguir utilizando las medidas de bioseguridad”, dice el capitán de Bomberos Genaro Ortega. • Recibir la vacuna les brinda seguridad para continuar con los",07-05-2021 21:20,https://www.bing.com/th?id=OVFT.Mwrs3TOBokrulqnBdu75Qi,Chile,Ultima Hora
Pdte Hernández anuncia intervención de 30 municipios más violentos del país,https://www.vtv.com.hn/noticia/pdte-hernandez-anuncia-intervencion-de-30-municipios-mas-violentos-del-pais/,"Vacunar, entregar ayuda humanitaria y perseguir y capturar a los delincuentes en los 30 municipios más violentos de Honduras serán parte del sello de la cuarta fase de Operación Morazán -según el anun",07-05-2021 23:20,https://www.bing.com/th?id=OVFT.TFYvJAnoWl18nRTLmEmWeC,Chile,VTV
Honduras acumula 218 mil 330 infectados y 5 mil 585 defunciones por COVID-19,https://proceso.hn/honduras-acumula-218-mil-330-infectados-y-5-mil-585-defunciones-por-covid-19/,"Tegucigalpa – Honduras alcanzó este viernes un total de 218 mil 300 infectados y cinco mil 585 defunciones por COVID-19, establece reporte divulgado por el Sistema Nacional de Gestión de Riesgos (Sina",08-05-2021 02:07,https://www.bing.com/th?id=OVFT.YUe6Kh9oUmHOgUyTI6o1Py,Chile,Proceso
Letalidad por COVID-19 sigue en aumento tras confirmarse otras 83 muertes,https://hondudiario.com/2021/05/07/letalidad-por-covid-19-sigue-en-aumento-tras-confirmarse-otras-83-muertes/,"Los casos de Covid-19 en Honduras ascendieron este viernes a 218.330 desde el inicio de la pandemia con la confirmación de otros 735 contagios, mientras que los pacientes recuperados se incrementaron",08-05-2021 02:38,https://www.bing.com/th?id=OVFT.EC5pDwYJ9CdJH0KI4l9OaC,Chile,Hondudiario
Casos de covid-19 aumentan a 218.330,https://www.latribuna.hn/2021/05/07/casos-de-covid-19-aumentan-a-218-330/,"Los casos de COVID-19 en Honduras ascendieron a 218,330 desde el inicio de la pandemia con la confirmación de otros",08-05-2021 02:41,https://www.bing.com/th?id=OVFT.z3E10TKf85Yal5ZEnQtzxS,Chile,La Tribuna
Aplican primera dosis de vacuna contra la covid-19 a miembros de los cuerpos de socorro en SPS,http://www.eldiario.hn/aplican-primera-dosis-de-vacuna-contra-la-covid-19-a-miembros-de-los-cuerpos-de-socorro-en-sps/,"San Pedro Sula. - La Secretaría de Salud inició este viernes en San Pedro Sula la aplicación de la primera dosis de AstraZeneca a miembros de los cuerpos de socorro como bomberos, Cruz Roja, Cruz Verd",08-05-2021 02:50,https://www.bing.com/th?id=OVFT.knWjsDGY6mYpPCI57FL6Ri,Chile,El Diario
"Nahún Aguilar, jefe de redacción de DIEZ, gana el premio al 'Cronista deportivo del año'",https://www.diez.hn/liganacionaldehonduras/1462398-498/nahun-aguilar-jefe-redaccion-diario-diez-premio-cronista-efrain-zuniga-chacon,El periodista hondureño y jefe de redacción de este medio ha ganado el premio 'Efraín Zúniga Chacón'. Tercero de DIEZ que lo obtiene.,08-05-2021 03:04,https://www.bing.com/th?id=OVFT.u0UjvkE-7rZu1AB6td8tDC,Chile,diez.hn
La entrada de remesas familiares a Honduras aumenta casi en 44%,https://www.elheraldo.hn/economia/1462390-466/aumentan-remesas-familiares-divisas-honduras-pib-migracion,Los hondureños que radican en el exterior han enviado alrededor de $700 millones en relación al 4 de mayo de 2020. Recuperación de la economía de EE UU está impactando en las remesas,08-05-2021 07:59,https://www.bing.com/th?id=OVFT.IasbdEEg8HAQ-oNQf-sTuC,Chile,El Heraldo
CUERPOS DE SOCORRO RECIBEN PRIMERA DOSIS DE VACUNA CONTRA LA COVID-19,https://ultimahora.hn/cuerpos-de-socorro-reciben-primera-dosis-de-vacuna-contra-la-covid-19/,"La Secretaría de Salud inició desde ayer  viernes en San Pedro Sula la aplicación de la primera dosis de AstraZeneca a miembros de los cuerpos de socorro como bomberos, Cruz Roja, Cruz Verde,",08-05-2021 14:19,https://www.bing.com/th?id=OVFT.k2FPUJTFRYxy79vv3rF7sC,Chile,Ultima Hora
NO HAY ORDEN NI PARA ENTREGAR CÉDULA A TERCERA EDAD EN HONDURAS,http://www.web.ellibertador.hn/index.php/noticias/nacionales/2901-no-hay-orden-ni-para-entregar-cedula-a-tercera-edad-en-honduras,"Tegucigalpa.- El primer día entrega del Documento Nacional de Identificación (DNI) para adultos mayores se desarrolló en el total caos en la Villa Olímpica de Tegucigalpa, no faltaron las aglomeracion",08-05-2021 21:10,https://www.bing.com/th?id=OVFT.CrNo-KBo-faYSM1yYDSqqS,Chile,El Libertador
Más de 17 mil niños contagiados y 37 han muerto por COVID-19 en Honduras,https://hondudiario.com/2021/05/08/mas-de-17-mil-ninos-contagiados-y-37-han-muerto-por-covid-19-en-honduras/,"La funcionaria del Programa de Políticas Públicas de la Dirección Nacional de la Niñez, Adolescencia y la Familia (Dinaf), Debbie Gómez, aseguró que, más de 17,400 niños hondureños se han contagiado y",08-05-2021 21:47,https://www.bing.com/th?id=OVFT.7ciR3bELX7qB2fBoEBX_Xi,Chile,Hondudiario
Maynor Figueroa reapareció en la MLS tras vencer el coronavirus: “El Covid-19 se atrevió pero no pudo vencerme”,https://www.diez.hn/legionarios/1462554-498/maynor-figueroa-reaparecio-dynamo-fc-dallas-supero-covid-19-mls,El capitán de la Selección de Honduras habló sobre los retos que tiene este año que es de eliminatorias mundialistas y dice que se siente con ganas de seguir jugando en la H,09-05-2021 00:46,https://www.bing.com/th?id=OVFT.2D-E4eowGjKf2ze5lCDZOi,Chile,diez.hn
Honduras suma 958 nuevos casos de COVID-19 previo al día de la Madre,https://proceso.hn/honduras-suma-958-nuevos-casos-de-covid-19-previo-al-dia-de-la-madre/,"Sobre el estado de salud de mil 125 personas hospitalizadas: 577 están estables, 491 graves y 57 en las unidades de cuidados intensivos (UCI).",09-05-2021 02:55,https://www.bing.com/th?id=OVFT.IVK-d5RlDjGVScPlX6RDjy,Chile,Proceso
Honduras contabiliza un total de 219 mil 288 casos de covid-19,https://www.radiohrn.hn/honduras-contabiliza-un-total-de-219-mil-288-casos-de-covid-19,Un total de 81 mil 382 hondureños han vencido l a enfermedad desde el año 2020 cuando se detectó el primer caso de covid,09-05-2021 03:12,https://www.bing.com/th?id=OVFT.ASUYpyUa9oEO7XSBykaYHS,Chile,Radio HRN
"Suman 5,617 muertes por la pandemia del covid-19 en Honduras",https://www.laprensa.hn/honduras/1462580-410/suman-5617-muertes-covid-19-honduras,"La cifra de muertes por covid-19 en Honduras se elevó este sábado a 5,617 con 32 nuevos casos confirmados por el estatal Sistema Nacional de Gestión de Riesgos (Sinager). En su informe diario el Sinag",09-05-2021 05:55,https://www.bing.com/th?id=OVFT.Qw21zQJ6wpEWEh088btsiy,Chile,La Prensa Chicos
En 60 días revisarán nivel de contagios para definir rumbo de clases semipresenciales,https://www.laprensa.hn/honduras/1462636-410/meses-incidencia-pandemia-covid-autorizacion-sinager-educacion-clases-semipresenciales,"Advierten que de mantener cerrado dos meses más el sistema educativo de Honduras, habrá repercusiones fuertes en la calidad formativa.",09-05-2021 10:35,https://www.bing.com/th?id=OVFT.l2vhZ57uR65BexCSKQ2GWS,Chile,La Prensa Chicos
"Suben a 5,617 los decesos por COVID-19 en Honduras",https://www.latribuna.hn/2021/05/09/suben-a-5617-los-decesos-por-covid-19-en-honduras/,"Tegucigalpa, may (EFE).- La cifra de muertos por covid-19 en Honduras se elevó ayer sábado a 5.617 con 32 nuevos",09-05-2021 14:16,https://www.bing.com/th?id=OVFT.4KRc2CLkMglDH-A2zjmWgy,Chile,La Tribuna
Mayo se perfila como uno de los meses más críticos de la pandemia del covid-19,https://www.radiohrn.hn/mayo-se-perfila-como-uno-de-los-meses-mas-criticos-de-la-pandemia-del-covid-19,El personal de salud está alarmado ya que en los centros de triajes no cuentan con los insumos necesarios para atender a los pacientes infectados con el virus,09-05-2021 15:01,https://www.bing.com/th?id=OVFT.F3XSYS52ohv6Ug7e3oz64i,Chile,Radio HRN
COVID-19 Honduras: cantidad de personas muere por cada millón de habitantes,https://tiempo.hn/covid-tasa-letalidad-honduras/,"REDACCIÓN. Actualmente, Honduras tiene una tasa de contagiados acumulados de 21,617 por cada millón de habitantes y la tasa de mortalidad es de 542 por cada millón de personas, según estadísticas del",09-05-2021 15:35,https://www.bing.com/th?id=OVFT.6GZ1nD4OVDNzod5yJVUIBS,Chile,Tiempo
COVID-19 Honduras | Más de 17 mil niños se han contagiado: 37 decesos,https://tiempo.hn/ninos-contagiados-covid-19/,"En total han fallecido 37 menores a causa del Covid-19. TEGUCIGALPA, HONDURAS. Al menos 17,400 niños hondureños se han contagiado de COVID-19 y, hasta la fecha, 37 murieron a causa del virus, detalló",09-05-2021 17:19,https://www.bing.com/th?id=OVFT.mWYUwPnDAq0qiMM4t-pxAy,Chile,Tiempo
