name,url,description,datePublished,imagen,pais,Fuente
El gobierno informa que distribuirá 40 millones entre las alcaldías para combatir el Covid-19,https://www.vtv.com.hn/noticia/el-gobierno-informa-que-distribuira-40-millones-entre-las-alcaldias-para-combatir-el-covid-19/,"Las alcaldías municipales de Honduras recibirán fondos monetarios para la atención de emergencia sanitaria causada por el Covid-19, cabe mencionar que desde el inicio de la pandemia en marzo del 2020 el gobierno le había donado 300 millones de lempiras ...",23-04-2021 21:21,https://www.bing.com/th?id=OVFT.Fymfns7KlvQA8S8Iy8GgeC,Chile,VTV
"Honduras sobrepasa los 5,000 muertos por coronavirus",https://www.laprensa.hn/honduras/1459167-410/honduras-sobrepasa-los-5000-muertos-por-coronavirus-sinager-salud,"Honduras sobrepasó la barrera de los 5,000 decesos por coronavirus, según el reporte oficial más reciente, y días atrás cruzó el umbral de los 200,000 contagios, mientras el proceso de vacunación sigu",23-04-2021 22:31,https://www.bing.com/th?id=OVFT.sSgqC6iA0IpXLNqRur4oYC,Chile,La Prensa Chicos
Pdte. Hernández pide acceso justo a vacunas anti Covid,https://www.vtv.com.hn/noticia/pdte-hernandez-pide-acceso-justo-a-vacunas-anti-covid/,Un acceso justo y equitativo a las vacunas anti Covid-19 fue el llamado que realizó el presidente Juan Orlando Hernández en la XXVII Cumbre Iberoamericana Andorra 2020 de Jefes de Estado. “La vacuna t,23-04-2021 22:47,https://www.bing.com/th?id=OVFT.fprzlRI7zaDqMwIPaCStfC,Chile,VTV
"Ricardo Elencoff: “No hemos ganado nada, dimos un gran paso para salvar la categoría”",https://www.diariomas.hn/2021/04/23/ricardo-elencoff-no-hemos-ganado-nada-pero-dimos-un-gran-paso-para-salvar-la-categoria/,"Sufrimiento, dolor, cólera y muchos sentimientos más pasan por la mente del presidente de Real Sociedad, Ricardo Elencoff, al no poder estar presente",24-04-2021 00:31,https://www.bing.com/th?id=OVFT.mOSgFlLdg3u4irBjn2_j6y,Chile,Mas
"Honduras acumula 5,095 decesos y 205,696 contagios por covid",https://www.radiohrn.hn/honduras-acumula-5095-decesos-y-205696-contagios-por-covid,"Los nuevos casos se registran en los departamentos de Francisco Morazán, Atlántida, Valle, Gracias a Dios, El Paraíso, Cortés y Ocotepeque",24-04-2021 04:07,https://www.bing.com/th?id=OVFT.OUPIfXTJhAWm0Am9TR5j2i,Chile,Radio HRN
Advierten que un nuevo cierre por covid-19 sería el tiro de gracia para el turismo,https://www.laprensa.hn/honduras/1459234-410/nuevo-cierre-canatur-tela-pandemia-covid-tiro-gracia-sector-turismo-honduras,La Canaturh de Tela señaló que el turismo aún no se ha recuperado del covid-19 ni de la crisis provocada Eta y Iota.,24-04-2021 12:45,https://www.bing.com/th?id=OVFT.ONRo-vQ4aMQLlablN53rsC,Chile,La Prensa Chicos
EN EL SECTOR TURISMO LA ECONÓMICA CAYÓ UN 31.5% EN ENERO Y EN FEBRERO 30.4% Y NO ES POSIBLE RECUPERARSE SI NO HAY UNA VACUNACIÓN,https://ultimahora.hn/en-el-sector-turismo-la-economica-cayo-un-31-5-en-enero-y-en-febrero-30-4-y-no-es-posible-recuperarse-si-no-hay-una-vacunacion/,"Es imprescindible que se vacune a la población para la reactivación de la economía así lo señaló el presidente de la Asociación de Pequeños y Medianos Hoteles de Honduras, Roberto Oseguera. La",24-04-2021 14:59,https://www.bing.com/th?id=OVFT.MO3pWbWHXrKWFkf-zA3xhC,Chile,Ultima Hora
Honduras roza en promedio mil casos de covid-19 al día,https://www.elheraldo.hn/pais/1459264-466/honduras-roza-mil-casos-de-covid-19-d%C3%ADa-fonac,"El análisis de EL HERALDO corresponde a las cifras divulgadas por Sinager en las últimas dos semanas, rango estipulado para observar el comportamiento del virus. Los triajes y las salas de hospitaliza",24-04-2021 15:59,https://www.bing.com/th?id=OVFT.I6kfRtJe50kU4Rz6-U0GCy,Chile,El Heraldo
"MARLENE ALVARENGA, DEL PAC PRESENTÓ SU LIBRO “LA VERDAD ME HARÁ JUSTICIA”",https://ultimahora.hn/26513-2/,"El secretario de Relaciones Exteriores y Cooperación Internacional de Honduras, Lisandro Rosales Banegas, iniciará hoy una visita a Rusia , donde se reunirá con el canciller ruso, Serguéi Lavrov.",24-04-2021 17:02,https://www.bing.com/th?id=OVFT.DvgijSYEaToIJWZHr2RL8y,Chile,Ultima Hora
"Suben a 5,095 los decesos por la COVID-19 y a 205,696 los contagios en Honduras",https://www.latribuna.hn/2021/04/24/suben-a-5095-los-decesos-por-la-covid-19-y-a-205696-los-contagios-en-honduras/,"Tegucigalpa, 23 abr (EFE).- La cifra de muertos por covid-19 en Honduras se elevó este viernes a 5.095, mientras que",24-04-2021 18:34,https://www.bing.com/th?id=OVFT.LjnTonCaMaiDHVt550Bqby,Chile,La Tribuna
"Támara, el Centro Penal con más casos positivos de covid-19",https://www.elheraldo.hn/pais/1459314-466/tamara-centro-penal-casos-positivos-covid-19,Un total de 191 casos positivos han sido detectados en los distintos centros panales del país en lo que va del año,24-04-2021 20:40,https://www.bing.com/th?id=OVFT.Batmz9VQF0LeJdPR1k028i,Chile,El Heraldo
Liga Ascenso: Equipos hace caso omiso a Sinager y juegan sus partidos a estadio lleno,https://www.diez.hn/ligadeascenso/1459268-498/liga-ascenso-equipos-caso-omiso-sinager-juegan-a-estadio-lleno-honduras,"Pese a las advertencias emitidas por el Sistema Nacional de Gestión de Riesgos (Sinager) por el acceso de público en los partidos de la Liga de Ascenso, los equipos han hecho caso omiso a las autorida",24-04-2021 22:09,https://www.bing.com/th?id=OVFT.iCJ008Fk695raJYWcWUdrC,Chile,diez.hn
"Un hondureño morirá cada 10 minutos por COVID-19 si gobierno no asume medidas, prevé Umaña",https://proceso.hn/un-hondureno-morira-cada-10-minutos-por-covid-19-si-gobierno-no-asume-medidas-preve-umana/,"Tegucigalpa – Un hondureño morirá cada 10 minutos a causa de la COVID-19, es el desalentador pronóstico del presidente de la Asociación de Médicos del Instituto Hondureño de Seguridad",24-04-2021 22:10,https://www.bing.com/th?id=OVFT.TXIH5BzlzVGp8Cpb4nlgxC,Chile,Proceso
Honduras ante el peor escenario; un muerto cada 10 minutos por Covid-19; alerta doctor Umaña,https://hondudiario.com/2021/04/24/honduras-ante-el-peor-escenario-un-muerto-cada-10-minutos-por-covid-19-alerta-doctor-umana/,"El presidente de la Asociación de Médicos del Instituto Hondureño de Seguridad Social (IHSS), en San Pedro Sula, Carlos Umaña, avizoró este sábado que hondureño morirá cada 10 minutos a causa del Covi",24-04-2021 22:52,https://www.bing.com/th?id=OVFT.LG6sKEPS6UAxuJ1o4gUjCS,Chile,Hondudiario
Motagua sigue sin poder ganarle a Olimpia y Pedro Troglio mantiene su dominio sobre Diego Vázquez,https://www.diez.hn/liganacionaldehonduras/1459316-498/motagua-sigue-sin-ganarle-a-olimpia-pedro-troglio-mantiene-dominio-diego-vasquez,Los Leones acumulan 7 clásicos consecutivos sin perder ante su mpaximo rival y de 12 enfrentamientos sólo cayó en dos ocasiones.,25-04-2021 03:28,https://www.bing.com/th?id=OVFT.Yw1oA9EScLghuvJu-H_Qii,Chile,diez.hn
"Honduras contabiliza un total de 206,381 casos de covid-19",https://www.radiohrn.hn/honduras-contabiliza-un-total-de-206381-casos-de-covid-19,"Francisco Morazán es el departamento que más casos de covid registró, un total de 366 A 206, 381 aumentaron el sábado (24.04.2021) los casos de covid-19 en Honduras, según el Sistema Nacional de Gesti",25-04-2021 04:22,https://www.bing.com/th?id=OVFT.8j1xzTHFSQ-_wliA15CENi,Chile,Radio HRN
"Honduras suma 5,100 fallecidos por COVID-19 y 206,381 contagios desde marzo de 2020",https://www.latribuna.hn/2021/04/25/honduras-suma-5100-fallecidos-por-covid-19-y-206381-contagios-desde-marzo-de-2020/,"Tegucigalpa, 25 abr (EFE).- Los muertos en Honduras por covid-19 ya suman 5.100 desde marzo de 2020, en tanto que",25-04-2021 13:31,https://www.bing.com/th?id=OVFT.wubErR1sSnywPB63mLzFgC,Chile,La Tribuna
"Honduras suma 5,100 muertos por COVID y 206,381 contagios desde marzo de 2020",https://proceso.hn/honduras-suma-5100-muertos-por-covid-y-206381-contagios-desde-marzo-de-2020/,"Agregó que de 2,374 nuevas pruebas de laboratorio procesadas, 685 dieron positivo, para un total de 206,381 desde que la pandemia de la mortal enfermedad se comenzó a expandir.",25-04-2021 13:44,https://www.bing.com/th?id=OVFT.UwZV97POn8uhn483JH6Ewy,Chile,Proceso
"LA ENTREVISTA | Gizelle Lanza al superar el COVID-19: «Sentí temor,...",https://tiempo.hn/testimonio-gizelle-lanza-covid-19/,"La periodista Gizelle Lanza aseguró que tener COVID-19 le dio muchas lecciones, pero las más importante acercarse más a Dios. TEGUCIGALPA, HONDURAS. Aún con algunas secuelas por haber experimentado el",25-04-2021 14:22,https://www.bing.com/th?id=OVFT.g9l-cB-1GTcqxsJegVbBpC,Chile,Tiempo
"Honduras alcanza las 5,100 muertes por coronavirus y 206,381 contagios en últimas 24 horas",https://hondudiario.com/2021/04/25/honduras-alcanza-las-5100-muertes-por-coronavirus-y-206381-contagios-en-ultimas-24-horas/,"El Sistema Nacional de Gestión de Riesgos (Sinager), confirmó este viernes 685 nuevos casos de Covid-19, sumando así un total de 206,381 contagios a nivel nacional. De 2,374 pruebas PCR procesadas por",25-04-2021 14:31,https://www.bing.com/th?id=OVFT.sfrSABBxp4_f0w9lNrKCbC,Chile,Hondudiario
"Ante falta de vacunas, alcalde de Honduras le pide ayuda a Nayib Bukele",https://tiempo.hn/alcalde-olancho-vacunas-nayib-bukele/,"HONDURAS. El alcalde del municipio de Santa María del Real, Olancho, Carlos Galeano, le pidió ayuda para comprar las vacunas contra la COVID-19 al presidente, pero no al de su p",25-04-2021 14:49,https://www.bing.com/th?id=OVFT.v2Yk3VMVgNe3qc6iz6AIPy,Chile,Tiempo
