name,url,description,datePublished,imagen,pais,Fuente
"Honduras sobrepasa los 5,000 muertos por coronavirus",https://www.laprensa.hn/honduras/1459167-410/honduras-sobrepasa-los-5000-muertos-por-coronavirus-sinager-salud,"Honduras sobrepasó la barrera de los 5,000 decesos por coronavirus, según el reporte oficial más reciente, y días atrás cruzó el umbral de los 200,000 contagios, mientras el proceso de vacunación sigu",23-04-2021 22:31,https://www.bing.com/th?id=OVFT.sSgqC6iA0IpXLNqRur4oYC,Chile,La Prensa Chicos
Pdte. Hernández pide acceso justo a vacunas anti Covid,https://www.vtv.com.hn/noticia/pdte-hernandez-pide-acceso-justo-a-vacunas-anti-covid/,Un acceso justo y equitativo a las vacunas anti Covid-19 fue el llamado que realizó el presidente Juan Orlando Hernández en la XXVII Cumbre Iberoamericana Andorra 2020 de Jefes de Estado. “La vacuna t,23-04-2021 22:47,https://www.bing.com/th?id=OVFT.fprzlRI7zaDqMwIPaCStfC,Chile,VTV
"Ricardo Elencoff: “No hemos ganado nada, dimos un gran paso para salvar la categoría”",https://www.diariomas.hn/2021/04/23/ricardo-elencoff-no-hemos-ganado-nada-pero-dimos-un-gran-paso-para-salvar-la-categoria/,"Sufrimiento, dolor, cólera y muchos sentimientos más pasan por la mente del presidente de Real Sociedad, Ricardo Elencoff, al no poder estar presente",24-04-2021 00:31,https://www.bing.com/th?id=OVFT.mOSgFlLdg3u4irBjn2_j6y,Chile,Mas
EN EL SECTOR TURISMO LA ECONÓMICA CAYÓ UN 31.5% EN ENERO Y EN FEBRERO 30.4% Y NO ES POSIBLE RECUPERARSE SI NO HAY UNA VACUNACIÓN,https://ultimahora.hn/en-el-sector-turismo-la-economica-cayo-un-31-5-en-enero-y-en-febrero-30-4-y-no-es-posible-recuperarse-si-no-hay-una-vacunacion/,"Es imprescindible que se vacune a la población para la reactivación de la economía así lo señaló el presidente de la Asociación de Pequeños y Medianos Hoteles de Honduras, Roberto Oseguera. La",24-04-2021 14:59,https://www.bing.com/th?id=OVFT.MO3pWbWHXrKWFkf-zA3xhC,Chile,Ultima Hora
Honduras roza en promedio mil casos de covid-19 al día,https://www.elheraldo.hn/pais/1459264-466/honduras-roza-mil-casos-de-covid-19-d%C3%ADa-fonac,"El análisis de EL HERALDO corresponde a las cifras divulgadas por Sinager en las últimas dos semanas, rango estipulado para observar el comportamiento del virus. Los triajes y las salas de hospitaliza",24-04-2021 15:59,https://www.bing.com/th?id=OVFT.I6kfRtJe50kU4Rz6-U0GCy,Chile,El Heraldo
"MARLENE ALVARENGA, DEL PAC PRESENTÓ SU LIBRO “LA VERDAD ME HARÁ JUSTICIA”",https://ultimahora.hn/26513-2/,"El secretario de Relaciones Exteriores y Cooperación Internacional de Honduras, Lisandro Rosales Banegas, iniciará hoy una visita a Rusia , donde se reunirá con el canciller ruso, Serguéi Lavrov.",24-04-2021 17:02,https://www.bing.com/th?id=OVFT.DvgijSYEaToIJWZHr2RL8y,Chile,Ultima Hora
"Támara, el Centro Penal con más casos positivos de covid-19",https://www.elheraldo.hn/pais/1459314-466/tamara-centro-penal-casos-positivos-covid-19,Un total de 191 casos positivos han sido detectados en los distintos centros panales del país en lo que va del año,24-04-2021 20:40,https://www.bing.com/th?id=OVFT.Batmz9VQF0LeJdPR1k028i,Chile,El Heraldo
Honduras ante el peor escenario; un muerto cada 10 minutos por Covid-19; alerta doctor Umaña,https://hondudiario.com/2021/04/24/honduras-ante-el-peor-escenario-un-muerto-cada-10-minutos-por-covid-19-alerta-doctor-umana/,"El presidente de la Asociación de Médicos del Instituto Hondureño de Seguridad Social (IHSS), en San Pedro Sula, Carlos Umaña, avizoró este sábado que hondureño morirá cada 10 minutos a causa del Covi",24-04-2021 22:52,https://www.bing.com/th?id=OVFT.LG6sKEPS6UAxuJ1o4gUjCS,Chile,Hondudiario
Motagua sigue sin poder ganarle a Olimpia y Pedro Troglio mantiene su dominio sobre Diego Vázquez,https://www.diez.hn/liganacionaldehonduras/1459316-498/motagua-sigue-sin-ganarle-a-olimpia-pedro-troglio-mantiene-dominio-diego-vasquez,Los Leones acumulan 7 clásicos consecutivos sin perder ante su mpaximo rival y de 12 enfrentamientos sólo cayó en dos ocasiones.,25-04-2021 03:28,https://www.bing.com/th?id=OVFT.Yw1oA9EScLghuvJu-H_Qii,Chile,diez.hn
"Honduras contabiliza un total de 206,381 casos de covid-19",https://www.radiohrn.hn/honduras-contabiliza-un-total-de-206381-casos-de-covid-19,"Francisco Morazán es el departamento que más casos de covid registró, un total de 366 A 206, 381 aumentaron el sábado (24.04.2021) los casos de covid-19 en Honduras, según el Sistema Nacional de Gesti",25-04-2021 04:22,https://www.bing.com/th?id=OVFT.8j1xzTHFSQ-_wliA15CENi,Chile,Radio HRN
"Honduras suma 5,100 fallecidos por COVID-19 y 206,381 contagios desde marzo de 2020",https://www.latribuna.hn/2021/04/25/honduras-suma-5100-fallecidos-por-covid-19-y-206381-contagios-desde-marzo-de-2020/,"Tegucigalpa, 25 abr (EFE).- Los muertos en Honduras por covid-19 ya suman 5.100 desde marzo de 2020, en tanto que",25-04-2021 13:31,https://www.bing.com/th?id=OVFT.wubErR1sSnywPB63mLzFgC,Chile,La Tribuna
"Honduras suma 5,100 muertos por COVID y 206,381 contagios desde marzo de 2020",https://proceso.hn/honduras-suma-5100-muertos-por-covid-y-206381-contagios-desde-marzo-de-2020/,"Agregó que de 2,374 nuevas pruebas de laboratorio procesadas, 685 dieron positivo, para un total de 206,381 desde que la pandemia de la mortal enfermedad se comenzó a expandir.",25-04-2021 13:44,https://www.bing.com/th?id=OVFT.UwZV97POn8uhn483JH6Ewy,Chile,Proceso
"Honduras alcanza las 5,100 muertes por coronavirus y 206,381 contagios en últimas 24 horas",https://hondudiario.com/2021/04/25/honduras-alcanza-las-5100-muertes-por-coronavirus-y-206381-contagios-en-ultimas-24-horas/,"El Sistema Nacional de Gestión de Riesgos (Sinager), confirmó este viernes 685 nuevos casos de Covid-19, sumando así un total de 206,381 contagios a nivel nacional. De 2,374 pruebas PCR procesadas por",25-04-2021 14:31,https://www.bing.com/th?id=OVFT.sfrSABBxp4_f0w9lNrKCbC,Chile,Hondudiario
"Ante falta de vacunas, alcalde de Honduras le pide ayuda a Nayib Bukele",https://tiempo.hn/alcalde-olancho-vacunas-nayib-bukele/,"HONDURAS. El alcalde del municipio de Santa María del Real, Olancho, Carlos Galeano, le pidió ayuda para comprar las vacunas contra la COVID-19 al presidente, pero no al de su p",25-04-2021 14:49,https://www.bing.com/th?id=OVFT.v2Yk3VMVgNe3qc6iz6AIPy,Chile,Tiempo
"El 30 de abril llegarán Honduras 40 mil dosis de la vacuna rusa Sputnik V, según el canciller de la República",https://www.radiohrn.hn/el-30-de-abril-llegaran-honduras-40-mil-dosis-de-la-vacuna-rusa-sputnik-v-segun-el-canciller-de-la-republica,Lisandro Rosales espera que la adquisición de las vacunas contra el covid-19 se normalice en los próximos días,25-04-2021 15:17,https://www.bing.com/th?id=OVFT.mlORRBg2H3kZKRFpjzsJVy,Chile,Radio HRN
"Este viernes llegarán a Honduras 40,000 dosis de Sputnik V, asegura Lisandro Rosales",https://www.laprensa.hn/honduras/1459339-410/vacuna-covid-pandemia-coronavirus-sputnik-v,"El canciller informó también, a través de su cuenta de Twitter, que en dos semanas arribarán otras 40 mil dosis de la vacuna contra el Covid-19 al país.",25-04-2021 15:37,https://www.bing.com/th?id=OVFT.dpJ2Y_pkLKauT-uxoySJsC,Chile,La Prensa Chicos
Boniek García reinventado como defensor central en ausencia de Maynor Figueroa en el Houston Dynamo,https://www.diez.hn/legionarios/1459355-498/maynor-figueroa-ausencia-por-covid-19-houston-dynamo,"El defensor hondureño Maynor Figueroa estuvo en el banquillo en el último encuentro ante Timbers con el equipo naranja, pero no sumó ningún minuto.",25-04-2021 16:01,https://www.bing.com/th?id=OVFT.10ZL0U6UMy9Q17WE5LOaUS,Chile,diez.hn
Estados Unidos recomienda a sus ciudadanos no viajar al 80 % de los países del mundo,https://proceso.hn/estados-unidos-recomienda-a-sus-ciudadanos-no-viajar-al-80-de-los-paises-del-mundo/,"Con la intención de evitar la propagación del virus de la COVID-19, el Departamento de Estado de los Estados Unidos ha elevado de 34 a 130 la lista de países que recomienda a sus ciudadanos no",25-04-2021 16:06,https://www.bing.com/th?id=OVFT.N6ATAborkNY44QTIfDOnqi,Chile,Proceso
Honduras: producción de mascarillas dejó $100 millones de ganancias en 2020,https://tiempo.hn/produccion-mascarillas-honduras-ganancias/,"Ante la llegada del Covid-19 a Honduras, las maquilas hondureñas tuvieron que reinventarse. En ese sentido, la producción de prenda para",25-04-2021 17:06,https://www.bing.com/th?id=OVFT.RTIIJu1jTNCwO3W3WwCXUy,Chile,Tiempo
La COVID-19 le arrebata la vida a conductor de ambulancia del IHSS en la capital,https://www.latribuna.hn/2021/04/25/la-covid-19-le-arrebata-la-vida-a-conductor-de-ambulancia-del-ihss-en-la-capital/,"Informes preliminares indican que Romero, se contagió del letal virus al trasladar a pacientes con COVID-19 hasta el recinto hospitalario donde laboraba. Cabe mencionar que, los muertos en Honduras por COVID-19, sumaron ayer sábado 5,100 desde marzo de ...",25-04-2021 18:01,https://www.bing.com/th?id=OVFT.IAfnKvtF60nwUkNPu3U5Mi,Chile,La Tribuna
