name,url,description,datePublished,imagen,pais,Fuente
Honduras tendrá unas 600.000 vacunas contra la covid-19 entre mayo y junio anuncia ministra de Salud,http://www.eldiario.hn/honduras-tendra-unas-600-000-vacunas-contra-la-covid-19-entre-mayo-y-junio-anuncia-ministra-de-salud/,"Tegucigalpa. - Honduras contará con unas 600.000 dosis de vacunas contra la covid-19 para inocular a una parte de su población entre los meses de mayo y junio próximos, anunció este miércoles la minis",29-04-2021 03:19,https://www.bing.com/th?id=OVFT.VqV8a_n_kKfLT9ypHJF7ti,Chile,El Diario
"Periodistas caídos, víctimas del COVID-19",https://proceso.hn/periodistas-caidos-victimas-del-covid-19/,"A más de un año de la llegada de la pandemia del coronavirus a Honduras, miles de personas han perdido sus vidas azotados por el virus, incluidos los periodistas que apagaron su voz y dejaron de",29-04-2021 04:10,https://www.bing.com/th?id=OVFT.re28LM9Ce0X9LqCMS3T4Ti,Chile,Proceso
Chelato Uclés será velado en el Estadio Nacional,https://www.elheraldo.hn/deportes/1460353-466/chelato-ucles-velorio-estadio-nacional-honduras-seleccion-jose-herrrera,"Debido a las restricciones por la pandemia del covid-19, el recinto deportivo será el lugar donde se le dará el último adiós al gran maestro",29-04-2021 08:09,https://www.bing.com/th?id=OVFT.DDZQBEwRCXF2pLeckhPRLC,Chile,El Heraldo
"Honduras tendrá unas 600,000 vacunas contra la COVID-19",https://www.latribuna.hn/2021/04/29/honduras-tendra-unas-600000-vacunas-contra-la-covid-19/,"Honduras contará con unas 600,000 dosis de vacunas contra la COVID-19, para inocular a una parte de su población entre",29-04-2021 11:00,https://www.bing.com/th?id=OVFT.c9vY_VNZXHIjyBVcwF2TNy,Chile,La Tribuna
"Honduras acumula 209,490 contagios y 5,223 fallecidos por la COVID-19",https://www.latribuna.hn/2021/04/29/honduras-acumula-209490-contagios-y-5223-fallecidos-por-la-covid-19/,"Tegucigalpa, 28 abr (EFE).- Honduras alcanzó este miércoles 209.490 casos confirmados del coronavirus SARS-CoV-2 y 5.223 fallecidos por la enfermedad",29-04-2021 13:55,https://www.bing.com/th?id=OVFT.9WEeZSn7Leao1h0OK92h2i,Chile,La Tribuna
Hondureño en Brasil: “Aquí se sigue en crisis; para Honduras el escenario sería peor”,https://www.elheraldo.hn/pais/1460283-466/hondure%C3%B1o-en-brasil-aqu%C3%AD-se-sigue-en-crisis-para-honduras-el-escenario,"Jorge Reyes Pinto estudia Medicina en la Universidad Federal do Rio Grande do Sul, en Porto Alegre, Brasil. Le comenta EL HERALDO cómo la variante del covid-19 hizo estragos en esa región",29-04-2021 14:39,https://www.bing.com/th?id=OVFT.ZppwIBdzN0uoKRulGBVz7y,Chile,El Heraldo
Así amanece Honduras: Se confirma variante del COVID 19 en Honduras,https://www.vtv.com.hn/noticia/asi-amanece-honduras-se-confirma-variante-del-covid-19-en-honduras/,"Alerta para los hondureños, se ha confirmado la presencia de variantes del coronavirus en el país, aunque las autoridades de salud desconocen cuales son",29-04-2021 14:48,https://www.bing.com/th?id=OVFT.ihTs7soVuO_hk79zzyTchy,Chile,VTV
"Muertes por coronavirus suben a 5,223 y contagios a 209,490 en Honduras",https://hondudiario.com/2021/04/29/muertes-por-coronavirus-suben-a-5223-y-contagios-a-209490-en-honduras/,"*** Las muertes sólo en 2021 suman un total de 1,989 a nivel nacional; los contagios en lo que va del año son 83,933. El Sistema Nacional de Gestión de Riesgos (Sinager), confirmó en las últimas horas",29-04-2021 14:57,https://www.bing.com/th?id=OVFT.McYEuR4z32M7xERV54eBpC,Chile,Hondudiario
Los municipios de Honduras con medidas fuertes por altas cifras de COVID-19,https://tiempo.hn/municipios-de-honduras-intervenidos-covid-19/,"TEGUCIGALPA, HONDURAS. Ante el aumento de contagios y muertos por COVID-19, varios municipios de Honduras tomaron la determinación de solicitar una intervención a la Secretaría de Salud (SESAL) o empe",29-04-2021 16:02,https://www.bing.com/th?id=OVFT.5Wq8SHE8k4K0eS6EBWL23S,Chile,Tiempo
Proveedores de vacunas se eximen de demandas por efectos adversos en Honduras,https://www.laprensa.hn/honduras/1460502-410/proveedores-vacunas-eximen-demandas-efectos-adversos-honduras,Congresistas aprobaron una ley que blinda a proveedores de medicamentos y vacunas contra covid-19 de responsabilidad penal.,29-04-2021 17:48,https://www.bing.com/th?id=OVFT.pWtSYlt2rqYS2tdB-z3azy,Chile,La Prensa Chicos
En un año de pandemia Honduras perdió un millón de empleos creados en una década,https://www.radiohrn.hn/en-un-ano-de-pandemia-honduras-perdio-un-millon-de-empleos-creados-en-una-decada,"De acuerdo con los reportes oficiales, el desempleo creció en por lo menos cinco puntos, debido al impacto de la urgencia sanitaria por covid-19",29-04-2021 18:00,https://www.bing.com/th?id=OVFT.sOp_nOGgjogYjOGWjzERyC,Chile,Radio HRN
CN APROBÓ LEY PARA FACILITAR COMPRA DE DIFERENTES VACUNAS CONTRA COVID-19,https://ultimahora.hn/cn-aprobo-ley-para-facilitar-compra-de-diferentes-vacunas-contra-covid-19/,"· Diferentes farmacéuticas piden a los países reformas legales para poder vender su vacuna. · “Todos acá queremos que vengan las vacunas, no creo que haya alguien que tenga un sentimiento tan",29-04-2021 21:24,https://www.bing.com/th?id=OVFT.V__hOFS3gsLSnDKS1f83Cy,Chile,Ultima Hora
Salud no descarta presencia de cepa en más departamentos de Honduras,https://www.laprensa.hn/honduras/1460573-410/salud-no-descarta-presencia-de-cepa-en-mas-departamentos-honduras-coronavirus-sinager-covid,"Exministra de Salud señala que las variantes pueden estar en el país desde febrero, pero dijo que no se tiene la tecnología para detectarlo Honduras es amenazada por tres cepas del covid.",29-04-2021 22:45,https://www.bing.com/th?id=OVFT.dh2xFTexNKG-ZbUpgX4FNC,Chile,La Prensa Chicos
Hijo de Chelato Uclés relata sus últimos momentos y la preciada 'herencia' que le dejó,https://www.diez.hn/liganacionaldehonduras/1460451-498/muere-chelato-ucles-hijo-rudy-urbina-ultimos-momentos-chelato-ihss,"Rudy Urbina, uno de los hijos de Chelato Uclés revela que intentarán hacer un museo de fútbol en honor a su padre en la casa donde vivió largo tiempo.",29-04-2021 23:09,https://www.bing.com/th?id=OVFT.68eNlVB951Midi_870l3fS,Chile,diez.hn
HONDURAS / ¡YA A SU ALCANCE! EL LIBERTADOR IMPRESO,http://www.web.ellibertador.hn/index.php/noticias/nacionales/2880-honduras-ya-a-su-alcance-nueva-edicion-impresa-el-libertador-5,"En la primera edición impresa de 2021, en formato digital, EL LIBERTADOR pone en sus manos artículos que sólo leerá en el “Primer Auditor Social de Honduras”, estos son algunos de nuestros titulares:",30-04-2021 00:06,https://www.bing.com/th?id=OVFT.4wC9Rt9VxOyFfhG4y50kBy,Chile,El Libertador
HONDURAS / UNAH GESTIONA VACUNAS PARA ESTUDIANTES ANTE TARDANZA DEL GOBIERNO,http://www.web.ellibertador.hn/index.php/noticias/nacionales/2881-honduras-unah-gestiona-vacunas-para-estudiantes-ante-tardanza-del-gobierno,"El vicerrector de la Universidad Nacional Autónoma de Honduras (UNAH) asegura que ya existen pláticas con universidades de Rusia, Chile y China para poder adquirir el biológico y así lograr que se vue",30-04-2021 00:59,https://www.bing.com/th?id=OVFT.Orm_FYXkcaTx7QdyP-wYoC,Chile,El Libertador
"'Que la población hondureña no esté vacunada retrasa la normalidad económica del país': Federico Álvarez, expresidente del BCIE",https://www.radiohrn.hn/que-la-poblacion-hondurena-no-este-vacunada-retrasa-la-normalidad-economica-del-pais-federico-alvarez-expresidente-del-bcie,"El experto en temas económicos aseguró que, mientras la ciudadanía no esté inmunizada contra el covid-19, la normalidad económica continuará retrasándose",30-04-2021 01:38,https://www.bing.com/th?id=OVFT.ebfRjPbfVsJW9-JH8NkrBC,Chile,Radio HRN
33 muestras de casos positivos de Covid-19 serán enviadas a laboratorios internacionales,https://www.vtv.com.hn/noticia/33-muestras-de-casos-positivos-de-covid-19-seran-enviadas-a-laboratorios-internacionales/,Esto se hará para conocer qué nueva variante de esta enfermedad está circulando en Honduras.,30-04-2021 01:50,https://www.bing.com/th?id=OVFT.HZ-xNcN3CWibCOqODZLBiy,Chile,VTV
Salud asegura que nueva variante de COVID-19 en Honduras “no mata”,https://tiempo.hn/nueva-variante-covid-19-honduras-no-mata/,"TEGUCIGALPA. De acuerdo con la titular de la Secretaría de Salud (SESAL), Alba Consuelo Flores, la nueva variante de COVID-19 que circula en Honduras no mata, solo se multiplica rápidamente. A través",30-04-2021 01:57,https://www.bing.com/th?id=OVFT.HVhJF7GfHFY6bGdwc9jWay,Chile,Tiempo
Honduras supera los 211 mil contagios de coronavirus tras aplicar más de 5 mil PCR,https://hondudiario.com/2021/04/29/honduras-supera-los-211-mil-contagios-de-coronavirus-tras-aplicar-mas-de-5-mil-pcr/,"Honduras sumó este jueves 1,586 nuevos casos de coronavirus, alcanzando así un total de 211,076 contagios a nivel nacional, según el último recuento del Sistema Nacional de Gestión de Riesgos (Sinager",30-04-2021 03:17,https://www.bing.com/th?id=OVFT.awBfxMPCF0zPE_DOBEcHTS,Chile,Hondudiario
