name,url,description,datePublished,imagen,pais,Fuente
REGIONAL DE SALUD DE SANTA BÁRBARA ESTABLE CONTROLES PARA PREVENIR COVID-19,https://ultimahora.hn/la-campana-sera-del-6-al-31-de-mayo-comienza-distribucion-de-189-600-dosis-de-vacunas-anticovid-19-para-ser-aplicadas/,Las 189.600 dosis de vacunas contra la covid-19 donadas por el mecanismo Covax/Gavi que llegaron este martes al país comenzaron a ser distribuidas a las regiones sanitarias desde el Almacén,04-05-2021 22:14,https://www.bing.com/th?id=OVFT.mHwjws0GYbfNgWXRk_N_fy,Chile,Ultima Hora
Unos 114 mil hondureños serán vacunas con AstraZeneca,https://www.vtv.com.hn/noticia/unos-114-mil-hondurenos-seran-vacunas-con-astrazeneca/,"Más de 114,000 hondureños, entre ellos, personal de Salud y adultos mayores, serán vacunados con las 229,600 dosis de de las farmacéuticas AstraZeneca a través del mecanismo Covax y la rusa Sputnik V,",04-05-2021 23:27,https://www.bing.com/th?id=OVFT.4MkSdhwDS62y95FbQZB0Fy,Chile,VTV
HONDURAS / DR. GIRÓN EXPLICA A “PROFE” DE SALUD CÓMO ACTÚA COVID,http://www.web.ellibertador.hn/index.php/noticias/nacionales/2888-honduras-dr-giron-explica-a-profe-de-salud-como-actua-covid,El doctor Marco Eliud Girón subraya que “es muy difícil que una licenciada en pedagogía entienda lo que un cuerpo médico de expertos le está explicando y creo que aprendió mal la lección de virología”,05-05-2021 02:35,https://www.bing.com/th?id=OVFT.Hoa8CJSazI1MZQ-mBwKdSS,Chile,El Libertador
Con más de 1.200 propuestas cierra fase de postulaciones de Las 30 Maravillas de Honduras,http://www.eldiario.hn/con-mas-de-1-200-propuestas-cierra-fase-de-postulaciones-de-las-30-maravillas-de-honduras/,"Tegucigalpa. - El presidente Juan Orlando Hernández clausuró este lunes la fase de postulación del concurso Las 30 Maravillas de Honduras, edición Bicentenario, en la que se contabilizaron más de 1.20",05-05-2021 02:40,https://www.bing.com/th?id=OVFT.LR__6zb1Dpqu3leUvaBALS,Chile,El Diario
Honduras suma 1.358 nuevos casos de COVID-19 y acumula 215.833 contagios,https://www.latribuna.hn/2021/05/04/honduras-suma-1-358-nuevos-casos-de-covid-19-y-acumula-215-833-contagios/,Tegucigalpa.- Honduras sumó este martes 1.358 nuevos casos de COVID-19 y acumuló 215.833 contagios desde que la pandemia se comenzó,05-05-2021 05:12,https://www.bing.com/th?id=OVFT.ydA-Nhf9jwlNtm0VBHXHMS,Chile,La Tribuna
Un niño de 6 años entre los nuevos infectados por covid-19 en Honduras,https://www.radiohrn.hn/un-nino-de-6-anos-entre-los-nuevos-infectados-por-covid-19-en-honduras,"El reporte del Sinager, establece que entre los nuevos infectados por el virus se encuentra un menor de 6 años de edad originario del Distrito Central. Gráfica . El comunicado i",05-05-2021 05:27,https://www.bing.com/th?id=OVFT.XPNj7iymsuyig8H-pDCb_S,Chile,Radio HRN
A cuentagotas costará llegar a la vacunación colectiva en Honduras,https://www.elheraldo.hn/pais/1461698-466/vacunacion-lenta-covid-honduras-2021,"Honduras sigue en la cola de los países de Centroamérica en la inmunización contra el covid-19 a tal extremo que es superada hasta por Nicaragua, que ha manejado la crisis silenciosamente",05-05-2021 08:12,https://www.bing.com/th?id=OVFT.SGKLqCu6P5OXL_WwXv1l0i,Chile,El Heraldo
ELSA PALOU: SE NECESITA MÁS VELOCIDAD EN LA INOCULACIÓN HONDURAS NO ALCANZARÁ LA INMUNIDAD DE REBAÑO,https://ultimahora.hn/elsa-palou-se-necesita-mas-velocidad-en-la-inoculacion-honduras-no-alcanzara-la-inmunidad-de-rebano/,"La exministra de Salud, Elsa Palou analizó este miércoles los aciertos y desaciertos del gobierno en el manejo de la pandemia por la covid-19 en Honduras. Para hacer este balance de país, menciono",05-05-2021 14:06,https://www.bing.com/th?id=OVFT.UGAMLEcFRxuJWbHNSiqUky,Chile,Ultima Hora
"Sólo en 2021 Honduras ya suma 2,152 muertes y 90,276 contagios por coronavirus",https://hondudiario.com/2021/05/05/solo-en-2021-honduras-ya-suma-2152-muertes-y-90276-contagios-por-coronavirus/,"*** Sólo en 2021 suman un total de 2,152 a nivel nacional; los contagios en lo que va del año son 90,276. Honduras sumó en las últimas horas 1,358 nuevos casos de coronavirus, alcanzando así un total",05-05-2021 14:19,https://www.bing.com/th?id=OVFT.Xnm0SmDkGSSIIT83a1kq9S,Chile,Hondudiario
Médico hondureño convaleciente de la covid-19 busca candidatura presidencial,https://www.laprensa.hn/honduras/1461840-410/medico-hondureno-convaleciente-de-la-covid-19-busca-candidatura-presidencial-elecciones-honduras,"En los últimos 70 años, según Matheu, se les ha hecho creer a los jóvenes la idea de que Honduras es el peor país del mundo.",05-05-2021 15:38,https://www.bing.com/th?id=OVFT.UOEtNqFXX1kzv2vbmAqubS,Chile,La Prensa Chicos
Atletismo activado en San Pedro Sula con medidas de bioseguridad,https://www.diariomas.hn/2021/05/05/atletismo-activado-en-san-pedro-sula-con-medidas-de-bioseguridad/,"Bajo estrictas medidas de bioseguridad, la Federación Hondureña de Atletismo, comenzó a realizar evaluaciones a los atletas nacionales, para que",05-05-2021 17:00,https://www.bing.com/th?id=OVFT.vA69nZ9N8sc8n0oT5sXSIy,Chile,Mas
"HONDURAS / DERECHOS E INVERSIÓN, DISCUTIRÁN EMPRESAS EN SEMANA RESPONSABILIDAD SOCIAL",http://www.web.ellibertador.hn/index.php/noticias/nacionales/2890-honduras-derechos-e-inversion-discutiran-empresas-en-semana-responsabilidad-social,"La “Semana de Responsabilidad Social Empresarial y la Sostenibilidad, Evolucionando a Sociedades Sostenibles” se celebrara entre el 17 y 21 de mayo próximo, buscando que en el país se hable de una inv",05-05-2021 18:09,https://www.bing.com/th?id=OVFT.HaR3etZ9GtXLYXlnXxcQRS,Chile,El Libertador
Mañana inicia nueva jornada de vacunación en Honduras,https://www.vtv.com.hn/noticia/manana-inicia-nueva-jornada-de-vacunacion-en-honduras/,"Hoy miércoles 5 de mayo del 2021, las autoridades de la Secretaría de Salud de Honduras empezaron el proceso de distribución de las vacunas contra el Covid-19 AstraZeneca, en las distintas regiones sa",05-05-2021 18:20,https://www.bing.com/th?id=OVFT.pFqaDV2WTanBeFGWlIy41S,Chile,VTV
"Reina Durón: Al ritmo actual de vacunación, Honduras terminaría en 10 años",https://tiempo.hn/cuanto-tardara-vacunacion-contra-el-covid-en-honduras/,"Honduras podría tardar hasta diez años en inmunizar contra el COVID-19 a toda la población elegible, según Reina Durón del Observatorio.",05-05-2021 19:03,https://www.bing.com/th?id=OVFT.4cpPMfwsuwjjkNpb9Vh_Zi,Chile,Tiempo
Afirma el presidente Hernández: Cuarta jornada de vacunación salvará las vidas de 228.000 hondureños,http://www.elsoldehonduras.com/nacionales/afirma-el-presidente-hernandez-cuarta-jornada-de-vacunacion-salvara-las-vidas-de-228-000-hondurenos/,"La cuarta jornada de vacunación contra la covid- 19 salvará las vidas de 228.000 hondureños, afirmó hoy el presidente Juan Orlando Hernández al recibir 189.600 dosis de la farmacéutica AstraZeneca baj",05-05-2021 21:19,https://www.bing.com/th?id=OVFT.9Nxk2ycMoyjhpii7CHG7BC,Chile,El Sol de Honduras
"Calendario de vacunación en mayo: fecha, hora, lugar y grupos a inmunizar contra el covid en la capital",https://www.elheraldo.hn/interactivos/1461931-529/calendario-de-vacunaci%C3%B3n-en-mayo-fecha-hora-lugar-y-grupos-a-inmunizar,EL HERALDO Plus pone a disposición las fechas de la cuarta jornada de vacunación en la capital de Honduras. Falta por definir los días para el personal de socorro. Esta tabla se irá actualizando a med,05-05-2021 21:47,https://www.bing.com/th?id=OVFT.yiSxYj8NMeO9i88XKLQPai,Chile,El Heraldo
Médico hondureño convaleciente de covid-19 busca candidatura presidencial,https://www.radiohrn.hn/medico-hondureno-convaleciente-de-covid-19-busca-candidatura-presidencial,"""Imagínese que llegara una administración que no robara"", dijo el galeno Manuel Matheu, quien espera presentar su candidatura independiente ante el CNE",05-05-2021 22:28,https://www.bing.com/th?id=OVFT.dVWQH_8YDX0_8NA0XdhUOy,Chile,Radio HRN
Fechas y lugares de vacunación contra el covid-19 en Tegucigalpa,https://www.laprensa.hn/honduras/1461980-410/fechas-lugares-vacunacion-contra-covid-19-tegucigalpa,Tegucigalpa. La Secretaría de Salud publicó este miércoles el calendario de la IV Campana de Vacunación contra el covid-19 en el departamento de Tegucigalpa. Jueves 6 al 11 de,05-05-2021 23:11,https://www.bing.com/th?id=OVFT.L3EYfezTonS1JlILSMjfTi,Chile,La Prensa Chicos
Nueva variante del COVID-19 circula en 11 departamentos de Honduras,https://proceso.hn/nueva-variante-del-covid-19-circula-en-11-departamentos-de-honduras/,"La nueva variante del COVID-19 ya circula en 11 de los departamentos de Honduras, confirmó la jefa de vigilancia de la Secretaría de Salud, Karla Pavón.",06-05-2021 00:17,https://www.bing.com/th?id=OVFT.k7n0NA576WIEj7NAy8D-DC,Chile,Proceso
Sesal: En once departamentos de Honduras circulan nuevas variantes del COVID-19,https://tiempo.hn/salud-departamentos-circulan-variantes-covid-19/,"TEGUCIGALPA, HONDURAS. En once departamentos del país, estarían circulando las nuevas variantes del COVID-19, según el último informe de las muestras que ha realizado el Laboratorio Nacional de Virolo",06-05-2021 01:19,https://www.bing.com/th?id=OVFT.LqgiNAnEUGxC_4b8Wq9FqS,Chile,Tiempo
La nueva variante del COVID-19 ya circula en 11 departamentos del país,https://hondudiario.com/2021/05/05/la-nueva-variante-del-covid-19-ya-circula-en-11-departamentos-del-pais/,"La jefa de vigilancia de la Secretaría de Salud, Karla Pavón, confirmó este miércoles que la nueva variante del COVID-19 ya circula en 11 de los departamentos de Honduras. En ese sentido, reveló que l",06-05-2021 01:24,https://www.bing.com/th?id=OVFT.ws-483mPkl10VEfED9v-gS,Chile,Hondudiario
Honduras llega a 216 mil 964 contagios y 5 mil 439 fallecimientos por coronavirus,https://proceso.hn/honduras-llega-a-216-mil-964-contagios-y-5-mil-439-fallecimientos-por-coronavirus/,"Respecto al estado de salud de mil 179 personas hospitalizadas: 606 se encuentran estables, 514 graves y 59 en las unidades de cuidados intensivos (UCI).",06-05-2021 02:48,https://www.bing.com/th?id=OVFT.Qpp2oOuj3a8mdmQq728v0y,Chile,Proceso
"Hoy inicia inmunización de 8,675 trabajadores",https://www.latribuna.hn/2021/05/05/hoy-inicia-inmunizacion-de-8675-trabajadores/,"Hoy inicia la cuarta jornada de vacunación contra la COVID-19 para los trabajadores de la salud, del sector público y",06-05-2021 04:24,https://www.bing.com/th?id=OVFT.wpuVKB_d757flq5T9nB8Pi,Chile,La Tribuna
