name,url,description,datePublished,imagen,pais,Fuente
"""Emprendetón"", la iniciativa que busca formar emprendedores de éxito en Honduras",https://www.laprensa.hn/honduras/1473203-410/emprendeton-iniciativa-busca-formar-emprendedores-exito-honduras,"Talleres sobre gestión empresarial, emprendimiento, estrategia y generación de empleo celebrará Senprende en San Pedro Sula y Tegucigalpa.",24-06-2021 13:10,https://www.bing.com/th?id=OVFT.pa5-bOhxTFY0vLpI5PYVjS,Chile,La Prensa Chicos
"Alpha, Beta y Gamma: ¿Qué peligro representan estas nuevas variantes identificadas en Honduras?",https://www.elheraldo.hn/pais/1473189-466/alpha-beta-gamma-variantes-covid-honduras,"A través de un muestreo realizado por el Laboratorio Nacional de Virología, con el apoyo del Instituto Gorgas de Panamá, se identificó la existencia de las variantes de preocupación Alpha, Beta y Gamm",24-06-2021 13:58,https://www.bing.com/th?id=OVFT.7xPoMxynKJMAUXiFSFFsyC,Chile,El Heraldo
Confirman tres nuevas variantes del letal coronavirus en Honduras,https://www.elheraldo.hn/pais/1473184-466/confirman-nuevas-variantes-covid-honduras-secretaria-salud,Las muestras fueron enviadas a un laboratorio internacional donde se logró confirmar que las variantes ya circulan en el país,24-06-2021 14:01,https://www.bing.com/th?id=OVFT.3bjVUcK4N8D3kJO1a8V39y,Chile,El Heraldo
Identifican caso positivo de COVID-19 en perro “callejero” de Honduras,https://proceso.hn/identifican-caso-positivo-de-covid-19-en-perro-callejero-de-honduras/,"El científico veterinario, Eleazar Ramos, informó este jueves que han logrado obtener evidencia científica de la enfermedad de la COVID-19 en un perro “callejero” en Honduras.",24-06-2021 15:01,https://www.bing.com/th?id=OVFT.cKv63LTErS9_3QNPXX8Soi,Chile,Proceso
VETERINARIO ASEGURA QUE UN PERRO MURIÓ CONTAGIADO DE COVID-19 SERÍA PRIMER CASO IDENTIFICADO EN HONDURAS,https://ultimahora.hn/veterinario-asegura-que-un-perro-murio-contagiado-de-covid-19-seria-primer-caso-identificado-en-honduras/,"El veterinario Eleazar Ramos, asegura que un perro en el municipio de Guaimaca, Francisco Morazán, murió contagiado de Covid-19. “Al animalito se le hizo el muestreo de Covid-19 y salió positivo",24-06-2021 15:35,https://www.bing.com/th?id=OVFT.zxfPx1RJoSrUqmpT7DcLRy,Chile,Ultima Hora
Honduras: veterinario confirma muerte de perrito que se contagió de COVID-19,https://tiempo.hn/muere-perrito-por-covid-19-guaimaca-honduras/,"El perrito luchó por más de una semana contra el virus. GUIMACA, HONDURAS. El veterinario hondureño, Eleazar Ramos, confirmó la mañana de este jueves que un perrito falleció a causa de COVID-19 en el",24-06-2021 16:52,https://www.bing.com/th?id=OVFT.KsCfVCzYrAl5bMfPR4o-rC,Chile,Tiempo
"Solicitan ayuda para Adolfo «Gorcha» Collins, ex seleccionado y ex jugador del Vida",https://www.diariomas.hn/2021/06/24/solicitan-ayuda-para-adolfo-gorcha-collins-ex-seleccionado-y-ex-jugador-del-vida/,"Los problemas de salud del ex seleccionado del Vida, Adolfo «Gorcha» Collins no paran y el ex portero también de la Selección Nacional, necesita el apoyode amigos para poder comparar sus medicamentos",24-06-2021 17:02,https://www.bing.com/th?id=OVFT.1CmqAkLEsB-aq-NECIL59S,Chile,Mas
"VARIANTES DE LA COVID-19: ALFA, BETA Y GAMMA CIRCULAN EN HONDURAS",https://ultimahora.hn/variantes-de-la-covid-19-alfa-beta-y-gamma-circulan-en-honduras/,"Alfa, Beta y Gamma circulan en Honduras, confirmaron este jueves la jefa del Laboratorio Nacional de Virología, Mitzi Castro, quien aseguró que se está trabajando para trabajar y dar más",24-06-2021 19:10,https://www.bing.com/th?id=OVFT.kxJGNiczoYiUh5kHGO5RKy,Chile,Ultima Hora
Detectan al primer perro con COVID-19 en Honduras,https://www.latribuna.hn/2021/06/24/detectan-al-primer-perro-con-covid-19-en-honduras/,"Un perro que deambulaba en las afueras de un centro de triaje en el municipio de Guaimaca, Francisco Morazán, dio",24-06-2021 19:14,https://www.bing.com/th?id=OVFT.KaRsLH9TZPZ6rHiBt489OS,Chile,La Tribuna
Confirmaron variantes de COVID-19 en el país,https://www.vtv.com.hn/noticia/confirmaron-variantes-de-covid-19-en-el-pais/,En el documento señalan que a través del Laboratorio Nacional de Virología se han recibido los resultados de las muestras enviadas al Instituto Gorgas de Panamá donde se confirma la presencia de tres,24-06-2021 19:38,https://www.bing.com/th?id=OVFT.TI3hZSgIikiHeJpPkCEyay,Chile,VTV
Sanofi iniciará ensayo en Honduras para su vacuna contra la COVID-19,https://tiempo.hn/sanofi-ensayo-en-honduras-vacuna-covid-19/,"TEGUCIGALPA, HONDURAS. Sanofi, una farmacéutica francesa, iniciará próximamente en Honduras un ensayo clínico de la tercera fase de su vacuna contra el COVID-19. Esta vacuna está basada en proteínas r",24-06-2021 21:00,https://www.bing.com/th?id=OVFT.YDD_NtyjkM2RLfA4UdzDly,Chile,Tiempo
Honduras identifica presencia de variante alfa del nuevo coronavirus,https://abc17news.com/cnn-spanish/2021/06/24/honduras-identifica-presencia-de-variante-alfa-del-nuevo-coronavirus/,"urielblanco (CNN Español) — La Secretaría de Salud de Honduras informó este jueves sobre la circulación de la variante del coronavirus identificada como alfa, una “de preocupación que surgió en el Rei",24-06-2021 21:49,https://www.bing.com/th?id=OVFT.mFY2DobnoiV9wFd0Tb8Gyy,Chile,ABC 17 News
Honduras recibe 150 mil vacunas contra el Covid-19 donadas por México,https://hondudiario.com/covid-19/honduras-recibe-150000-vacunas-donadas-por-mexico/,"Honduras recibió este jueves 150,000 vacunas contra el coronavirus donadas por el Gobierno de México. Las vacunas de AstraZeneca llegaron con procedencia del Distrito Federal a Palmerola, después de l",24-06-2021 22:07,https://www.bing.com/th?id=OVFT.fQvElgtZO8OK_IleWa5vfC,Chile,Hondudiario
Nadador catracho ganó plata en CCCAN,https://www.diariomas.hn/2021/06/24/nadador-catracho-gano-plata-en-cccan/,"En el segundo día de competencia en el CCCAN de  San Juan de Puerto Rico, el nadador hondureño Omar Oyuela logró el segundo lugar (medalla de plata) en la modalidad de 200 metros combinados individual",24-06-2021 22:59,https://www.bing.com/th?id=OVFT.0R2o4zltD6BrbvTiXY4_Zi,Chile,Mas
"Fenafuth, Liga Nacional y Copeco trabajarán en el regreso de la afición a los estadios",https://www.radiohrn.hn/fenafuth-liga-nacional-y-copeco-trabajaran-en-el-regreso-de-la-aficion-a-los-estadios,"El fútbol de Liga Nacional se juega sin público desde marzo de 2020, cuando el país registró los primeros casos de covid-19",24-06-2021 23:14,https://www.bing.com/th?id=OVFT.0YsoBdgp4GPEGvyfu2TxaC,Chile,Radio HRN
"En Honduras circula la variante delta del covid; India identifica la delta plus, mirá de qué se trata",https://www.radiohrn.hn/en-honduras-circula-la-variante-delta-del-covid-india-identifica-la-delta-plus-mira-de-que-se-trata,Autoridades indias dicen que es preocupante pues ya se ha propagado por tres estados apenas en cuestión de días,24-06-2021 23:19,https://www.bing.com/th?id=OVFT.pFTih-TnWFdjGYwedzlmxy,Chile,Radio HRN
Reportan mil 155 contagios y muertes se elevan a 6 mil 879 por COVID-19 en Honduras,https://proceso.hn/reportan-mil-155-contagios-y-muertes-se-elevan-a-6-mil-879-por-covid-19-en-honduras/,"El Sistema Nacional de Gestión de Riesgos (Sinager), cifró este jueves en 256 mil 818 los contagios de COVID-19 y en 6 mil 879 los fallecimientos de COVID-19 en Honduras.",25-06-2021 01:40,https://www.bing.com/th?id=OVFT.Fa4OONLb6IkAocKb4uB4wC,Chile,Proceso
Llegan 150.000 dosis de vacunas donadas por México,http://www.eldiario.hn/llegan-150-000-dosis-de-vacunas-donadas-por-mexico/,"Tegucigalpa. - Las 150.000 dosis de vacunas donadas por el Gobierno de México a Honduras arribaron este jueves en un vuelo de la Fuerza Aérea de ese país a la terminal aérea de Palmerola, en Comayagua",25-06-2021 02:11,https://www.bing.com/th?id=OVFT.JlmQVuAdwGpAHN9wO__mVS,Chile,El Diario
"Llegan 19,300 dosis de vacunas de AstraZeneca",https://www.latribuna.hn/2021/06/24/llegan-19300-dosis-de-vacunas-de-astrazeneca/,"Honduras recibió 19,310 dosis de la vacuna de AstraZeneca bajo el mecanismo Covax que servirán para continuar con la implementación",25-06-2021 02:20,https://www.bing.com/th?id=OVFT.Hhfbr2KsO8IsNcft2iAd6i,Chile,La Tribuna
Honduras reporta 35 muevas muertes por coronavirus y más de mil contagios en últimas 24 horas,https://hondudiario.com/covid-19/honduras-reporta-35-muevas-muertes-por-coronavirus-y-mas-de-mil-contagios-en-ultimas-24-horas/,"*** La cifra total de personas recuperadas de la enfermedad es de 92,187 en el acumulado. Honduras registró este jueves 1,155 nuevos casos de coronavirus, alcanzando así un total de 256,818 contagios",25-06-2021 02:22,https://www.bing.com/th?id=OVFT.O4BJ07mzcJINmbc5ftO5XS,Chile,Hondudiario
