name,url,description,datePublished,imagen,pais,Fuente
IHSS espera que su compra de vacunas de AstraZeneca llegue a finales de abril,https://hondudiario.com/2021/04/09/ihss-espera-que-su-compra-de-vacunas-de-astrazeneca-llegue-a-finales-de-abril/,informó este viernes que a finales de este mes llegarían a Honduras el primer lote de vacunas contra el coronavirus compradas por esa entidad. “En el caso del Seguro Social tendremos ingreso de vacunas (contra el Covid-19) a finales de este mes ...,09-04-2021 19:21,https://www.bing.com/th?id=OVFT._vPXYdcWHe0K3HwO0FlZZC,Chile,Hondudiario
MP SEGUIRÁ PROCESO INTERNACIONAL EN CONTRA DE AXEL LÓPEZ PARA QUE RESPONDA POR FRAUDE,https://ultimahora.hn/mp-seguira-proceso-internacional-en-contra-de-axel-lopez-para-que-responda-por-fraude/,"El portavoz de la Fiscalía, Yuri Mora informó que Ministerio Público de Honduras seguirá todos los procedimientos internacionales contra el guatemalteco Axel Gamaliel López Guzmán para que",09-04-2021 20:48,https://www.bing.com/th?id=OVFT.iAeC22XUZ1R0NUM_wO5sMS,Chile,Ultima Hora
Cohep confirmó que las vacunas anti covid para afiliados del IHSS estarán en Honduras a inicios de mayo,https://www.vtv.com.hn/noticia/cohep-confirmo-que-las-vacunas-anti-covid-para-afiliados-del-ihss-estaran-en-honduras-a-inicios-de-mayo/,"Las 1.4 millones de dosis de vacunas de la empresa farmacéutica AstraZeneca para inmunizar el Covid-19, fueron adquiridas por el Instituto Hondureño de Seguridad Social IHSS, el presidente del Consejo",09-04-2021 20:51,https://www.bing.com/th?id=OVFT.QIf-rNONp1hafZb0pA3szC,Chile,VTV
HONDUREÑOS SOLVENTES VIAJAN A “TURISMO DE VACUNAS” EN EEUU,http://www.web.ellibertador.hn/index.php/noticias/nacionales/2840-hondurenos-solventes-viajan-a-turismo-de-vacunas-en-eeuu,"Hacer un viaje de placer a Estados Unidos y de paso inmunizarse contra el mortal Covid-19 se ha vuelto “turismo de vacunas ... porque nuestra lectora lamenta: “En Honduras, el Gobierno sólo es promesas y promesas, mientras tanto mueren y mueren ...",09-04-2021 22:32,https://www.bing.com/th?id=OVFT.dXcQ1ZtPMwyEyE0rudaDji,Chile,El Libertador
"A la cárcel de Támara mandan a Marco Bográn y Alex Moraes, detenidos por el caso de los hospitales móviles",https://www.diez.hn/noticiasdelmundo/1455622-498/carcel-de-tamara-mandan-marco-bogran-y-alex-moraes-corrupcion,"El exdirector de Invest-H está siendo investigado por abuso de autoridad, fraude y malversación de caudales públicos por la compra de los hospitales móviles",10-04-2021 01:14,https://www.bing.com/th?id=OVFT.8rWBlzW457MHsiJ_W18lSy,Chile,diez.hn
Delegaciones de Honduras y Estados Unidos desarrollan diálogo bilateral,http://www.eldiario.hn/delegaciones-de-honduras-y-estados-unidos-desarrollan-dialogo-bilateral/,"para conversar sobre los daños ocasionados en Honduras tras el paso de las tormentas tropicales de Eta y Iota, el impacto de la pandemia de covid-19 y sobre la solicitud para la aprobación de un nuevo Estatus de Protección Temporal (TPS) para los ...",10-04-2021 04:06,https://www.bing.com/th?id=OVFT.3qfAI0lAPXzoTEjzDQf4gy,Chile,El Diario
Honduras a la zaga de la vacunación en Centroamérica,https://proceso.hn/honduras-a-la-zaga-en-vacunacion-en-ca/,"Tegucigalpa – La situación de COVID-19 se agrava en Honduras, donde se desconoce cuándo arribarán más vacunas para inocular a la población. A esto se suma que el país está a la zaga de la vacunación en Centroamérica, al tiempo que se cierran ...",10-04-2021 05:09,https://www.bing.com/th?id=OVFT.gqfeQR_1MKeNg9Pe2laLhy,Chile,Proceso
COVID-19 en Honduras: Vea quiénes pueden circular este sábado,https://tiempo.hn/covid-19-honduras-que-digitos-circulan-este-sabado/,Los hondureños deben recordar que la Secretaría de Seguridad aprobó un toque de queda para evitar que los casos de COVID-19 se propaguen.,10-04-2021 14:03,https://www.bing.com/th?id=OVFT.kh2aW_XVgqaPC0zN_uEaIS,Chile,Tiempo
"Suben a 4,776 los decesos por COVID-19 en Honduras y a 194,548 los contagios",https://www.latribuna.hn/2021/04/10/suben-a-4776-los-decesos-por-covid-19-en-honduras-y-a-194548-los-contagios/,"Tegucigalpa, 9 abr (EFE).- La cifra de muertos por covid-19 en Honduras se elevó este viernes a 4.776 y la de contagios a 194.548, informó el estatal Sistema Nacional de Gestión de Riesgos (Sinager).",10-04-2021 14:49,https://www.bing.com/th?id=OVFT.fJwqQ4HkacnuRPVDv4rmAC,Chile,La Tribuna
"Cifras covid Honduras: suben a 4,776 los fallecidos y a 194,548 los contagios",https://www.laprensa.hn/honduras/1455721-410/cifras-covid-honduras-fallecidos-contagios,"La cifra de muertos por covid-19 en Honduras se elevó este viernes a 4.776 y la de contagios a 194.548, informó el estatal Sistema Nacional de Gestión de Riesgos (Sinager). Según el organismo sanitari",10-04-2021 14:56,https://www.bing.com/th?id=OVFT.3dKMDm3vMb2YCQCkCQGc8y,Chile,La Prensa Chicos
Honduras denuncia que le ofrecían vacunas por cuatro veces su precio en EE.UU,https://hondudiario.com/2021/04/10/honduras-denuncia-que-le-ofrecian-vacunas-por-cuatro-veces-su-precio-en-ee-uu/,"El canciller de Honduras, Lisandro Rosales, denunció que una farmacéutica de Estados Unidos les ofreció la vacuna contra la COVID-19 a un precio cuatro veces mayor al del mercado para entregársela en",10-04-2021 17:00,https://www.bing.com/th?id=OVFT.-ZzFO4haODDiHKckwWnwAC,Chile,Hondudiario
WhatsApp: Alerta sobre virus que roba datos personales haciéndose pasar por Netflix,https://www.elheraldo.hn/suplementos/tecnologia/1455820-466/whatsapp-alerta-sobre-virus-roba-datos-personales-haciendose-pasar-netflix,"Apropiarse de información personal, de contactos y bloquear el acceso del titular de WhatsApp son algunas de las acciones que puede ocasionar el nuevo virus TEGUCIGALPA, HONDURAS ... ha sido un éxito a causa de covid-19, ya que diversos usuarios han ...",10-04-2021 22:58,https://www.bing.com/th?id=OVFT.Ojmfz0oE_Tgg5BdgVZmLyy,Chile,El Heraldo
HONDURAS / ¡URGENTE! IHSS DECLARA EMERGENCIA TOTAL,http://www.web.ellibertador.hn/index.php/noticias/nacionales/2842-honduras-urgente-ihss-declara-emergencia-total,"El Instituto Hondureño de Seguridad Social (IHSS) en Tegucigalpa, ante el colapso de la red hospitalaria por la alta incidencia de Covid-19 y la falta de medicamentos, ha declarado “emergencia general” y ha ordenado la cancelación de consulta externa.",10-04-2021 23:09,https://www.bing.com/th?id=OVFT.xLMRubu3dROCeq9kz-eHuy,Chile,El Libertador
"Suben a 4,776 los muertos por covid-19 en Honduras y a 194,548 los contagios",https://www.laprensa.hn/honduras/1455858-410/coronavirus-honduras-covid-19-honduras-contagios-sinager-salud-copeco,"Se añaden 765 nuevos casos positivos confirmados por el Laboratorio Nacional de Virología entre 3,072 nuevas pruebas procesadas, indicó el Sinager. Tegucigalpa, Honduras. La cifra de muertos por covid-19 en Honduras se elevó este viernes a 4.776 y la ...",11-04-2021 03:17,https://www.bing.com/th?id=OVFT.30fB7GBEojPuO1bnZIHUZS,Chile,La Prensa Chicos
Sinager reporta 977 nuevos casos de covid y cuatro fallecidos más,https://www.radiohrn.hn/sinager-reporta-977-nuevos-casos-de-covid-19-y-cuatro-fallecidos-mas-por-la-enfermedad,"Se recomienda siempre tomar todas las medidas de bioseguridad como el lavado constante de manos, distanciamiento social, entre otros",11-04-2021 04:57,https://www.bing.com/th?id=OVFT.UjFTA3cyOj8-bhUFE6V3ni,Chile,Radio HRN
"Honduras registra 195,525 positivos con COVID-19 y 4,770 fallecidos desde 2020",https://www.latribuna.hn/2021/04/11/honduras-registra-195525-positivos-con-covid-19-y-4770-fallecidos-desde-2020/,"Tegucigalpa, 10 abr (EFE).- El número de casos positivos con covid-19 en Honduras desde marzo de 2020 se elevó este sábado a 195.525 y el de muertos a 4.770, según el informe diario del Sistema Nacional de Gestión de Riesgos (Sinager). De 3.029 nuevas ...",11-04-2021 15:27,https://www.bing.com/th?id=OVFT.us-GDXOQkwKUcWPqYUsl-y,Chile,La Tribuna
Contemplan que Hospital Escuela se convierta en un centro COVID-19,https://tiempo.hn/hospital-escuela-centro-covid-19/,"El Hospital Escuela podría vivir un nuevo escenario en plena pandemia de COVID-19, alimentado por el colapso en las salas de otros centros. TEGUCIGALPA, HONDURAS. El Hospital Escuela (HE) podría convertirse próximamente en un centro dedicado a la ...",11-04-2021 15:59,https://www.bing.com/th?id=OVFT.1tYrZNT3qtDNUAhqUNbcay,Chile,Tiempo
Cardenal hondureño recuerda “estragos” del coronavirus y pide enérgicamente seguir normas de bioseguridad,https://proceso.hn/cardenal-hondureno-recuerda-estragos-del-coronavirus-y-pide-energicamente-seguir-normas-de-bioseguridad/,"Tegucigalpa – El cardenal hondureño, Óscar Andrés Rodríguez, recordó hoy, después de haber superado la enfermedad, los “estragos” del coronavirus y enfáticamente pidió a la población seguir las normas",11-04-2021 17:15,https://www.bing.com/th?id=OVFT.GX4ESKDXPNVFu7KmCurDTy,Chile,Proceso
