name,url,description,datePublished,imagen,pais,Fuente
Identifican caso positivo de COVID-19 en perro “callejero” de Honduras,https://proceso.hn/identifican-caso-positivo-de-covid-19-en-perro-callejero-de-honduras/,"El científico veterinario, Eleazar Ramos, informó este jueves que han logrado obtener evidencia científica de la enfermedad de la COVID-19 en un perro “callejero” en Honduras.",24-06-2021 15:01,https://www.bing.com/th?id=OVFT.cKv63LTErS9_3QNPXX8Soi,Chile,Proceso
"""Recibir 150 mil dosis, es el cielo para nosotros"", dice ministra de Salud ante donación de México",https://www.elheraldo.hn/pais/1473225-466/llegan-honduras-150-mil-dosis-astrazeneca-donadas-mexico,"El lote de AstraZeneca arribó en horas del mediodía a la terminal aérea de Palmerola, en el departamento de Comayagua",24-06-2021 15:05,https://www.bing.com/th?id=OVFT.oXi9PCwu2WDBzVgMMWdawy,Chile,El Heraldo
VETERINARIO ASEGURA QUE UN PERRO MURIÓ CONTAGIADO DE COVID-19 SERÍA PRIMER CASO IDENTIFICADO EN HONDURAS,https://ultimahora.hn/veterinario-asegura-que-un-perro-murio-contagiado-de-covid-19-seria-primer-caso-identificado-en-honduras/,"El veterinario Eleazar Ramos, asegura que un perro en el municipio de Guaimaca, Francisco Morazán, murió contagiado de Covid-19. “Al animalito se le hizo el muestreo de Covid-19 y salió positivo",24-06-2021 15:35,https://www.bing.com/th?id=OVFT.zxfPx1RJoSrUqmpT7DcLRy,Chile,Ultima Hora
Honduras: veterinario confirma muerte de perrito que se contagió de COVID-19,https://tiempo.hn/muere-perrito-por-covid-19-guaimaca-honduras/,"El perrito luchó por más de una semana contra el virus. GUIMACA, HONDURAS. El veterinario hondureño, Eleazar Ramos, confirmó la mañana de este jueves que un perrito falleció a causa de COVID-19 en el",24-06-2021 16:52,https://www.bing.com/th?id=OVFT.KsCfVCzYrAl5bMfPR4o-rC,Chile,Tiempo
"Solicitan ayuda para Adolfo «Gorcha» Collins, ex seleccionado y ex jugador del Vida",https://www.diariomas.hn/2021/06/24/solicitan-ayuda-para-adolfo-gorcha-collins-ex-seleccionado-y-ex-jugador-del-vida/,"Los problemas de salud del ex seleccionado del Vida, Adolfo «Gorcha» Collins no paran y el ex portero también de la Selección Nacional, necesita el apoyode amigos para poder comparar sus medicamentos",24-06-2021 17:02,https://www.bing.com/th?id=OVFT.1CmqAkLEsB-aq-NECIL59S,Chile,Mas
Reportan siete decesos con sospecha de COVID-19 en hospitales capitalinos,https://proceso.hn/reportan-siete-decesos-con-sospecha-de-covid-19-en-hospitales-capitalinos/,"Al menos siete personas perdieron la vida bajo sospecha de la COVID-19 en hospitales de Tegucigalpa, informaron este jueves fuentes de los centros asistenciales.",24-06-2021 17:27,https://www.bing.com/th?id=OVFT.HiG2hgjmm2oPkT7ufoYNMy,Chile,Proceso
"'Tasty Paella', el exitoso y original restaurante de una pareja hondureña en Dallas",https://www.elheraldo.hn/minisitios/hondurenosenelmundo/1472985-471/tasty-paella-restaurante-emprendedores-honduras-estados-unidos-dallas,"TEXAS, ESTADOS UNIDOS.-Disciplina, esfuerzo y pasión por la cocina definen al hondureño Adán Ventura, de 37 años, quien junto a su esposa Yesmin Valladares se han posicionado en el extranjero con su r",24-06-2021 17:31,https://www.bing.com/th?id=OVFT.tollRyrZcO_ILoQHOPhNmi,Chile,El Heraldo
"VARIANTES DE LA COVID-19: ALFA, BETA Y GAMMA CIRCULAN EN HONDURAS",https://ultimahora.hn/variantes-de-la-covid-19-alfa-beta-y-gamma-circulan-en-honduras/,"Alfa, Beta y Gamma circulan en Honduras, confirmaron este jueves la jefa del Laboratorio Nacional de Virología, Mitzi Castro, quien aseguró que se está trabajando para trabajar y dar más",24-06-2021 19:10,https://www.bing.com/th?id=OVFT.kxJGNiczoYiUh5kHGO5RKy,Chile,Ultima Hora
Detectan al primer perro con COVID-19 en Honduras,https://www.latribuna.hn/2021/06/24/detectan-al-primer-perro-con-covid-19-en-honduras/,"Un perro que deambulaba en las afueras de un centro de triaje en el municipio de Guaimaca, Francisco Morazán, dio",24-06-2021 19:14,https://www.bing.com/th?id=OVFT.KaRsLH9TZPZ6rHiBt489OS,Chile,La Tribuna
Confirmaron variantes de COVID-19 en el país,https://www.vtv.com.hn/noticia/confirmaron-variantes-de-covid-19-en-el-pais/,En el documento señalan que a través del Laboratorio Nacional de Virología se han recibido los resultados de las muestras enviadas al Instituto Gorgas de Panamá donde se confirma la presencia de tres,24-06-2021 19:38,https://www.bing.com/th?id=OVFT.TI3hZSgIikiHeJpPkCEyay,Chile,VTV
Sanofi iniciará ensayo en Honduras para su vacuna contra la COVID-19,https://tiempo.hn/sanofi-ensayo-en-honduras-vacuna-covid-19/,"TEGUCIGALPA, HONDURAS. Sanofi, una farmacéutica francesa, iniciará próximamente en Honduras un ensayo clínico de la tercera fase de su vacuna contra el COVID-19. Esta vacuna está basada en proteínas r",24-06-2021 21:00,https://www.bing.com/th?id=OVFT.YDD_NtyjkM2RLfA4UdzDly,Chile,Tiempo
Honduras identifica presencia de variante alfa del nuevo coronavirus,https://abc17news.com/cnn-spanish/2021/06/24/honduras-identifica-presencia-de-variante-alfa-del-nuevo-coronavirus/,"urielblanco (CNN Español) — La Secretaría de Salud de Honduras informó este jueves sobre la circulación de la variante del coronavirus identificada como alfa, una “de preocupación que surgió en el Rei",24-06-2021 21:49,https://www.bing.com/th?id=OVFT.mFY2DobnoiV9wFd0Tb8Gyy,Chile,ABC 17 News
Con nuevas vacunas aplicarán segunda dosis a mayores de 75,https://www.laprensa.hn/honduras/1473332-410/nuevas-vacunas-aplicaran-segunda-dosis-mayores-honduras,Las personas que recibieron la primera inyección de AstraZeneca contra el covid en mayo serán inoculadas con este lote Se está a la espera del segundo componente de la Sputnik-V.,24-06-2021 22:00,https://www.bing.com/th?id=OVFT.P9Ce2ttdil45BzGotJdWKS,Chile,La Prensa Chicos
Honduras recibe 150 mil vacunas contra el Covid-19 donadas por México,https://hondudiario.com/covid-19/honduras-recibe-150000-vacunas-donadas-por-mexico/,"Honduras recibió este jueves 150,000 vacunas contra el coronavirus donadas por el Gobierno de México. Las vacunas de AstraZeneca llegaron con procedencia del Distrito Federal a Palmerola, después de l",24-06-2021 22:07,https://www.bing.com/th?id=OVFT.fQvElgtZO8OK_IleWa5vfC,Chile,Hondudiario
Nadador catracho ganó plata en CCCAN,https://www.diariomas.hn/2021/06/24/nadador-catracho-gano-plata-en-cccan/,"En el segundo día de competencia en el CCCAN de  San Juan de Puerto Rico, el nadador hondureño Omar Oyuela logró el segundo lugar (medalla de plata) en la modalidad de 200 metros combinados individual",24-06-2021 22:59,https://www.bing.com/th?id=OVFT.0R2o4zltD6BrbvTiXY4_Zi,Chile,Mas
"En Honduras circula la variante delta del covid; India identifica la delta plus, mirá de qué se trata",https://www.radiohrn.hn/en-honduras-circula-la-variante-delta-del-covid-india-identifica-la-delta-plus-mira-de-que-se-trata,Autoridades indias dicen que es preocupante pues ya se ha propagado por tres estados apenas en cuestión de días,24-06-2021 23:19,https://www.bing.com/th?id=OVFT.pFTih-TnWFdjGYwedzlmxy,Chile,Radio HRN
Llegan 150.000 dosis de vacunas donadas por México,http://www.eldiario.hn/llegan-150-000-dosis-de-vacunas-donadas-por-mexico/,"Tegucigalpa. - Las 150.000 dosis de vacunas donadas por el Gobierno de México a Honduras arribaron este jueves en un vuelo de la Fuerza Aérea de ese país a la terminal aérea de Palmerola, en Comayagua",25-06-2021 02:11,https://www.bing.com/th?id=OVFT.JlmQVuAdwGpAHN9wO__mVS,Chile,El Diario
Honduras reporta 35 muevas muertes por coronavirus y más de mil contagios en últimas 24 horas,https://hondudiario.com/covid-19/honduras-reporta-35-muevas-muertes-por-coronavirus-y-mas-de-mil-contagios-en-ultimas-24-horas/,"*** La cifra total de personas recuperadas de la enfermedad es de 92,187 en el acumulado. Honduras registró este jueves 1,155 nuevos casos de coronavirus, alcanzando así un total de 256,818 contagios",25-06-2021 02:22,https://www.bing.com/th?id=OVFT.O4BJ07mzcJINmbc5ftO5XS,Chile,Hondudiario
Un 50% más contagian variantes del covid-19,https://www.laprensa.hn/premium/1473364-410/mas-contagian-variantes-covid-19-pandemia-honduras,"Secretaría de Salud confirmó la presencia de tres variantes de preocupación en el territorio: alfa, beta y gamma; y una de interés: B.1.1.519 que predomina en México.",25-06-2021 04:52,https://www.bing.com/th?id=OVFT.851My8f9exHIcJvleWRZ7S,Chile,La Prensa Chicos
"Honduras reporta 6,879 fallecidos por coronavirus desde el inicio de la pandemia",https://www.radiohrn.hn/honduras-reporta-6879-fallecidos-por-coronavirus-desde-el-inicio-de-la-pandemia,"La cifra de fallecidos se elevó a 6 mil 879, con la suma de 35 personas más que perdieron la vida a causa del covid-19",25-06-2021 06:29,https://www.bing.com/th?id=OVFT.BFzXBoaW9O8scciYEc6Oni,Chile,Radio HRN
Recibe alta médica primer paciente de Hongo Negro,https://www.latribuna.hn/2021/06/25/recibe-alta-medica-primer-paciente-de-hongo-negro/,"El primer paciente confirmado con mucormicosis más conocido como “Hongo Negro” en Honduras, asociado al padecimiento del COVID-19, fue dado",25-06-2021 11:10,https://www.bing.com/th?id=OVFT.PAVq4xL-DsNzX00HM-7VYy,Chile,La Tribuna
