name,url,description,datePublished,imagen,pais,Fuente
Gobernador pedirá extensión de sus poderes de emergencia de COVID-19,https://www.elsolnews.com/2021/07/07/gobernador-pedira-extension-de-sus-poderes-de-emergencia-de-covid-19/,"El Gobernador, que ha operado con mayores poderes desde marzo pasado, esbozó algunas razones para mantener sus poderes de emergencia en su lugar. Señaló la flexibilidad necesaria para administrar un l",07-07-2021 19:56,https://www.bing.com/th?id=OVFT.i1TXN8zJHpik2iCaiqz7VS,Chile,El Sol News
Fortalecerán la producción del cacao y el chocolate para reactivar la economía local impactada por la crisis del Covid-19,http://www.elsoldehonduras.com/agroindustria/fortaleceran-la-produccion-del-cacao-y-el-chocolate-para-reactivar-la-economia-local-impactada-por-la-crisis-del-covid-19/,"suscribieron un convenio para la ejecución del proyecto “Fortalecimiento del sector MIPYME para la Activación Económica de Honduras en el contexto del COVID-19”. La Secretaria de Relaciones Exteriores y Cooperación Internacional, firmó como ...",15-07-2021 20:51,https://www.bing.com/th?id=OVFT.RYomqzcZonFwCr17Fcp-7i,Chile,El Sol de Honduras
Juticalpa reporta una muerte por covid-19 cada 72 horas,https://www.elheraldo.hn/pais/1478371-466/juticalpa-muertes-covid-72-horas,Las autoridades sanitarias notificaron que en lo que va del año registran 65 fallecimientos a causa de la enfermedad,15-07-2021 21:16,https://www.bing.com/th?id=OVFT.Ao_5ACxJg5kowAihKp6-zy,Chile,El Heraldo
"Sector turismo del centro del país, se vacunó con primera dosis anticovid",https://www.vtv.com.hn/noticia/sector-turismo-del-centro-del-pais-se-vacuno-con-primera-dosis/,"Con los objetivos de reactivar la actividad comercial del país, salvar empleos y crear nuevas fuentes de trabajo se realiza la intensiva vacunación contra la Covid-19 del sector turismo. En Tegucigalp",15-07-2021 22:51,https://www.bing.com/th?id=OVFT.RQ27ZHnsLwkiablL36QD9S,Chile,VTV
Honduras cerca de los 278 mil contagios y suma 35 nuevas muertes por coronavirus,https://hondudiario.com/covid-19/honduras-cerca-de-los-278-mil-contagios-y-suma-35-nuevas-muertes-por-coronavirus/,"Honduras registró este jueves 985 nuevos casos de coronavirus, alcanzando así un total de 277,974 contagios a nivel nacional, según el último recuento del Sistema Nacional de Gestión de Riesgos (Sinag",16-07-2021 02:28,https://www.bing.com/th?id=OVFT.h-SjuTl2MQvOSvfOz416bC,Chile,Hondudiario
Honduras realizó 2 mil pruebas PCR en las últimas 24 horas para detectar 985 nuevos contagios de covid,https://www.radiohrn.hn/honduras-realizo-2-mil-pruebas-pcr-en-las-ultimas-24-horas-para-detectar-985-nuevos-contagios-de-covid,"Honduras reportó el jueves (15.07.2021), a través del Sistema Nacional de Gestión de Riesgos (Sinager), un acumulado de 276 mil 989 casos positivos de covid-19 desde el inicio de la pandemia en marzo",16-07-2021 03:42,https://www.bing.com/th?id=OVFT.geOvb1X7Oo2IXBssV3AfYy,Chile,Radio HRN
ANEEAH: El 90 % de miembros ya está vacunado,https://tiempo.hn/aneeah-vacunacion-covid-19/,"El 90% de los miembros de la Asociación Nacional de Enfermeras y Enfermeros Auxiliares de Honduras (ANEEAH) ya está vacunado contra el COVID-19, así lo informó ayer el secretario de esa organización, Santiago Martínez, quien expresó su alegría por ...",16-07-2021 13:18,https://www.bing.com/th?id=OVFT.ZKtEKAerL4SU9xtFiN-MtS,Chile,Tiempo
MÁS DE 30.000 POBLADORES DE COLÓN SERÁN INMUNIZADOS AL CONCLUIR QUINTA JORNADA DE VACUNACIÓN,https://ultimahora.hn/mas-de-30-000-pobladores-de-colon-seran-inmunizados-al-concluir-quinta-jornada-de-vacunacion/,"—- A partir del lunes próximo se vacunarán a grupos priorizados como personas que trabajan en turismo, transporte, mercados y otros sectores. Más de 30.000 pobladores del departamento de",16-07-2021 14:01,https://www.bing.com/th?id=OVFT.xex1ibHbJvwGi7hHmtgjdi,Chile,Ultima Hora
Honduras se acerca a los 10 millones de habitantes,https://www.laprensa.hn/honduras/1478349-410/honduras-acerca-10-millones-habitantes-ine-onu,"El 37% de la población está concentrada en Cortés y Francisco Morazán.En 2030, el país tendrá 10.7 millones: 5.2 millones de hombres y 5.5 millones de mujeres.",16-07-2021 16:15,https://www.bing.com/th?id=OVFT.6MC6e1b5skCHJt224mkmnS,Chile,La Prensa Chicos
Comen solos y en habitaciones separadas: Las restricciones a las que se somete la Sub-23 de Honduras en Japón,https://www.diez.hn/laseleccion/1478434-498/honduras-tokio-juegos-olimpicos-restricciones-covid-19-japon-comen-solos-separados-sub23,"Los jugadores hondureños no tienen permitido visitar áreas del hotel adonde no se les haya asignado, incluso en cada mesa solo puede comer un futbolista.",16-07-2021 16:29,https://www.bing.com/th?id=OVFT.1GxGe9l6QvQS2uthUraT4y,Chile,diez.hn
Israel prevé incluir a España en la lista roja de países a los que no viajar,https://www.latribuna.hn/2021/07/16/israel-preve-incluir-a-espana-en-la-lista-roja-de-paises-a-los-que-no-viajar/,"Jerusalén, 16 jul (EFE).- El Ministerio de Salud propuso hoy incluir España en la lista roja de países a los que sus nacionales y residentes tiene vetado viajar, debido a la «extrema tasa de infección",16-07-2021 16:55,https://www.bing.com/th?id=OVFT.b0ANR_G-vYfjTsq0N6AYli,Chile,La Tribuna
Honduras encara pico de pandemia con solo 5 camas UCI,https://proceso.hn/honduras-encara-pico-de-pandemia-con-solo-5-camas-uci/,Honduras vive un repunte de la pandemia sin lograr equipar el proceso de vacunación contra la COVID-19 y con acciones negativas como el cierre de más de 100 triajes por falta de presupuesto. Así lo revela el último boletín hospitalario de la ...,16-07-2021 17:56,https://www.bing.com/th?id=OVFT.Y5UnCz9d8_oLemay3HJR5C,Chile,Proceso
"Ninrod Medina, asistente técnico del Motagua, ha sido internado por Covid-19, pero está estable",https://www.diez.hn/liganacionaldehonduras/1478461-498/ninrod-medina-motagua-infectado-covid-19-hospitalizado-liga-nacional,"Medina, que es la mano derecha del argentino Diego Vázquez en el cuerpo técnico del equipo azul fue infectado de Covid-19, por lo que se encuentra actualmente ... El actual subcampeón de la Liga Nacional de Honduras está en plena pretemporada con ...",16-07-2021 17:57,https://www.bing.com/th?id=OVFT.1yAc4ngZpJzC8Ce5SKhLwS,Chile,diez.hn
Bicolor espera completar doble turno a pesar de la tormenta eléctrica en Houston,https://www.diariomas.hn/2021/07/15/bicolor-espera-completar-doble-turno-a-pesar-de-la-tormenta-electrica-en-houston/,"La Selección Nacional de Honduras que alista detalles para enfrentar el sábado a su similar de Panamá en la segunda jornada del Grupo D de la Copa Oro realizó doble entrenamiento, pero el nocturno se",16-07-2021 20:01,https://www.bing.com/th?id=OVFT.eBQcPRsNT3SEHUFNwnAMhy,Chile,Mas
Ninrod Medina interno por Covid-19,https://www.diariomas.hn/2021/07/16/ninrod-medina-interno-por-covid-19/,"El asistente técnico del Motagua, Ninrod Medina, se encuentra hospitalizado en una clínica privada de la ciudad tras haber dado positivo del coronavirus ... 🏼🦖💚 #MonstruoVerde #SanPedroSula #Honduras pic.twitter.com/eB0ewDhnAs — CD Marathón ...",16-07-2021 20:19,https://www.bing.com/th?id=OVFT.pWJTDq3wO1CWCGPVjV-kwC,Chile,Mas
CANCELAN EL CARNAVAL DE TEGUCIGALPA POR SEGUNDO AÑO CONSECUTIVO,https://ultimahora.hn/cancelan-el-carnaval-de-tegucigalpa-por-segundo-ano-consecutivo/,"La alcaldesa por ley del Distrito Central, Eva López, informó que se cancela por segundo año consecutivo el carnaval de la capital porque la pandemia del COVID-19 sigue afectando fuertemente el",16-07-2021 20:22,https://www.bing.com/th?id=OVFT.DvTUcRBODIWVlrSdRKUBaS,Chile,Ultima Hora
Colegio de Microbiólogos y Químicos rechaza que terceros realicen las muestras de COVID-19,https://proceso.hn/colegio-de-microbiologos-y-quimicos-rechaza-que-terceros-realicen-las-muestras-de-covid-19/,"“Queremos dejar claro nuestra posición en contra de la improvisación en este proceso de captación de muestras, enfatizando el riesgo que existe en disminuir la confianza de los resultados”, cita",16-07-2021 22:54,https://www.bing.com/th?id=OVFT.oTwD5zL_DfzYs6CGfoR62i,Chile,Proceso
Salud inmuniza al 100% el primer centenar de policías contra la covid-19,http://www.elsoldehonduras.com/nacionales/salud-inmuniza-al-100-el-primer-centenar-de-policias-contra-la-covid-19/,"La Secretaría de Salud, en el marco de la Quinta Jornada de Vacunación, inmunizó al 100 % este viernes el primer centenar de policías de la zona norte del país con la segunda dosis de AstraZeneca. Los",16-07-2021 23:04,https://www.bing.com/th?id=OVFT.qrZCOBAumyTITUXXZOefry,Chile,El Sol de Honduras
Ofrecen certificados falsos de vacunación anticovid en pleno centro de Ciudad de México,https://www.laprensa.hn/mundo/1478525-410/certificados-anticovid-falsos-mexico,"En un céntrico barrio de Ciudad de México, un hombre ofrece certificados falsos de vacunación contra el covid-19 a quienes lo requieren para ... Sputnik V en un avión privado con destino a Honduras. El Fondo de Inversión Directa de Rusia confirmó ...",16-07-2021 23:13,https://www.bing.com/th?id=OVFT.UKYQJDghDve165W1e-Rz4y,Chile,La Prensa Chicos
Calendario de vacunación para segunda dosis de Pfizer y Moderna,https://www.elheraldo.hn/interactivos/1478522-529/calendario-de-vacunaci%C3%B3n-para-segunda-dosis-de-pfizer-y-moderna,"De interés: Preocupa en Honduras muertes por covid-19 en mayores de 60 años Los trabajadores de la salud que recibieron una dosis de Moderna en la capital el pasado 30 de junio podrán completar el esquema el 27 de julio, mientras que los trabajadores ...",16-07-2021 23:25,https://www.bing.com/th?id=OVFT.jfariCS-cH5_xT_jnUOlrC,Chile,El Heraldo
ENEE anuncia varios apagones masivos en Honduras este sábado,https://tiempo.hn/cortes-electricos-sabado-16-julio-2021-honduras/,"Bastantes lugares de Honduras aquejarán este sábado interrupciones al servicio energético. ¿Está su vecindario en la lista? Le contamos. TEGUCIGALPA, HONDURAS. Este sábado la interrupción al servicio",17-07-2021 02:32,https://www.bing.com/th?id=OVFT.Jc4zapwdoYwHebbTLTpyey,Chile,Tiempo
"Más de 400 mil vacunados con una dosis en la capital, pero el COVID no retrocede",https://hondudiario.com/covid-19/mas-de-400-mil-vacunados-con-una-dosis-en-la-capital-pero-el-covid-no-retrocede/,"Más de un millón de personas recibieron al menos la primera dosis de la vacuna contra el Covid-19, representando el 11 por ciento ... Hasta la 8:00 de la noche del 16 de julio, Honduras registró 985 nuevos casos de coronavirus, alcanzando así un ...",17-07-2021 02:42,https://www.bing.com/th?id=OVFT.ZvzpvbyhTEF6DgA1YcUNey,Chile,Hondudiario
