name,url,description,datePublished,imagen,pais,Fuente
Honduras identifica presencia de variante alfa del nuevo coronavirus,https://abc17news.com/cnn-spanish/2021/06/24/honduras-identifica-presencia-de-variante-alfa-del-nuevo-coronavirus/,"urielblanco (CNN Español) — La Secretaría de Salud de Honduras informó este jueves sobre la circulación de la variante del coronavirus identificada como alfa, una “de preocupación que surgió en el Rei",24-06-2021 21:49,https://www.bing.com/th?id=OVFT.mFY2DobnoiV9wFd0Tb8Gyy,Chile,ABC 17 News
HONDURAS / LIBERADA “ENGELS” SIN “PECES GORDOS” DEL GOBIERNO HERNÁNDEZ,http://www.web.ellibertador.hn/index.php/noticias/nacionales/3027-honduras-liberada-engels-sin-peces-gordos-del-gobierno-hernandez,"Después de generar altas expectativas con el listado “Engels”, finalemente este jueves el Departamento de Estado de los Estados Unidos, ha liberado los nombres de políticos corruptos del Triángulo Norte; en el caso de Honduras, no aparece ningún ...",01-07-2021 17:26,https://www.bing.com/th?id=OVFT.T36qXh1-jR96tMdJl0T6Pi,Chile,El Libertador
Microbiólogos: Pacientes con COVID-19 presentan ahora 10 veces más carga viral,https://tiempo.hn/pacientes-covid-19-carga-viral-honduras/,"TEGUCIGALPA. Hasta 10 veces más es la carga viral que presentan los pacientes con COVID-19, manifestó la doctora Miriam Aguilar, vocera del Colegio de Microbiólogos de Honduras. «En la prueba de antíg",01-07-2021 22:21,https://www.bing.com/th?id=OVFT.Nfo0NXtB8uKUP5zU-j_ttS,Chile,Tiempo
"PRESIDENTE HERNÁNDEZ EN OLANCHITO: «SI QUEREMOS RESULTADOS DIFERENTES, DEBEMOS TRABAJAR CON LAS ZONAS DE EMPLEO”",https://ultimahora.hn/presidente-hernandez-en-olanchito-si-queremos-resultados-diferentes-debemos-trabajar-con-las-zonas-de-empleo/,"El presidente Juan Orlando Hernández aseguró este jueves en Olanchito, departamento de Yoro, que si Honduras aspira a resultados diferentes en generación de empleos debe optar por las Zonas de",01-07-2021 22:30,https://www.bing.com/th?id=OVFT.gv-6BunhMLvvI7luGtjmNC,Chile,Ultima Hora
Miguel Falero integra tres nuevos jugadores a la Sub-23; Kervin Arriaga sigue al margen de los entrenamientos,https://www.diez.hn/laseleccion/1474983-498/miguel-falero-integra-tres-nuevos-jugadores-a-la-sub-23-kervin-arriaga-sigue,"Después de los 15 futbolistas que convocaron el domingo, ahora hay tres nuevos jugadores se han integrado a los trabajos de la Sub-23.",01-07-2021 22:33,https://www.bing.com/th?id=OVFT.fYh5WONhnJGIVMNH2pOuDi,Chile,diez.hn
Choluteca registra en una semana cifra récord de casos de covid-19,https://www.elheraldo.hn/pais/1475058-466/choluteca-cifra-record-covid-honduras,"El municipio sureño concentra el 70% de los casos semanales del departamento. Para hacerle frente, las autoridades locales decidieron prohibir eventos sociales, deportivos y restringir la circulación",01-07-2021 22:49,https://www.bing.com/th?id=OVFT.zpTtcdzsJbntEXTcXNpJOC,Chile,El Heraldo
SESAL ampliará número de camas en hospitales de Honduras,https://www.vtv.com.hn/noticia/sesal-ampliara-numero-de-camas-en-hospitales-de-honduras/,"A pesar de que Honduras desarrolla la quinta campaña de vacunación contra el Covid-19, se reporta una alta ocupación hospitalaria por contagios. Para contrarrestar el avance de la pandemia, el gobiern",01-07-2021 23:00,https://www.bing.com/th?id=OVFT.FCU-Eu_SL5Pb7l_4efC6DS,Chile,VTV
La H Olímpica llevará 22 jugadores a Tokio 2020; ya hay fecha para la convocatoria final,https://www.radiohrn.hn/la-h-olimpica-llevara-22-jugadores-a-tokio-2020-ya-hay-fecha-para-la-convocatoria-final,La Federación Nacional de Fútbol de Honduras (Fenafuth) anunció el miércoles (30.06.2021) que el listado final de los jugadores que viajarán a Japón para disputar el torneo masculino de fútbol en los,01-07-2021 23:37,https://www.bing.com/th?id=OVFT.5PMBpeIiad4OBQPHDHOipS,Chile,Radio HRN
"La cifra de infectados por covid aumentó a 263,376 y los fallecidos a 7,030 en Honduras",https://www.radiohrn.hn/la-cifra-de-infectados-por-covid-aumento-a-263376-y-los-fallecidos-a-7030-en-honduras,"La cifra de fallecidos se elevó a 7,030 con la suma de 25 personas más que perdieron la vida a causa del covid-19. Mientras, que los recuperados del nuevo virus se aumentó a 92",02-07-2021 03:26,https://www.bing.com/th?id=OVFT.zLWwJPAOYFYQ-a8pw_4EUS,Chile,Radio HRN
Julio inicia con 25 muertos y 616 nuevos contagios de la COVID-19 en Honduras,https://proceso.hn/julio-inicia-con-25-muertos-y-616-nuevos-contagios-de-la-covid-19-en-honduras/,"Honduras inició julio con 25 muertos a causa de la COVID-19 y 616 nuevos contagios por la enfermedad, informó este jueves el estatal Sistema Nacional de Gestión de Riesgos (Sinager).",02-07-2021 03:38,https://www.bing.com/th?id=OVFT._MPRnv9WYRFXW1DqjLjg6C,Chile,Proceso
Ajuste a tarifa de energía eléctrica debe apegarse al momento actual del país,http://www.eldiario.hn/ajuste-a-tarifa-de-energia-electrica-debe-apegarse-al-momento-actual-del-pais/,Tegucigalpa. - El presidente Juan Orlando Hernández afirmó este jueves que el ajuste a la tarifa de energía eléctrica debe apegarse a la situación actual del país para no afectar la recuperación econó,02-07-2021 04:13,https://www.bing.com/th?id=OVFT.sO0wkC3NxDgSVUOv1gXytS,Chile,El Diario
Honduras inicia julio con 25 muertos y 616 nuevos contagios de la covid-19,https://www.latribuna.hn/2021/07/01/honduras-inicia-julio-con-25-muertos-y-616-nuevos-contagios-de-la-covid-19/,"Honduras inició julio con 25 muertos a causa de la covid-19 y 616 nuevos contagios por la enfermedad, informó este",02-07-2021 04:32,https://www.bing.com/th?id=OVFT.kBV0y3V2pXwuQ5CTt_ta9C,Chile,La Tribuna
"""Combinación de AstraZeneca y Pfizer es buena para combatir el Covid-19"": Salvador Moncada",https://www.laprensa.hn/honduras/1475140-410/combinacion-vacunas-covid-pandemia-corornavirus-salvador-moncada-astrazeneca-pfizer-moderna,"El hondureño Sir Salvador Moncada, explico que la combinación de las vacunas de AstraZeneca y Pfizer es buena y efectiva para combatir el Covid-19. Honduras ha recibido lotes de vacunas tanto de Astra",02-07-2021 12:08,https://www.bing.com/th?id=OVFT.5uaPZ80CriOjbU92SBEcRC,Chile,La Prensa Chicos
Honduras tiene cartera de proyectos más grande de Centroamérica con el BCIE,https://www.laprensa.hn/honduras/1475145-410/honduras-tiene-cartera-de-proyectos-m%C3%A1s-grande-de-centroam%C3%A9rica-con-el-bcie,"En 2020, el apoyo del BCIE hacia Honduras estuvo enfocado en la respuesta a la emergencia por la pandemia de covid-19, lo mismo que para 2021, añadió.",02-07-2021 12:08,https://www.bing.com/th?id=OVFT.utBNOxc72NiOeQbPvBpNQi,Chile,La Prensa Chicos
"Contagios de coronavirus suben a 263,376 y las muertes ya son 7,030 a nivel nacional",https://hondudiario.com/covid-19/contagios-de-coronavirus-suben-a-263376-y-las-muertes-ya-son-7030-a-nivel-nacional/,"*** Las muertes sólo en 2021 suman un total de 3,771 a nivel nacional. Honduras registró en las últimas horas 616 nuevos casos de coronavirus, alcanzando así un total de 263,376 contagios a nivel naci",02-07-2021 14:35,https://www.bing.com/th?id=OVFT.I9u56i87_9Q-LvpNxQr0aS,Chile,Hondudiario
"En seis meses de 2021, hay más casos y muertes por COVID-19 que en 2020",https://tiempo.hn/muertes-y-casos-de-covid-19-2021-honduras/,"TEGUCIGALPA, HONDURAS. Los primeros seis meses del año 2021 superan la positividad de casos y muertes por COVID-19, en comparación a los nueve meses de pandemia en 2020 desde que llegó el virus a Hond",02-07-2021 17:40,https://www.bing.com/th?id=OVFT.5seVOXsDdW4-YXS5mguIgi,Chile,Tiempo
Los 22 futbolistas convocados por Honduras para los Juegos Olímpicos de Tokio 2021,https://www.diez.hn/laseleccion/1475104-498/22-convocados-honduras-juegos-olimpicos-tokio-2021-miguel-falero,"Miguel Falero, entrenador de Honduras, brindó este viernes el listado final de los futbolistas que asistirán a los Juegos Olímpicos a realizarse este mes en Tokio, Japón.",02-07-2021 17:41,https://www.bing.com/th?id=OVFT.5ETm9FNyakEyili_J-8vgC,Chile,diez.hn
Honduras se fogueará ante Japón y Alemania previo a los JJOO,https://www.diariomas.hn/2021/07/02/honduras-se-fogueara-ante-japon-y-alemania-previo-a-los-jjoo/,La selección de Honduras previo a su debut en los Juegos Olímpicos de Tokio tendrá dos amistosos de lujo. Los dirigidos por Miguel Falero jugarán primero ante Japón el día el lunes 12 de julio en el e,02-07-2021 18:06,https://www.bing.com/th?id=OVFT.pDen6SARmNKwAZ76WzdhfS,Chile,Mas
Falta de pago a médicos amenaza salud pública de Honduras,https://proceso.hn/falta-de-pago-a-medicos-amenaza-salud-publica-de-honduras/,"Ante la falta de pagos los médicos no pueden seguir en sus puestos de trabajo ya que deben asumir gastos de transporte, alimentación y compra de equipo de bioseguridad.",02-07-2021 18:30,https://www.bing.com/th?id=OVFT.VMqO7iqN2_U8tK4qG183nS,Chile,Proceso
Alejandro Obando gana en dobles y singles en Copa Davis ante trinitecos,https://www.diariomas.hn/2021/07/02/alejandro-obando-gana-en-dobles-y-singles-en-copa-davis-ante-trinitecos/,"El tenista hondureño Alejandro Obando sigue destacando en Copa Davis, hoy ganó en singles y dobles acompañado de Kenny Turcios, raqueta uno de Honduras, al enfrentar al equipo de Trinidad Tobago, dond",02-07-2021 19:11,https://www.bing.com/th?id=OVFT.vYt8JGi56lDiWlPoEEG10C,Chile,Mas
El cierre de municipios ya no es una solución a la pandemia,https://hondudiario.com/covid-19/el-cierre-de-municipios-ya-no-es-una-solucion-a-la-pandemia/,"La epidemióloga, Silvia Portillo, es del criterio que el cierre parcial de municipios en el país no es una solución a la pandemia del COVID-19. Esto, ante el anuncio del municipio de El Paraíso hizo p",02-07-2021 19:23,https://www.bing.com/th?id=OVFT.KK3nJO7_j0csrlR26Ng1ly,Chile,Hondudiario
Salud: Honduras se acerca al millón de personas vacunadas contra la COVID-19,https://www.latribuna.hn/2021/07/02/salud-honduras-se-acerca-al-millon-de-personas-vacunadas-contra-la-covid-19/,Autoridades de Salud informaron este viernes que Honduras se acerca al millón de personas vacunadas contra la COVID-19. En comparecencia,02-07-2021 20:25,https://www.bing.com/th?id=OVFT.TUocml-S94e85kOhy1P7Hy,Chile,La Tribuna
