name,url,description,datePublished,imagen,pais,Fuente
NO FUE REAL: Una mirada a lo que no sucedió esta semana,https://www.registercitizen.com/news/article/NO-FUE-REAL-Una-mirada-a-lo-que-no-sucedi-esta-16123430.php,"Además, el especialista explicó que sí ha trabajado como observador electoral de la OEA en elecciones de El Salvador, Perú y Honduras, pero no estuvo presente ... cáncer, SIDA y COVID-19, pero estos no pueden pagar a los donantes para obtener el ...",23-04-2021 14:23,https://www.bing.com/th?id=OVFT.3VqLzsloi5sAK0Jk-rHrFi,Chile,The Register Citizen
El sentido mensaje de Amado Guevara por la muerte de su amigo Roy Posas,https://www.elheraldo.hn/deportes/1460933-466/mensaje-amado-guevara-muerte-roy-posas-motagua-honduras,"El excapitán de la H y del Motagua lamentó la partida del preparador de arqueros, con quien compartió muchas vivencias tanto en la Bicolor como en el ciclón azul",01-05-2021 16:58,https://www.bing.com/th?id=OVFT.GnuZjz7souMtl0WGx1586C,Chile,El Heraldo
Día del Trabajador en Honduras,https://www.vtv.com.hn/noticia/dia-del-trabajo-en-honduras/,"Con manifestaciones pacíficas se ha celebrado el Día del Trabajador en Tegucigalpa y en Honduras. Las distintas organizaciones obreras, campesinas y también de grupos étnicos han desfilado por las pri",01-05-2021 16:59,https://www.bing.com/th?id=OVFT.emKd67xzgpEghU1t2uJtbi,Chile,VTV
"Falleció ex preparador de porteros de la Selección Nacional, Roy Posas",https://www.diariomas.hn/2021/05/01/fallecio-ex-preparador-fisico-de-la-seleccion-roy-posas/,"Fuentes cercanas a la familia de Roy Orlando Posas, ex portero de Marathon y Atlético Indio, informaron que falleció esta mañana en el Seguro",01-05-2021 19:52,https://www.bing.com/th?id=OVFT.5_r7-7TzFsVSJdTTl-5iiS,Chile,Mas
EN VIVO: Olimpia y Real España llegan al estadio Olímpico para enfrentarse por la final de grupos,https://www.diez.hn/liganacionaldehonduras/1460794-498/real-espana-olimpia-en-vivo-online-transmision-liga-nacional-honduras-pedro-troglio,"4:15 PM: DIEZ ha confirmado el 11 del Olimpia, Edrick Menjívar aparece bajo los tres palos. Línea de cuatro con Maylor Núñez como carrilero derecho, Elvin Casildo y Jhony Leverón en la zaga central y",01-05-2021 22:31,https://www.bing.com/th?id=OVFT.x56UKTwR39MonfNpG1WKJy,Chile,diez.hn
COVID-19 en niños: ¿cuántos menores han muerto por el virus en Honduras?,https://tiempo.hn/menores-muertos-por-covid-19-honduras/,"TEGUCIGALPA, HONDURAS. Según el Sistema Nacional de Gestión de Riesgos (Sinager), en Honduras, hasta el jueves 29 de abril, 106 menores habrían fallecido a causa del covid-17, pero el con el deceso de",02-05-2021 02:38,https://www.bing.com/th?id=OVFT.J6cIykwM8dSpOh9bpZ8IQy,Chile,Tiempo
"Sinager reporta un total de 213,167 casos de covid-19 en Honduras",https://www.radiohrn.hn/sinager-reporta-un-total-de-213167-casos-de-covid-19-en-honduras,"Según reporte del Sinager para el 1 de mayo de 2021, en Honduras se registran un total de 213,167 casos de covid-19. El informe detalla que se confirmaron 834 nuevos casos del virus que sigue enlutand",02-05-2021 03:19,https://www.bing.com/th?id=OVFT.Q4JR_q-vGXQT6yFClSKebi,Chile,Radio HRN
COVID-19| Hay más de 212 mil casos: ¿cuál ha sido el mes con más contagios?,https://tiempo.hn/mes-casos-covid-honduras-212-mil-casos/,"TEGUCIGALPA, HONDURAS. El mes de enero del 2021 es el mes con mayor número de contagios y fallecimientos por covid-19, según el investigador Efraín Farach. Asimismo, informó que los casos aumentaron u",02-05-2021 05:16,https://www.bing.com/th?id=OVFT.X0nqbu-SEIWZzogKhZ9Qwy,Chile,Tiempo
Honduras supera las cinco mil 300 muertes por Covid-19,https://www.laprensa.hn/honduras/1461016-410/honduras-muertos-covid-contagios-covid-pandemia-coronavirus,"Honduras sumó este sábado 834 nuevos contagios de la covid-19 y registró 37 muertes más por la enfermedad, lo que eleva a 213.167 contagios confirmados y 5.318 los fallecidos, informaron las autoridad",02-05-2021 10:03,https://www.bing.com/th?id=OVFT.jj8_DJ-DkY-ZYfE2v6YlBi,Chile,La Prensa Chicos
Fallece por Covid-19 esposa del pastor y expositor Arturo López Malumbres,https://www.laprensa.hn/honduras/1461023-410/muere-covid-esposa-arturo-lopez-malumbres-expositor-partor-honduras-covid-olga-carolina-villalobos,"El virus atacó al matrimonio y a sus dos hijas, situación que los mantuvo en una constante lucha por varias semanas.",02-05-2021 10:51,https://www.bing.com/th?id=OVFT.t72O_JlnxIiuwjZqvZRn-y,Chile,La Prensa Chicos
Honduras acumula 5.318 muertes y 213.167 casos de la Covid-19,https://hondudiario.com/2021/05/02/honduras-acumula-5-318-muertes-y-213-167-casos-de-la-covid-19/,"El Sistema Nacional de Gestión de Riesgos (Sinager), informó que los casos de COVID-19 en Honduras ascendieron a 213, 167. Para diagnosticar los nuevos casos, el Laboratorio Nacional de Virología proc",02-05-2021 15:27,https://www.bing.com/th?id=OVFT.xD2e4vhJ8o6n84XQvxlXDC,Chile,Hondudiario
"Jorge Benguché, de goleador en el Olimpia a no estar ni entre los convocados en el Boavista de Portugal",https://www.diez.hn/legionarios/1461048-498/jorge-benguch%C3%A9-de-goleador-en-el-olimpia-a-no-estar-ni-entre,El delantero hondureño Jorge Benguché no fue convocado por Boavista para el juego ante Santa Clara que terminó empatado 3-3 con doblete de Alberth Elis.,02-05-2021 18:04,https://www.bing.com/th?id=OVFT.43MuzspKAOOfDW5SHX2PtS,Chile,diez.hn
El SAR pone trabas para la declaración de pérdidas operativas,https://www.elheraldo.hn/economia/1461152-466/sar-declaracion-perdidas-honduras-impuesto,"El sector privado afirma que las autoridades del SAR están exigiendo documentos y requisitos que no establece la ley, lo que les impide cumplir",03-05-2021 08:08,https://www.bing.com/th?id=OVFT.RbWLxoWd7aT0EVOJhzwKrS,Chile,El Heraldo
"“Tecnoestrés”, el nuevo mal que afecta hondureños",https://www.latribuna.hn/2021/05/03/tecnoestres-el-nuevo-mal-que-afecta-hondurenos/,"Con el alto uso de los aparatos electrónicos, el teletrabajo y las clases en línea, por la pandemia del COVID-19,",03-05-2021 11:30,https://www.bing.com/th?id=OVFT.fjqzHEW1Pv1PLThtF3ttAS,Chile,La Tribuna
BONOS DE SOLIDARIDAD PRODUCTIVA Y CAFETALERO BRINDAN SEGURIDAD ALIMENTARIA EN TODO EL PAÍS,https://ultimahora.hn/bonos-de-solidaridad-productiva-y-cafetalero-brindan-seguridad-alimentaria-en-todo-el-pais-2/,"Los bonos de Solidaridad Productiva y Cafetalero brindan seguridad alimentaria en todas las regiones del país, gracias a la visión del presidente Juan Orlando Hernández. En menos de siete años de",03-05-2021 14:01,https://www.bing.com/th?id=OVFT.Yblf0NQ8s4cmuZckE9AInS,Chile,Ultima Hora
"Honduras eleva la cifra de contagiados por covid-19 a 213,970",https://www.radiohrn.hn/honduras-eleva-la-cifra-de-contagiados-por-covid-19-a-213970,"El comunicado indicó que la cifra total de fallecidos por covid es de 5,334 con 290 decesos confirmados. Mientras que, la cifra de personas que vencieron el virus ascendió en 79",03-05-2021 14:09,https://www.bing.com/th?id=OVFT.x-nbytBbJfXxlZ1kgNkLci,Chile,Radio HRN
CIUDAD MUJER CHOLUTECA SE PREPARA PARA ATENDER A MÁS DE 200.000 SUREÑAS,https://ultimahora.hn/ciudad-mujer-choluteca-se-prepara-para-atender-a-mas-de-200-000-surenas/,"El sexto complejo de Ciudad Mujer a nivel nacional tendrá cobertura en municipios de Choluteca, Valle y El Paraíso. Féminas podrán acceder a más de 40 servicios al año que se brindarán en este",03-05-2021 14:40,https://www.bing.com/th?id=OVFT.mdDi7rgcIF9BmKpib9hofi,Chile,Ultima Hora
Reportan 20 decesos con sospecha de COVID-19 en hospitales del país,https://proceso.hn/reportan-20-decesos-con-sospecha-de-covid-19-en-hospitales-del-pais/,"Al menos 20 personas perdieron la vida en las últimas 24 horas, bajo sospecha de la COVID-19 en hospitales de Tegucigalpa y Santa Bárbara, informaron este lunes fuentes de los centros",03-05-2021 15:10,https://www.bing.com/th?id=OVFT.HiG2hgjmm2oPkT7ufoYNMy,Chile,Proceso
Cinco pacientes con COVID-19 en Asilo de Ancianos San Felipe; uno falleció,https://www.latribuna.hn/2021/05/03/cinco-pacientes-con-covid-19-en-asilo-de-ancianos-san-felipe-uno-fallecio-el-fin-de-semana/,"El jefe de la Región Sanitaria Metropolitana del Distrito Central, Harry Bock, informó este lunes que cinco personas resultaron positivas",03-05-2021 15:30,https://www.bing.com/th?id=OVFT.nQTXz-vbE7HDE4QYeSfdii,Chile,La Tribuna
Honduras supera la cifra de más de 8 mil casos de niños con Covid-19 y al menos 8 muertos,https://www.vtv.com.hn/noticia/honduras-supera-la-cifra-de-mas-de-8-mil-casos-de-ninos-con-covid-19-y-al-menos-8-muertos/,"Según el coordinador de Vigilancia de virus y otras enfermedades de la Secretaría del país, Homer Mejía, en lo que va del año al menos unos ocho mil niños se han contagiado de Coronavirus, debido a la",03-05-2021 15:53,https://www.bing.com/th?id=OVFT.nZHX0KfwQhV6Z4E6yErUBC,Chile,VTV
Gobierno y población deben aumentar esfuerzos para evitar «catástrofe» por COVID-19,https://hondudiario.com/2021/05/03/gobierno-y-poblacion-deben-aumentar-esfuerzos-para-evitar-catastrofe-por-covid-19/,"***Los decesos por Covid-19 continuarán en aumento en los diferentes centros asistenciales del país, sostuvo Ramos. La presidenta de la Asociación de Médicos del Instituto Hondureño de Seguro Social (",03-05-2021 16:16,https://www.bing.com/th?id=OVFT.0KIKkEPnsbQtaha1oAaRjC,Chile,Hondudiario
