name,url,description,datePublished,imagen,pais,Fuente
Honduras identifica presencia de variante alfa del nuevo coronavirus,https://abc17news.com/cnn-spanish/2021/06/24/honduras-identifica-presencia-de-variante-alfa-del-nuevo-coronavirus/,"urielblanco (CNN Español) — La Secretaría de Salud de Honduras informó este jueves sobre la circulación de la variante del coronavirus identificada como alfa, una “de preocupación que surgió en el Rei",24-06-2021 21:49,https://www.bing.com/th?id=OVFT.mFY2DobnoiV9wFd0Tb8Gyy,Chile,ABC 17 News
Cohep entrega propuesta a candidatos presidenciales de Honduras,https://www.laprensa.hn/honduras/1474390-410/cohep-entrega-propuesta-candidatos-presidenciales-honduras,"El documento prioriza ocho ejes transversales con más de 64 propuestas y fue entregado a los candidatos por el titular del Consejo Hondureño de la Empresa Privada (Cohep), Juan Carlos Sikaffy.",29-06-2021 16:06,https://www.bing.com/th?id=OVFT.zGaSOzTgR7w4kbzy7dw9Iy,Chile,La Prensa Chicos
Victoria invitado a una gira por New Orleans,https://www.diariomas.hn/2021/06/29/victoria-invitado-a-una-gira-por-new-orleans/,"El nuevo inquilino de la Liga Nacional, el Club Deportivo Victoria, se alista para un partido amistoso en la Ciudad de New Orleans, Estados Unidos para jugar contra una selección local con el objeto d",29-06-2021 16:32,https://www.bing.com/th?id=OVFT.exJCJETNNFATPOKHa3UThy,Chile,Mas
SIN FECHA DE LLEGADA DE VACUNAS SPUTNIKV RECONOCE DOCTOR HARRY BOCK,https://ultimahora.hn/sin-fecha-de-llegada-de-vacunas-sputnikv-reconoce-doctor-harry-bock/,"El jefe de la Región Metropolitana de Salud, Harry Bock, informó que no hay fecha de ingreso de la vacuna contra la covid-19 Sputnik V porque el proveedor le está quedando mal a Honduras como a",29-06-2021 18:15,https://www.bing.com/th?id=OVFT.gCNWAXGCxP9UzrvH6axj3S,Chile,Ultima Hora
Selección Sub-23 de Honduras podría aumentar su listado y llevar 22 jugadores a los Juegos Olímpicos de Tokio,https://www.diez.hn/laseleccion/1474335-498/seleccion-olimpica-honduras-juegos-tokio-miguel-falero-convocatoria-futbolistas-japon-futbol,"La FIFA se plantea ampliar la lista y permite añadir a cuatro suplentes, que podrían pasar a fijos si se aprueba la iniciativa, lo que sería una gran noticia para Honduras.",29-06-2021 19:54,https://www.bing.com/th?id=OVFT.3iyaORFhHTE2o7Z_RSx3ZS,Chile,diez.hn
"Honduras recibirá el miércoles 59,670 vacunas contra el coronavirus de Pfizer-BioNTech",https://www.elheraldo.hn/pais/1474435-466/vacuna-pfizer-biontech-coronavirus-honduras-joh,Este es un primer lote de las 4.4 millones de vacuna que el gobierno de Honduras le compró a la empresa estadounidense,29-06-2021 19:54,https://www.bing.com/th?id=OVFT.CfWeU10WAE6fiZgG5UG5wi,Chile,El Heraldo
Obispo Ángel Garachana: El gobierno debe de escuchar el clamor de la población y que detenga todo esto de las ZEDE,https://www.radiohrn.hn/obispo-angel-garachana-el-gobierno-debe-de-escuchar-el-clamor-de-la-poblacion-y-que-detenga-todo-esto-de-las-zede,"Con relación a la jornada de vacunación contra el covid-19, comentó que se ha manejado equivocadamente. Aquí todo lo que dijo",29-06-2021 20:07,https://www.bing.com/th?id=OVFT.K0G6m4qHD-76JbnLl3JJOi,Chile,Radio HRN
Estados Unidos aliado en la pandemia,https://www.vtv.com.hn/noticia/estados-unidos-aliado-en-la-pandemia/,En San Pedro Sula aterrizaron los aviones de la esperanza: Un millón y medio de vacunas contra el Covid-19 donado por Estados Unidos al gobierno de Honduras que servirá para inmunizar a 750 mil person,29-06-2021 21:51,https://www.bing.com/th?id=OVFT.p3hx5mQBtcUQcBkiworRyC,Chile,VTV
Gracias tendrá el primer museo de interpretación e historia de Honduras,https://www.laprensa.hn/honduras/1474467-410/gracias-tendra-primer-museo-interpretacion-historia-honduras,"GRACIAS. Ubicado en el centro histórico de Gracias se encuentra el que será el primer museo de interpretación e historia del país: el museo Casa Galeano, el cual abrirá sus p",29-06-2021 22:00,https://www.bing.com/th?id=OVFT.DmjvzAxmDlJHqtEwjhp3Mi,Chile,La Prensa Chicos
Honduras: Inicia recuento de las pérdidas en cultivos por sequías,https://www.elheraldo.hn/pais/1474545-466/recuento-perdidas-cultivos-corredor-seco-honduras-,Las autoridades de la SAG y de Cenaos junto a los agricultores van a reunión de emergencia para medir las pérdidas y fijar las nuevas fechas de siembra,29-06-2021 23:53,https://www.bing.com/th?id=OVFT.3A7EPvvvJlR9Qc57FVv2MC,Chile,El Heraldo
"Sinager reporta 262,069 infectados por covid, de los cuales 92,403 vencieron el virus",https://www.radiohrn.hn/sinager-reporta-262069-infectados-por-covid-de-los-cuales-92403-vencieron-el-virus,"Los recuperados del nuevo virus se aumentó a 92 mil 403, con el reporte de 87 hondureños más que lograron vencer la enfermedad",30-06-2021 03:11,https://www.bing.com/th?id=OVFT.ZGDFpcnApmw7GlWTzeUeEi,Chile,Radio HRN
Casos de COVID-19 suben a 262 mil 069 al confirmarse 1 mil 188 nuevos contagios,https://proceso.hn/casos-de-covid-19-suben-a-262-mil-069-al-confirmarse-1-mil-188-nuevos-contagios/,"Los casos de COVID-19 en Honduras ascendieron hoy a 262 mil 069 desde el inicio de la pandemia con la confirmación de otros 1 mil 188 contagios, mientras que los pacientes recuperados se",30-06-2021 03:40,https://www.bing.com/th?id=OVFT.hmyCgLlBWWZcnW03Nou54C,Chile,Proceso
Secretaría de Salud agiliza la distribución de vacuna contra la Covid-19,http://www.elsoldehonduras.com/salud/secretaria-de-salud-agiliza-la-distribucion-de-vacuna-contra-la-covid-19/,"Con el objetivo de mantener el ritmo en el proceso de vacunación a nivel nacional, la Secretaría de Salud a través del Programa Ampliado de Inmunizaciones (PAI), continúa con el envío de vacuna contra",30-06-2021 04:05,https://www.bing.com/th?id=OVFT.qtg0TFs-qkSfxbwWNE13fC,Chile,El Sol de Honduras
La Selección de Honduras también pide a FIFA llevar 22 jugadores a los Juegos Olímpicos de Tokio,https://www.diez.hn/laseleccion/1474518-498/seleccion-honduras-fifa-22-jugadores-juegos-olimpico-tokio-fifa-fenafuth,"Honduras, se sumó a varias federaciones, que solicitaron a FIFA y al Comité Olímpico para que se aprueba llevar 22 jugadores a Tokio 2021 y que sean elegibles.",30-06-2021 04:47,https://www.bing.com/th?id=OVFT.L3lYcDvOGbok2CcbeGabtC,Chile,diez.hn
Sinager anuncia más camas en hospitales,https://www.latribuna.hn/2021/06/30/sinager-anuncia-mas-camas-en-hospitales/,Las autoridades de Sistema Nacional de Gestión de Riesgos (Sinager) anunciaron el reforzamiento de las acciones para dar respuesta a,30-06-2021 08:05,https://www.bing.com/th?id=OVFT.xuB-VAAFyCArwKtt3-O37S,Chile,La Tribuna
Enormes filas de personas y vehículos en busca de la vacuna contra el COVID-19,https://www.latribuna.hn/2021/06/30/enormes-filas-de-personas-y-vehiculos-en-busca-de-la-vacuna-contra-el-covid-19/,Desde horas de la madrugada se observaron grandes filas de personas y vehículos en el polideportivo de la Universidad Nacional,30-06-2021 08:13,https://www.bing.com/th?id=OVFT.RZmbkbEb30v9VNNET39hji,Chile,La Tribuna
"Honduras no puede completar esquema de vacunación solamente con donaciones, según microbiólogos",https://proceso.hn/honduras-no-puede-completar-esquema-de-vacunacion-solamente-con-donaciones-segun-microbiologos/,"Honduras requiere invertir en vacunas y no solo depender de los donativos internacionales, ya que así no podrá completar el esquema de vacunación contra la COVID-19, advirtió hoy la portavoz del",30-06-2021 13:35,https://www.bing.com/th?id=OVFT.EY-jIR7MLHzpFenmolge0C,Chile,Proceso
"Segundas dosis deben aplicarse a las 8 semanas, no a las 12: rector de la UNAH",https://tiempo.hn/unah-segunda-dosis-de-vacuna/,"El rector de la UNAH dijo que es mejor aplicar la segunda dosis a las 8 semanas. TEGUCIGALPA, HONDURAS. El rector de la Universidad Nacional Autónoma de Honduras, Francisco Herrera, manifestó que se e",30-06-2021 13:54,https://www.bing.com/th?id=OVFT.xSfULsSYRDJs9G_eh2LcsC,Chile,Tiempo
"Honduras suma 1,188 nuevos contagios y 22 muertes confirmadas por coronavirus",https://hondudiario.com/covid-19/honduras-suma-1188-nuevos-contagios-y-22-muertes-confirmadas-por-coronavirus/,"*** Las muertes sólo en 2021 suman un total de 3,746 a nivel nacional; los contagios en lo que va del año son 136,512. Honduras registró en las últimas horas 1,188 nuevos casos de coronavirus, alcanza",30-06-2021 14:01,https://www.bing.com/th?id=OVFT.MniYsIu7EOKM6jj6pQjIXS,Chile,Hondudiario
Fenafuth pidió a FIFA ampliar nómina para Juegos Olímpicos,https://www.diariomas.hn/2021/06/30/fenafuth-pidio-a-fifa-ampliar-nomina-para-juegos-olimpicos/,"Para tener un plantel más amplio durante los Juegos Olímpicos varias Federaciones de fútbol incluida la Fenafuth, solicitaron mediante una nota a la FIFA abogar ante el  Comité Olímpico Internacional",30-06-2021 14:02,https://www.bing.com/th?id=OVFT.zUKX-6bQFfTwkD_YGh1dYy,Chile,Mas
ABOGADO FÉLIX ÁVILA ASUMIRÁ LA DEFENSA DEL CIUDADANO GUATEMALTECO AXEL LÓPEZ IMPLICADO EN CASO DE HOSPITALES MÓVILES,https://ultimahora.hn/abogado-felix-avila-asumira-la-defensa-del-ciudadano-guatemalteco-axel-lopez-implicado-en-caso-de-hospitales-moviles/,"El exjuez , Félix Ávila, quien ahora ejerce de manera privada, será el abogado defensor del empresario guatemalteco, Axel López Guzmán, acusado por el Ministerio Público en la compra de los",30-06-2021 14:15,https://www.bing.com/th?id=OVFT.2k4z1o_i0DqCGxxKr_BVVC,Chile,Ultima Hora
Honduras urge replantear sus estrategias de lucha contra la pandemia,https://hondudiario.com/covid-19/honduras-urge-replantear-sus-estrategias-de-lucha-contra-la-pandemia/,"El científico hondureño, Marco Tulio Medina, aseveró que Honduras urge replantear todas las estrategias de lucha contra la pandemia del COVID-19, debido a la difícil situación epidemiológica y las nue",30-06-2021 14:48,https://www.bing.com/th?id=OVFT.LUa9dDVOJFbCrJksIEiqqC,Chile,Hondudiario
