name,url,description,datePublished,imagen,pais,Fuente
HONDURAS / EN UN MES LUIS ZELAYA PERDIÓ POR COVID MADRE Y HERMANO,http://www.web.ellibertador.hn/index.php/noticias/nacionales/2937-honduras-en-un-mes-luis-zelaya-perdio-por-covid-madre-y-hermano,"Este lunes murió Iván Zelaya, hermano del excandidato presidencial por el Partido Liberal, Luis Zelaya, casi un mes después de la muerte de su madre Martha Medrano, ambos por Covid-19. Tegucigalpa. Es",25-05-2021 01:05,https://www.bing.com/th?id=OVFT.q13k8iM1mQjay-4bX0iSTi,Chile,El Libertador
"JOH se vacuna contra el covid-19 con AstraZeneca: ""Tengo dos enfermedades base""",https://www.laprensa.hn/honduras/1466184-410/presidente-hernandez-vacunara-astrazeneca-tengo-dos-enfermedades-base,"El mandatario había dicho que no se vacunaría en los primeros grupos, pero que el covid que padeció en 2020 le dejó secuelas.",25-05-2021 20:15,https://www.bing.com/th?id=OVFT.-VZllzJLSV8khN4l5pmzLS,Chile,La Prensa Chicos
Abren el tercer triaje: está en el bulevar del norte de San Pedro Sula,https://www.laprensa.hn/sanpedro/1466299-410/abren-tercer-triaje-bulevar-norte-san-pedro-sula-honduras,"A pesar de que se tiene una disminución en la concurrencia de personas con síntomas de covid-19 en los dos triajes que tiene San Pedro Sula, ayer fue inaugurado el tercero en el bulevar del norte. Est",25-05-2021 20:40,https://www.bing.com/th?id=OVFT.Yls3YijLl4fNUPFktg3g2i,Chile,La Prensa Chicos
Honduras no llegará a la meta de vacunados contra covid-19 este año,https://www.elheraldo.hn/pais/1466317-466/honduras-sin-meta-vacunados-covid-2021,El país está aplicando menos de la mitad de las dosis diarias necesarias. Desorganización y caos en arranque de campaña de vacunación del IHSS en Tegucigalpa. Cientos de adultos mayores esperaron hast,25-05-2021 23:03,https://www.bing.com/th?id=OVFT.jYMFArLTUmq23gjJID0hEC,Chile,El Heraldo
Hondureños ven a Nicaragua como destino de vacunación contra covid-19,https://www.elheraldo.hn/pais/1466318-466/hondurenos-nicaragua-destino-vacuna-covid,"Unos 7,600 hondureños han viajado a Nicaragua este año. Paradójicamente, algunos compatriotas lo ven como mejor opción, aunque el proceso de vacunación no marche tan rápido",25-05-2021 23:05,https://www.bing.com/th?id=OVFT.3sXjryXztneVCf3s7YjowS,Chile,El Heraldo
Presidente Hernández ya tiene cita en el IHSS para aplicarse la dosis AstraZeneca porque adolece de dos enfermedades,https://www.radiohrn.hn/presidente-hernandez-ya-tiene-cita-en-el-ihss-para-aplicarse-la-dosis-astrazeneca-porque-adolece-de-dos-enfermedades,"Hernández será inoculado en las próximas horas con la vacuna de AstraZeneca remarcó que “pude haber sido de los primeros en ser vacunados, como lo hacen en otros países con",26-05-2021 00:13,https://www.bing.com/th?id=OVFT.l3Db3JTFP4cE0R_eJta7pS,Chile,Radio HRN
Presidente Hernández ndez se vacuna contra el Covid-19 con AstraZeneca,https://ultimahora.hn/presidente-hernandez-se-vacuna-contra-el-covid-19-con-astrazeneca/,"El mandatario hondureño, Juan Orlando Hernández procedió este día a vacunarse bajo el esquema del Instituto Hondureño de Seguridad Social (IHSS) con AstraZeneca, cumpliendo con todos los",26-05-2021 00:46,https://www.bing.com/th?id=OVFT.qOZwF89wpOFKlxG6Gd5e3y,Chile,Ultima Hora
Presidente de Honduras se vacuna contra covid-19,https://proceso.hn/presidente-de-honduras-se-vacuna-contra-covid-19/,"El presidente de Honduras, Juan Orlando Hernández, de 52 años, anunció que se inmunizará este martes contra la covid-19, que ya contrajo a mediados de 2020, por sufrir «dos enfermedades base y",26-05-2021 00:58,https://www.bing.com/th?id=OVFT.RfzKITI7aRFIU5dCAoc9Ty,Chile,Proceso
Presidente Hernández se vacuna contra COVID-19 (Video),https://www.latribuna.hn/2021/05/25/presidente-hernandez-se-vacuna-contra-covid-19-video/,"Tegucigalpa.- El presidente de Honduras, Juan Orlando Hernández, de 52 años, anunció que se inmunizará este martes contra la COVID-19,",26-05-2021 00:59,https://www.bing.com/th?id=OVFT.PujSNCUVhQAPhaRLLX3bey,Chile,La Tribuna
COVID-19| Funerarias reportan más de 14 mil fallecimientos en Honduras,https://tiempo.hn/covid-19-funerarias-mas-de-14-mil-fallecimientos-honduras/,"TEGUCIGALPA, HONDURAS.- Más de 14 mil entierros de personas que fallecieron por sospechas de la COVID-19 en todo el país contabiliza hasta la fecha la Asociación de la Industria Funeraria de Honduras,",26-05-2021 01:39,https://www.bing.com/th?id=OVFT.fh2CQZY8M8KLKpJ4CPhZdy,Chile,Tiempo
Expresidente Roberto Micheletti se vacuna contra la COVID-19 en Tegucigalpa,https://tiempo.hn/micheletti-se-vacuna-contra-covid-19/,"TEGUCIGALPA, HONDURAS. El expresidente de Honduras, Roberto Micheletti, acudió hoy martes al centro vehicular de vacunación ubicado en la Universidad Tecnológica de Honduras (UTH), donde recibió la pr",26-05-2021 02:25,https://www.bing.com/th?id=OVFT.IyjbyaZWkdkHOWc8pXgjnS,Chile,Tiempo
Presidente Hernández se vacuna contra la covid-19 en el IHSS,http://www.eldiario.hn/presidente-hernandez-se-vacuna-contra-la-covid-19-en-el-ihss/,Tegucigalpa. - El  presidente Juan Orlando Hernández se vacunó este martes contra la covid-19 con AstraZeneca en la primera jornada de inmunización del Instituto Hondureño de Seguridad Social (IHSS) y,26-05-2021 03:42,https://www.bing.com/th?id=OVFT.4FCwOLuUI31AHHOa6pqwoi,Chile,El Diario
"Casos de COVID-19 aumentan a 233,916",https://www.latribuna.hn/2021/05/25/casos-de-covid-19-aumentan-a-233916/,"Los casos de COVID-19 en Honduras ascendieron a 233,916 desde el inicio de la pandemia con la confirmación de otros",26-05-2021 04:05,https://www.bing.com/th?id=OVFT.Gi9KRcUzGx-8LxdAhDTeYy,Chile,La Tribuna
"Honduras registra 233,916 infectados, de los cuales 83,761 vencieron el covid-19",https://www.radiohrn.hn/honduras-registra-233916-infectados-de-los-cuales-83761-vencieron-el-covid-19,"Según reporte del Sinager, este martes se realizaron 2,367 pruebas para identificar el virus, de estas, 800 resultaron positivas. La cifra de fallecidos se elevó a 6,210 con la suma de 22 personas con",26-05-2021 06:41,https://www.bing.com/th?id=OVFT.yUwkpBa9KMrdQNF0j2jK6C,Chile,Radio HRN
"Muertes por coronavirus suben a 6,210 y los contagios ya son 233,916 en Honduras",https://hondudiario.com/covid-19/muertes-por-coronavirus-suben-a-6210-y-los-contagios-ya-son-233916-en-honduras/,"*** La cifra total de personas recuperadas de la enfermedad es de 83,761 en el acumulado. Honduras reportó en las últimas horas 800 nuevos casos de coronavirus, alcanzando así un total de 233,916 cont",26-05-2021 14:31,https://www.bing.com/th?id=OVFT.iDNWHGjvoHa4RLGyLuwIpC,Chile,Hondudiario
Gremio magisterial pide vacunar urgentemente a 70 mil docentes en Honduras,https://proceso.hn/gremio-magisterial-pide-vacunar-urgentemente-a-70-mil-docentes-en-honduras/,"Directivos del Colegio Profesional Unión Magisterial Hondureño (Coprumh), consideran que es urgente vacunar contra el COVID-19 a unos 70 mil maestros del país.",26-05-2021 14:40,https://www.bing.com/th?id=OVFT.UjJHHOY1YWMTXhYjF0xqdC,Chile,Proceso
PRESIDENTE HERNÁNDEZ ANUNCIA QUE EN JUNIO LLEGARÁN VACUNAS DE PFIZER,https://ultimahora.hn/presidente-hernandez-anuncia-que-en-junio-llegaran-vacunas-de-pfizer/,"El presidente de Honduras, Juan Orlando Hernández, anunció que en junio llegarán las vacunas de Pfizer con la cantidad que llegue se prevé inocular a un millón de hondureños. El Gobierno de",26-05-2021 14:47,https://www.bing.com/th?id=OVFT.o1r1lZ2L9pTH9rjUM18wzi,Chile,Ultima Hora
Este miércoles inicia inmunización de mayores de 70 años en centros de vacunación peatonales,https://hondudiario.com/covid-19/este-miercoles-inicia-inmunizacion-de-mayores-de-70-anos-en-centros-de-vacunacion-peatonales/,"Autoridades de la Secretaría de Salud (Sesal), informaron que este miércoles da inicio la vacunación contra el Covid-19 para los adultos mayores de 70 años en los centros peatonales instalados en la c",26-05-2021 15:02,https://www.bing.com/th?id=OVFT.r5UEcFb1wSY-joyCT21zbC,Chile,Hondudiario
