name,url,description,datePublished,imagen,pais,Fuente
Honduras ejecutará Programa de ‘Empleo y Emprendimiento Juvenil’ financiado por el BCIE,http://www.eldiario.hn/honduras-ejecutara-programa-de-empleo-y-emprendimiento-juvenil-financiado-por-el-bcie/,La iniciativa forma parte del “Programa de Emergencia de Apoyo y Preparación ante la COVID-19 y de Reactivación Económica ... El programa juvenil se desarrollará en Honduras en cumplimiento con el Objetivo de Desarrollo Sostenible 8 (ODS8 ...,13-04-2021 04:59,https://www.bing.com/th?id=OVFT.nkupRqdDCf6U-KA1Jez5mS,Chile,El Diario
"El COVID-19 ha matado a más de mil capitalinos, según Salud",https://tiempo.hn/hondurenos-muertos-covid-tegucigalpa/,"TEGUCIGALPA, HONDURAS. Según un informe del jefe de la Región Metropolitana de Salud del Distrito Central, Harry Book, unas 1.150 personas en total han perdido la vida a cusa del COVID-19 desde el comienzo de la pandemia. “Con los datos proporcionados ...",13-04-2021 13:00,https://www.bing.com/th?id=OVFT.I-N75cmfM_bXjY7RfD8siS,Chile,Tiempo
"Honduras reporta 57 muertes por COVID en últimas 24 horas y un total de 196,086 contagios",https://hondudiario.com/2021/04/13/honduras-reporta-57-muertes-por-covid-en-ultimas-24-horas-y-196086-contagios/,"El Sistema Nacional de Gestión de Riesgos (Sinager), confirmó en las últimas horas 306 nuevos casos de Covid-19, sumando así un total de 196,086 contagios a nivel nacional. De 1,464 pruebas PCR proces",13-04-2021 13:14,https://www.bing.com/th?id=OVFT.qeJSrJ5m6CI9utUNeRuZwC,Chile,Hondudiario
"Funerarias registran 11,361 muertos por COVID-19 hasta el 10 de marzo",https://hondudiario.com/2021/04/13/funerarias-registran-11361-muertos-por-covid-19-hasta-el-10-de-marzo/,"***Indicó que esas cifras se refieren a los registros de las funerarias que están afiliadas a esa asociación, pero hay otras empresas que se dedican al terraje de personas fallecidas. El secretario de",13-04-2021 14:51,https://www.bing.com/th?id=OVFT.k0_IE2WFrpAVhQmw7wgY3y,Chile,Hondudiario
"En compra de hospitales participaron varios ministros, no empleados de baja categoría, dice defensa de Bográn",https://www.elheraldo.hn/pais/1456503-466/ministros-gabinete-involucrados-compra-marco-bogran-hospitales-moviles-alex-moraes,El proceso contra los exfuncionarios comenzó el pasado sábado y para este miércoles está prevista la audiencia de conclusiones,13-04-2021 15:28,https://www.bing.com/th?id=OVFT.C19HIRRq4rUlRARi8Meevi,Chile,El Heraldo
Al menos 57 decesos hubo el lunes de esta semana por COVID-19 en Honduras,https://proceso.hn/al-menos-57-decesos-hubo-el-lunes-de-esta-semana-por-covid-19-en-honduras/,"Al menos 57 personas murieron el lunes de esta semana a causa de la COVID-19 en Honduras, reveló hoy la portavoz del Colegio de Microbiólogos, Miriam Aguilera.",13-04-2021 16:40,https://www.bing.com/th?id=OVFT.cCztL8kJek5WJzeQykU1gi,Chile,Proceso
Intervienen hospitales de Juticalpa y Catacamas por coronavirus,https://www.laprensa.hn/honduras/1456533-410/intervienen-hospitales-juticalpa-catacamas-coronavirus-,"Olancho registra un total de 5,714 casos confirmados de la Covid-19, siendo los municipios de Catacamas y Juticalpa los más afectados. Olancho, Honduras La Secretaría de Salud anunció este martes la intervención en los hospitales Hermano Pedro de ...",13-04-2021 16:52,https://www.bing.com/th?id=OVFT.PDESShy9-w0ZGB9Cf-YscS,Chile,La Prensa Chicos
La cifra más alta de la pandemia: SINAGER confirma 57 nuevas muertes por COVID,https://tiempo.hn/cifra-mas-alta-57-nuevas-muertes-por-covid-19/,"Los contagios de COVID-19 en Honduras van en aumento así como las muertes. Solo ayer, lunes, se reportaron de forma oficial 57",13-04-2021 18:03,https://www.bing.com/th?id=OVFT.wfmkrfnuP1f4gfIoA8_aGC,Chile,Tiempo
ESPECIALISTA EN MICROBIOLOGÍA MIRIAM AGUILERA NO DESCARTA QUE NUEVA VARIANTE DEL COVID-19 YA ESTÉ EN EL PAÍS,https://ultimahora.hn/especialista-en-microbiologia-miriam-aguilera-no-descarta-que-nueva-variante-del-covid-19-ya-este-en-el-pais/,"Al menos 57 muertes por la covid-19 reportaron los hospitales certificados del país y aún falta los que no se han certificado informó la portavoz del Colegio de Microbiólogos de Honduras, Miriam Aguilera. Por lo que no descartó que en el país haya ...",13-04-2021 18:08,https://www.bing.com/th?id=OVFT.NSPYRYnTUiopKYnI6T1mUC,Chile,Ultima Hora
Caso Marco Bográn: de la captura sorpresa a una maratónica audiencia inicial (FOTOS),https://www.elheraldo.hn/fotogalerias/1456518-468/marco-bogran-invest-h-compra-hospitales-moviles-honduras-pandemia-covid,"De ser uno más de los funcionarios del Estado casi intocable, Marco Bográn, extitular de Invest-H, se convirtió en uno de los personajes más cuestionados de 2020, cuando el país no solo fue azotado po",13-04-2021 18:48,https://www.bing.com/th?id=OVFT.J10O31Ycc5OVy3aP9VLOfS,Chile,El Heraldo
EN LA COLONIA KENNEDY SALUD REALIZA MEGA BRIGADA PARA LA BÚSQUEDA DE CASOS DE COVID-19,https://ultimahora.hn/en-la-colonia-kennedy-salud-realiza-mega-brigada-para-la-busqueda-de-casos-de-covid-19/,La población debe extremar las medidas de bioseguridad debido a que estamos ante una nueva oleada del COVID-19 a nivel mundial y Honduras no es la excepción. Debido a la incidencia de casos que se registran en la colonia Kennedy autoridades sanitarias ...,13-04-2021 19:24,https://www.bing.com/th?id=OVFT.vRKBODlsioB4HatRPU_MwS,Chile,Ultima Hora
Gobierno confirma que Honduras contará con vacunas Covid-19,https://www.vtv.com.hn/noticia/gobierno-confirma-que-honduras-contara-con-vacunas-covid-19/,El secretario de comunicaciones de casa presidencial asegura que en los próximos días los hondureños tendrán buenas noticias en el tema de las vacunas contra la COVID-19.,13-04-2021 20:15,https://www.bing.com/th?id=OVFT.9ISFpMs_i_MlKs--GpA_ni,Chile,VTV
Entre junio y julio podría recibir Honduras las vacunas Pfizer,https://www.vtv.com.hn/noticia/entre-junio-y-julio-podria-recibir-honduras-las-vacunas-pfizer/,... Panamericana de la Salud en Honduras OPS Piedad Puerta anunció que Honduras clasificó para recibir la donación de 200 mil dosis de vacunas contra el Covid-19 de la farmacéutica estadounidense Pfizer. En el programa Frente a Frente de Televicentra ...,13-04-2021 20:22,https://www.bing.com/th?id=OVFT.OhPvLJa3OrQLIq8SvByJTS,Chile,VTV
Las Vegas será sede de Final de Copa Oro 2021 de Concacaf,https://www.diariomas.hn/2021/04/13/las-vegas-sera-sede-de-la-final-de-la-copa-oro-2021-de-concacaf/,"La Fase de Grupos de la Copa Oro 2021 de Concacaf arrancará el 10 de julio y contará con 16 selecciones nacionales participantes, de las cuales Canadá, Costa Rica, Curazao, El Salvador, Estados Unidos, Granada, Honduras ... de Covid-19, que tendrán ...",13-04-2021 22:00,https://www.bing.com/th?id=OVFT.N9hMwP2x-1swZNLHxPdHzy,Chile,Mas
Honduras: Hospitales reportan 17 fallecidos con sospecha de COVID-19,https://www.latribuna.hn/2021/04/13/honduras-hospitales-reportan-17-fallecidos-con-sospecha-de-covid-19/,"A 17 sube la cifra de fallecidos bajo sospecha del COVID-19 en las últimas 24 horas en los distintos centros asistenciales del país, de acuerdo a informe de las autoridades. La portavoz del Hospital E",13-04-2021 23:02,https://www.bing.com/th?id=OVFT.HhBt5fzfguoGges4Ib6bnC,Chile,La Tribuna
Covid-19 en Honduras: 36 muertes diarias y cero vacunas,https://www.laprensa.hn/premium/1456649-410/incremento-del-covid-seguira-hasta-mayo-y-no-llegan-vacunas-honduras-coronavirus-salud-sinager,"Tegucigalpa, Honduras. El sistema sanitario del país ya comenzó a sentir las consecuencias de las aglomeraciones de personas durante las elecciones del pasado 14 de marzo y las",14-04-2021 01:16,https://www.bing.com/th?id=OVFT.12rl086iUUTH1lLcdVVxEi,Chile,La Prensa Chicos
Honduras registra mil 136 pacientes hospitalizados por la COVID-19,https://proceso.hn/honduras-registra-mil-136-pacientes-hospitalizados-por-la-covid-19/,"Honduras registró este martes mil 136 pacientes hospitalizados, asimismo, 618 nuevos casos de COVID-19 para acumular un total de 196 mil 704 contagios, informó este martes el Sistema Nacional de",14-04-2021 03:35,https://www.bing.com/th?id=OVFT.nzEsYfg7ZFJ7eCZMY_csPi,Chile,Proceso
"Honduras suma 71,147 casos positivos de covid-19 de enero al 13 de abril de 2021",https://www.radiohrn.hn/honduras-suma-71147-casos-positivos-de-covid-19-de-enero-al-13-de-abril-de-2021,Honduras reportó el martes (13.04.2021) a través del Sistema Nacional de Gestión de Riesgos (Sinager) un acumulado de casos positivos de covid-19 desde el inicio de la pandemia de 196 mil 704. Este ma,14-04-2021 05:20,https://www.bing.com/th?id=OVFT.AKi40mRHEY-GU5qP-Rkkky,Chile,Radio HRN
Edición Bicentenario: Más de 600 sitios han sido postulados para participar en las 30 Maravillas de Honduras,http://www.eldiario.hn/edicion-bicentenario-mas-de-600-sitios-han-sido-postulados-para-participar-en-las-30-maravillas-de-honduras/,"Más de 600 nuevas postulaciones han sido presentadas a nivel nacional para participar en el programa 30 Maravillas de Honduras, edición Bicentenario ... debido a la pandemia de covid-19, es importante aprender a vivir en la nueva normalidad y conocer ...",14-04-2021 05:29,https://www.bing.com/th?id=OVFT.A_5hbCowo6Y8OOI3LIND7i,Chile,El Diario
Honduras acumula 4.873 muertos y 196.704 contagios por COVID-19,https://www.latribuna.hn/2021/04/14/honduras-acumula-4-873-muertos-y-196-704-contagios-por-covid-19/,"Honduras, con una población de 9,3 millones, notificó el 11 de marzo de 2020 los primeros dos casos de covid-19, dos mujeres hondureñas que llegaron al país procedentes de España y Suiza. Desde el inicio de la pandemia, los departamentos de Cortés ...",14-04-2021 06:14,https://www.bing.com/th?id=OVFT.ZwOAvYWG2YQJtoUfn9zy-y,Chile,La Tribuna
Honduras aumentó en un 29% la positividad por covid- 19,https://www.radiohrn.hn/honduras-aumento-en-un-29-la-positividad-por-covid-19,"El coordinador Nacional de la Vigilancia Epidemiológica de la Covid, Homer Mejía, declaró el martes (13.04.2021), durante el programa La Tarde de HRN y Tsi, que la positividad por covid-19 a nivel nacional es de 29%. Según Mejía, la positividad ...",14-04-2021 06:57,https://www.bing.com/th?id=OVFT.kpDrn9OtDKOfEM-56QTrjy,Chile,Radio HRN
