name,url,description,datePublished,imagen,pais,Fuente
No se descartan que en el país circulen variantes del COVID-19,https://www.latribuna.hn/2021/03/30/no-se-descartan-que-en-el-pais-circulen-variantes-del-covid-19/,"El viceministro de Salud, Roberto Cosenza, manifestó que no se descarta que en Honduras ya circulen otras variantes del COVID-19,",30-03-2021 07:53,https://www.bing.com/th?id=OVFT.zCaeuWXvYCyACKdr4eroNS,Chile,La Tribuna
Expertos coinciden: La «agresiva» variante brasileña ya estaría en Honduras,https://tiempo.hn/expertos-agresiva-variante-brasilena-covid-19-en-honduras/,"En Panamá ya se detectó el primer caso de la variante brasileña de COVID-19, según la dependencia de Salud de esa nación. En",30-03-2021 20:01,https://www.bing.com/th?id=OVFT.xXhYOA5piJ0LcsLpJA8bSS,Chile,Tiempo
UNOS 30 ENTIERROS DIARIOS REPORTAN FUNERARIAS HONDUREÑAS DURANTE MARZO A CAUSA DE LA COVID-19,https://ultimahora.hn/unos-30-entierros-diarios-reportan-funerarias-hondurenas-durante-marzo-a-causa-de-la-covid-19/,"El presidente de la Asociación Nacional de la Industria Funeraria, Edwin Lanza, informó  que durante este mes de marzo , han realizado un promedio de 30 entierros diarios a causa de la COVID-19.",31-03-2021 02:13,https://www.bing.com/th?id=OVFT.WV7h0vPFZfTtU8rtp2WFsS,Chile,Ultima Hora
Honduras supera los 188.000 casos de COVID-19 y acumula 4.599 fallecidos,https://www.latribuna.hn/2021/03/30/honduras-supera-los-188-000-casos-de-covid-19-y-acumula-4-599-fallecidos/,"Tegucigalpa.- Honduras superó este martes los 188.000 casos de coronavirus desde marzo de 2020, cuando comenzó la pandemia en el",31-03-2021 05:05,https://www.bing.com/th?id=OVFT.W1aMpdH2zLLXCQ3oiLzsRi,Chile,La Tribuna
Las inevitables «nuevas olas» del covid-19 para las que Honduras debe prepararse,https://hondudiario.com/2021/03/31/las-inevitables-nuevas-olas-del-covid-19-para-las-que-honduras-debe-prepararse/,"*** De acuerdo a los datos de la Universidad John Hopkings, los peores momentos vividos por Honduras se resumen en los meses de julio de 2020 y febrero de 2021, cuando la presión hospitalaria ha alcan",31-03-2021 14:09,https://www.bing.com/th?id=OVFT.Q-6-XmlAgbZ-fTPmrKyENS,Chile,Hondudiario
Funerarias hondureñas reportan 30 entierros diarios durante marzo a causa de la COVID-19,https://proceso.hn/funerarias-hondurenas-reportan-30-entierros-diarios-durante-marzo-a-causa-de-la-covid-19/,"Tegucigalpa – El presidente de la Asociación Nacional de la Industria Funeraria, Edwin Lanza, informó este miércoles que durante este mes de marzo que finaliza hoy, han",31-03-2021 14:50,https://www.bing.com/th?id=OVFT.qBVj_HeA_sUItrCr8_gLOC,Chile,Proceso
INICIATIVA PRIVADA TRABAJA EN UN CONVENIO CON SECRETARÍA DE SALUD Y IHSS PARA LA COMPRA DE VACUNAS CONTRA LA COVID-19,https://ultimahora.hn/iniciativa-privada-trabaja-en-un-convenio-con-secretaria-de-salud-y-ihss-para-la-compra-de-vacunas-contra-la-covid-19/,"El director ejecutivo de la Cámara de Comercio e Industrias de Tegucigalpa (CCIT), Rafael Medina, informó que se está trabajando en un convenio entre organizaciones privadas que es el Cohep el que",31-03-2021 14:58,https://www.bing.com/th?id=OVFT.SBPGoOIV5_jlnWnsXC1sCC,Chile,Ultima Hora
Industria turística está lista con medidas de bioseguridad que deben respetar los veraneantes,http://www.elsoldehonduras.com/turismo/industria-turistica-esta-lista-con-medidas-de-bioseguridad-que-deben-respetar-los-veraneantes/,"Ante la cercanía del asueto por la Semana Santa, la ministra de Turismo, Nicole Marrder, aseguró que la industria turística a nivel nacional se encuentra lista para recibir a los veraneantes con todas",31-03-2021 17:24,https://www.bing.com/th?id=OVFT.eOmkYhH3Vv2jo1iOUyQVJC,Chile,El Sol de Honduras
"Honduras ha detenido a 2,687 extranjeros por movilizarse de manera ilegal",https://www.radiohrn.hn/honduras-ha-detenido-a-2687-extranjeros-por-movilizarse-de-manera-ilegal,La mayoría de los detenidos son ciudadanos de países caribeños que llegan a Honduras a Choluteca presuntamente vía Nicaragua con rumbo a Estados Unidos,01-04-2021 02:26,https://www.bing.com/th?id=OVFT.6BRymCz7HQbwHgUoJjqZdS,Chile,Radio HRN
"Honduras supera los 189 mil casos de covid-19 y acumula 4,605 fallecidos",https://www.radiohrn.hn/honduras-supera-los-189-mil-casos-de-covid-19-y-acumula-4605-fallecidos,"causante de la covid-19. El número de pacientes recuperados del coronavirus en las últimas horas ascendió a 88, por lo que la cifra de personas que se han salvado de morir a causa de la enfermedad se elevó a 72,732, según el informe el ente.",01-04-2021 03:21,https://www.bing.com/th?id=OVFT.p3UgXtCH5ePza0EoU_VWhC,Chile,Radio HRN
"Honduras supera los 189 mil contagios y las 4,600 muertes por coronavirus",https://hondudiario.com/2021/03/31/honduras-supera-los-189-mil-contagios-y-las-4600-muertes-por-coronavirus/,"El Sistema Nacional de Gestión de Riesgos (Sinager), confirmó este miércoles 529 nuevos casos de Covid-19, sumando así un total de 189,043 contagios a nivel nacional. De 1,967 pruebas PCR procesadas por el Laboratorio Nacional de Virología para ...",01-04-2021 03:41,https://www.bing.com/th?id=OVFT.5LBr794Ui8XVMhExRNQZ0C,Chile,Hondudiario
Honduras acumula 4 mil 605 muertos por COVID y 189 mil 043 contagios,https://proceso.hn/honduras-acumula-4-mil-605-muertos-por-covid-y-189-mil-043-contagios/,"Honduras acumula a más de un año desde que se comenzó a expandir la pandemia de COVID-19 un total de 4 mil 605 muertos y 189 mil 043 contagios, informó este miércoles el estatal Sistema Nacional",01-04-2021 03:54,https://www.bing.com/th?id=OVFT.G5g_B3QgBtmfJfAlUd6KIy,Chile,Proceso
BCH: Inversión extranjera en Honduras sumó $418.6 millones; hubo caída de 16 %,https://tiempo.hn/inversion-extranjera-honduras-sumo-418-6-millones-bch/,"El BCH detalla que la pandemia del COVID-19, Eta e Iota, influyeron en la caída de la inversión extranjera. TEGUCIGALPA, HONDURAS. El Banco Central de Honduras (BCH) informó que la Inversión Extranjera Directa (IED) en el país sumó 418,6 millones de ...",01-04-2021 06:14,https://www.bing.com/th?id=OVFT.DH3yeXRGanFSE2lP5muwXC,Chile,Tiempo
Dentro de dos semanas esperan una nueva ola de covid-19 en Honduras.,https://www.laprensa.hn/honduras/1453744-410/dentro-de-dos-semanas-esperan-una-nueva-ola-de-covid-19-en-honduras-coronavirus-salud,Médicos que han estado en primera línea batallando contra el coroanvirus advierten que el desenfreno de los veraneantes causará un repunte.,01-04-2021 07:32,https://www.bing.com/th?id=OVFT.Jovl0gXxuYarTXru8vTNvy,Chile,La Prensa Chicos
