name,url,description,datePublished,imagen,pais,Fuente
Honduras confirma el primer caso de hongo negro en un paciente con COVID-19,https://es-us.noticias.yahoo.com/honduras-confirma-caso-hongo-negro-210902402.html,"Las autoridades sanitarias de Honduras confirmaron la aparición del primer caso de hongo negro en un paciente recuperado de COVID-19, enfermedad que ha azotado en las últimas semanas a la India. “Pued",08-06-2021 21:09,https://www.bing.com/th?id=OVFT.hfKNKMfH6wKb9vtOD2TVFy,Chile,Yahoo Noticias en Español
Caen los números de hospitalizaciones por COVID-19 en Rhode Island,https://www.msn.com/es-us/noticias/otras/caen-los-n%C3%BAmeros-de-hospitalizaciones-por-covid-19-en-rhode-island/ar-AAKXdhM,"Solo hay 37 personas en los hospitales de Rhode Island con casos confirmados del coronavirus según los últimos datos del Departamento de Salud del estado publicados el jueves, el total de un solo día",11-06-2021 18:26,https://www.bing.com/th?id=OVFT.Qf9qhLs9wRKpxOjPqs1EbS,Chile,MSN
"Honduras acumula 6,606 muertos por covid-19 y 247,074 contagios",https://www.laprensa.hn/honduras/1470356-410/honduras-acumula-6606-muertos-por-covid-19-y-247074-contagios,"El organismo sumó a sus registros siete nuevos casos de fallecidos, con los que la cifra se elevó a 6,606 en quince meses de pandemia.",12-06-2021 23:53,https://www.bing.com/th?id=OVFT.awgsxFqHkT2iYnY9VTiegy,Chile,La Prensa Chicos
"A 247,074 asciende la cifra de casos de covid en Honduras",https://www.radiohrn.hn/a-247074-asciende-la-cifra-de-casos-de-covid-en-honduras,"Honduras acumula un total de 247,074 casos de covid-19 desde el año anterior cuando inició la pandemia hasta a la fecha, según informó el sábado (12.06.2021) el Sistema Nacional de Gestión de Riesgos",13-06-2021 03:44,https://www.bing.com/th?id=OVFT.yEyVf2sZHAt9Y2Dzmd2SsC,Chile,Radio HRN
"Honduras registra 247,074 contagios y 6,606 muertos a causa del COVID",https://hondudiario.com/covid-19/honduras-registra-247074-contagios-y-6606-muertos-a-causa-del-covid/,"El Sistema Nacional de Gestión de Riesgos (Sinager), informó que de 1,379 nuevos casos positivos de Covid-19, sumando así 247, 074 contagios desde que se declaró una emergencia sanitaria por la pandem",13-06-2021 15:29,https://www.bing.com/th?id=OVFT.9tX6IbP8UN-8-T4ILhtjii,Chile,Hondudiario
Maynor Figueroa busca al aficionado catracho que invadió el Honduras-México para regalarle su camisa,https://www.diez.hn/laseleccion/1470392-498/maynor-figueroa-aficionado-busca-regalarle-camisa-honduras-amistoso-mexico-gesto,Maynor Alexis Figueroa Róchez (38 años) es el gran líder y capitán de la selección de Honduras que dirige el entrenador Fabián Coito. Te puede interesar: Henry Figueroa reaparece jugando al fútbol lue,13-06-2021 21:11,https://www.bing.com/th?id=OVFT.liry57zWlzIy2GuMLZLoVC,Chile,diez.hn
"Huérfanos del covid: 1,300 niños hondureños sin sus padres por el virus",https://www.elheraldo.hn/pais/1470576-466/huerfanos-covid-ninos-hondurenos-2021,"Una estimación de la Unidad de Datos de EL HERALDO Plus calcula que hay 1,300 niños que perdieron al menos a uno de sus padres",13-06-2021 23:05,https://www.bing.com/th?id=OVFT.ZjJGH7Mpi1oO3MU-QQNUGS,Chile,El Heraldo
La Mesa Multisectorial acuerda crear comisión para conocer cronograma de vacunación a docentes,http://www.elsoldehonduras.com/nacionales/la-mesa-multisectorial-acuerda-crear-comision-para-conocer-cronograma-de-vacunacion-a-docentes/,"En la reunión de este día, los miembros de la Mesa Multisectorial lograron importantes acuerdos, dentro de los cuales se destaca el tema de vacunación contra el Covid-19 a los docentes del sector públ",14-06-2021 04:54,https://www.bing.com/th?id=OVFT.olSfbfE3-3H7soPP2raIci,Chile,El Sol de Honduras
Más de 400 mil hondureños han sido vacunados contra la Covid-19,http://www.elsoldehonduras.com/nacionales/mas-de-400-mil-hondurenos-han-sido-vacunados-contra-la-covid-19/,"Un total de 447,023 hondureños se han vacunado contra la Covid-19 desde el mes de febrero hasta el 10 de junio, así lo informó este día la jefa del Programa Ampliado de Inmunizaciones (PAI), Ida Beren",14-06-2021 04:58,https://www.bing.com/th?id=OVFT.xEumewzFjXBNvIv5FDwzUy,Chile,El Sol de Honduras
La sostenibilidad de la deuda y el sacrificio del gasto social,https://www.latribuna.hn/2021/06/14/la-sostenibilidad-de-la-deuda-y-el-sacrificio-del-gasto-social/,"La pandemia de la COVID-19 deja en Honduras varios desafíos; salud y educación precarias, empleos perdidos y un alto endeudamiento",14-06-2021 09:01,https://www.bing.com/th?id=OVFT.DmfFJaJ3RUjk3NFyivILZy,Chile,La Tribuna
COVID-19 pone de rodillas a El Paraíso: Salud y Sinager dan nuevas medidas,https://tiempo.hn/el-paraiso-casos-covid-19/,"De acuerdo con datos del SINAGER, el departamento de El Paraíso actualmente registra 13,364 casos de COVID-19. HONDURAS. Ante el incremento casos de COVID-19 en el departamento de El Paraíso y la alta",14-06-2021 12:50,https://www.bing.com/th?id=OVFT.N4A7m_Otv_wvgk4C_x9hOS,Chile,Tiempo
COVID-19: sitios y horarios donde continúa vacunación en Honduras,https://tiempo.hn/vacunacion-hoy-honduras-covid-19/,"Desde el pasado mes de mayo, comenzó la campaña de vacunación contra la COVID-19 en varios sectores de Honduras. Según las autoridades de Salud, durante ese proceso, un total de 447 mil 023 hondureños",14-06-2021 13:19,https://www.bing.com/th?id=OVFT.ZrFXXK540AbpTbcCFT9oYC,Chile,Tiempo
"Honduras alcanza 6,631 muertes por coronavirus y 247,728 contagios",https://hondudiario.com/covid-19/honduras-alcanza-6631-muertes-por-coronavirus-y-247728-contagios/,"*** Las muertes sólo en 2021 suman un total de 3,397 a nivel nacional. Honduras registró en las últimas horas 654 nuevos casos de coronavirus, alcanzando así un total de 247,728 contagios a nivel naci",14-06-2021 14:31,https://www.bing.com/th?id=OVFT.lUYk2Zc4zPFK4ZRaSgCPyi,Chile,Hondudiario
"GOBIERNO POSTERGA LA APLICACIÓN DE LA SEGUNDA DOSIS DE LA VACUNA ANTICOVID, SPUTNIK V Y ASTRAZENECA HASTA LOS TRES MESES",https://ultimahora.hn/gobierno-posterga-la-aplicacion-de-la-segunda-dosis-de-la-vacuna-anticovid-sputnik-v-y-astrazeneca-hasta-los-tres-meses/,"La Secretaría de Salud de Honduras informó, que la segunda dosis de la vacuna contra el covid-19, Sputnik V y AstraZeneca, será aplicada a los tres meses después de haberse inmunizado la primera",14-06-2021 14:40,https://www.bing.com/th?id=OVFT.jdN7c9Qg_Yd3VotBlaYvyC,Chile,Ultima Hora
Kevin Álvarez: Dejamos buenas sensaciones,https://www.diariomas.hn/2021/06/14/kevin-alvarez-dejamos-buenas-sensaciones/,"Luego de cerrar la gira por Estados Unidos donde jugaron las semifinales de la Liga de Naciones y un duelo amistoso contra México, la selección nacional regresó al país y los futbolistas se mostraron",14-06-2021 15:08,https://www.bing.com/th?id=OVFT.SYuAsKRI0rRMkZTRS1xjyi,Chile,Mas
Marcelo Pereira: Estamos creciendo,https://www.diariomas.hn/2021/06/14/marcelo-pereira-estamos-creciendo/,"El defensor central de la selección nacional, Marcelo Pereira calificó como positiva la gira del equipo de todos por los Estados Unidos donde realizaron tres partidos, dos por la Liga Naciones y un am",14-06-2021 15:50,https://www.bing.com/th?id=OVFT.4cpyXqB9kn-ymtUUGv1rCS,Chile,Mas
Al menos 11 decesos con sospecha de COVID-19 se reportan en hospitales de Tegucigalpa,https://proceso.hn/al-menos-11-decesos-con-sospecha-de-covid-19-se-reportan-en-hospitales-de-tegucigalpa/,"Al menos 11 personas perdieron la vida bajo sospecha de la COVID-19 en hospitales de Tegucigalpa, informaron este lunes fuentes de los centros asistenciales.",14-06-2021 17:23,https://www.bing.com/th?id=OVFT.9LXUn6XmK2-uW69eb1inkC,Chile,Proceso
"Secretaría de Salud: ""Honduras tiene vacunado el 100% del personal"" sanitario público y privado",https://www.elheraldo.hn/factchecking/1470799-504/vacunacion-covid-trabajadores-salud,"Pese a que las autoridades de la Secretaría de Salud anunciaron que el 100% del sector salud está vacunado, EL HERALDO comprobó que hay un porcentaje pendiente, principalmente en el área privada",14-06-2021 20:30,https://www.bing.com/th?id=OVFT.CqO4u7SzB-nZ5yqS39-4Xy,Chile,El Heraldo
Aplicar segunda dosis fuera de tiempo es un riesgo; Gobierno defiende estudio,https://www.laprensa.hn/honduras/1470819-410/aplicar-segunda-dosis-fuera-tiempo-riesgo-gobierno-defiende-estudio,A centeneres de hondureños ya les pasó la fecha de la aplicación de la segunda dosis de vacunas Sputnik V y AstraZeneca.,14-06-2021 22:28,https://www.bing.com/th?id=OVFT.PthYqsI1I5LLojUXSnsS9C,Chile,La Prensa Chicos
Honduras acumula 6 mil 653 muertos por la COVID-19 y 248 mil 115 casos positivos,https://proceso.hn/honduras-acumula-6-mil-653-muertos-por-la-covid-19-y-248-mil-115-casos-positivos/,"Honduras acumula 6 mil 653 decesos y casi 248 mil 115 casos positivos del SARS-CoV-2, según el reporte divulgado este lunes por el Sistema Nacional de Gestión de Riesgo (Sinager).",15-06-2021 03:24,https://www.bing.com/th?id=OVFT.7c-_hvOkY9ofbI8FNpeVUi,Chile,Proceso
"Honduras acumula 6,653 muertos; 89,324 recuperados y 248, 115 contagios de covid",https://www.radiohrn.hn/honduras-acumula-6653-muertos-89324-recuperados-y-248-115-contagios-de-covid,"El Laboratorio Nacional de Virología realizó el lunes un total de mil 141 pruebas para detectar el covid, de las cuales 387 resultaron positivas",15-06-2021 03:40,https://www.bing.com/th?id=OVFT._mEQJLW62tJ6wBgViaurIS,Chile,Radio HRN
"Casos de COVID-19 aumentan a 248,115 al confirmarse otros 387 contagios",https://www.latribuna.hn/2021/06/14/casos-de-covid-19-aumentan-a-248115-al-confirmarse-otros-387-contagios/,"Los casos de COVID-19 en Honduras ascendieron a 248,115 desde el inicio de la pandemia con la confirmación de otros",15-06-2021 05:00,https://www.bing.com/th?id=OVFT.kDH2TmYDJFjmxVX9x1ZtSi,Chile,La Tribuna
