name,url,description,datePublished,imagen,pais,Fuente
PERSONAL DE SALUD DE SPS YA ESTÁN INMUNIZADOS AL 100% TRAS RECIBIR SEGUNDA DOSIS Y AGRADECE AL GOBIERNO Y A ISRAEL,https://ultimahora.hn/personal-de-salud-de-sps-ya-estan-inmunizados-al-100-tras-recibir-segunda-dosis-y-agradece-al-gobierno-y-a-israel/,"El personal de primera línea contra la covid-19 de los hospitales Mario Catarino Rivas, Leonardo Martínez y regional del Instituto Hondureño de Seguridad Social (IHSS), de San Pedro Sula,",27-03-2021 14:16,https://www.bing.com/th?id=OVFT.vCM-HETKklR8g2cw6674ji,Chile,Ultima Hora
Jorge Benguché con Covid-19 y será baja de Honduras ante Grecia,https://www.diariomas.hn/2021/03/27/jorge-benguche-con-covid-19-y-sera-baja-de-honduras-ante-grecia/,"El delantero Jorge Benguché será baja de Honduras en el partido amistoso de este domingo ante Grecia, tras haber dado positivo en las pruebas",27-03-2021 20:42,https://www.bing.com/th?id=OVFT.6h7QjkIe40NvYRbfBZLz6C,Chile,Mas
Jorge Benguché dio positivo por covid-19 horas antes del juego ante Grecia,https://www.elheraldo.hn/deportes/1452806-466/jorge-benguche-positivo-covid19-grecia-amistoso-nuevo-coronavirus-pandemia-fenafuth,En el transcurso de las horas se estará monitoreando al jugador y al resto del plantel para evitar más casos positivos al nuevo coronavirus,27-03-2021 21:26,https://www.bing.com/th?id=OVFT.2KxlkkK9upUyr8FK88jh9y,Chile,El Heraldo
Bicolor a cerrar con dignidad gira Europea,https://www.diariomas.hn/2021/03/27/bicolor-a-cerrar-con-dignidad-gira-europea/,La bicolor catracha que dirige el uruguayo Fabián Coito Machado cierra su gira europea con un partido no muy fácil en Salónica ante Grecia en un,28-03-2021 01:00,https://www.bing.com/th?id=OVFT.XzF6dpPGuGxOjMB_AztUfC,Chile,Mas
HONDURAS / ¡CONOZCAN A YUSUF! EL INSOLENTE VENDEDOR DE HILOS Y LA “LLAVE MÁGICA”,http://www.web.ellibertador.hn/index.php/avance/2812-honduras-conozcan-a-yusuf-el-insolente-vendedor-de-hilos-y-la-llave-magica,"Esto es leyes y Estado; el señor Yusuf se siente tan por encima de Juan y del Poder Judicial en Honduras, que puede hacer lo que quiera ... más de 5 mil dosis de vacunas falsas contra el Covid-19 que dicen entrarían ilegalmente en el país.",28-03-2021 03:01,https://www.bing.com/th?id=OVFT.DVjHgWmvsku-NhLNAGHAjS,Chile,El Libertador
"Honduras registra un total de 187,015 casos de covid-19",https://www.radiohrn.hn/honduras-registra-un-total-de-187015-casos-de-covid-19,"Según el informe diario del Sistema Nacional de Gestión de Riesgos (Sinager) hasta a la fecha en Honduras se registra un total de 187,015 casos de covid-19. El informe detalla que este sábado (27.03.2",28-03-2021 03:08,https://www.bing.com/th?id=OVFT.lWC3uqMhQCiZGVgX8Ev5li,Chile,Radio HRN
Hyatt Place el único hotel en Honduras y en la región que cuenta con dos sellos de bioseguridad,http://www.eldiario.hn/hyatt-place-el-unico-hotel-en-honduras-y-en-la-region-que-cuenta-con-dos-sellos-de-bioseguridad/,"Los dos grandes hoteles de la cadena en la ciudad capital y la ciudad industrial de Honduras son los primeros en el país ... cumpliendo con las medidas de seguridad y salud del Covid-19. Por su parte, el sello Gbac certifica a las empresas que están ...",28-03-2021 03:11,https://www.bing.com/th?id=OVFT.O6BiEhTBQ2JHO9pQcRrocS,Chile,El Diario
Muere enfermera por Covid-19 en la zona norte de Honduras,https://www.laprensa.hn/sanpedro/1452787-410/muere-enfermera-pandemia-covid-honduras-hondurena,"Otra profesional de la enfermería en San Pedro Sula, zona norte de Honduras, pierde su batalla contra el Covid-19. Se trata de Suyapa Castillo, quien murió en el Instituto Hondureño de Seguridad Socia",28-03-2021 08:22,https://www.bing.com/th?id=OVFT.9zn8axTRHHJkY-oHi675Si,Chile,La Prensa Chicos
Jorge Benguché sigue positivo de coronavirus y se perderá el juego amistoso entre Grecia,https://www.diez.hn/laseleccion/1452884-498/jorge-benguche-positivo-coronavirus-no-jugara-amistoso-fecha-fifa-honduras-grecia,"Honduras no podrá contar con el delantero del Boavista de Portugal, Jorge Benguché, el jugador sigue siendo positivo por coronavirus y no estará ante la selección de Grecia. Te puede interesar: Tres b",28-03-2021 12:49,https://www.bing.com/th?id=OVFT.e_wF0byRRsDcJHx-dtaefy,Chile,diez.hn
"Por COVID-19, muere Roberto Ordóñez, exdirector del Central Vicente Cáceres",https://tiempo.hn/muere-exdirector-del-central/,"TEGUCIGALPA, HONDURAS. Luego de una lucha contra la mortal enfermedad COVID-19, este domingo se confirmó la muerte de Roberto Armando Ordóñez Flores, exdirector del Instituto Central Vicente Cáceres (",28-03-2021 14:58,https://www.bing.com/th?id=OVFT.03w_-WdiqQk5W9N7jQo24S,Chile,Tiempo
"Muere Roberto Ordóñez, exdirector del Instituto Central, por covid-19",https://www.elheraldo.hn/pais/1452893-466/muere-roberto-ord%C3%B3%C3%B1ez-exdirector-del-instituto-central-por-covid-19,"El docente había sido ingresado a la Unidad de Cuidados Intensivos del Hospital María, debido a complicaciones derivadas del mortal virus",28-03-2021 15:07,https://www.bing.com/th?id=OVFT.CnnSsc9PMcG1fDFBvCZ56C,Chile,El Heraldo
"Muere por Covid-19 exdirector del Instituto Central, Roberto Ordóñez",https://www.laprensa.hn/honduras/1452912-410/muere-roberto-ordonez-exdirector-instituto-vicente-central-caceres-covid-19,"Este domingo en horas de la madrugada falleció el exdirector del Instituto Central Vicente Cáceres (ICVC), Roberto Ordóñez, a causa del Covid-19. El docente estaba ingresado en la Unidad de Cuidados I",28-03-2021 16:31,https://www.bing.com/th?id=OVFT.dJJI00JFnIIAdAxABGBfgi,Chile,La Prensa Chicos
Exdirector del Instituto Central Vicente Cáceres fallece por COVID-19,https://www.latribuna.hn/2021/03/28/exdirector-del-instituto-central-vicente-caceres-fallece-por-covid-19/,"El exdirector del Instituto Central Vicente Cáceres (ICVC), Roberto Armando Ordóñez Flores, murió en las últimas horas por COVID-19 en",28-03-2021 18:50,https://www.bing.com/th?id=OVFT.fKj0S9t6EuNPXvU5ctAiAC,Chile,La Tribuna
Obispo Garachana tilda de grave situación en Honduras por COVID,https://proceso.hn/obispo-garachana-tilda-de-grave-situacion-en-honduras-por-pandemia/,"El también obispo de la diócesis de San Pedro Sula, invitó a vivir el espíritu de la Semana Santa y con ello sobrellevar la prueba de la COVID-19. De acuerdo a los datos oficiales, Honduras sumó hasta la noche del sábado a un total de 187 mil 15 ...",28-03-2021 19:13,https://www.bing.com/th?id=OVFT.at-7VQDCuYFYsWfvkJz3ay,Chile,Proceso
Muere por COVID-19 periodista que laboraba en el RNP,https://proceso.hn/muere-por-covid-19-periodista-que-laboraba-en-el-rnp/,"Tegucigalpa – Este domingo se informó del fallecimiento a causa de la COVID-19 del licenciado en periodismo, Francisco Orlando Rodríguez García en la capital hondureña. Francisco Orlando Rodríguez lab",28-03-2021 19:29,https://www.bing.com/th?id=OVFT.GQN4bzDCZJVlukBhgdXL9y,Chile,Proceso
"Infectólogo cuestiona: Gobierno pide quedarse en casa, pero autoriza feriado",https://tiempo.hn/tito-alvarado-cuestiona-gobierno-feriado/,"“El Gobierno dice por un lado que no salgan y por otro que vayan a vacacionar”, recriminó Alvarado. El experto, desde algunas semanas anteriores había propuesto que se pospusiera el feriado y una vez",28-03-2021 19:54,https://www.bing.com/th?id=OVFT.SRHuaY26-tsFPacTh9khqC,Chile,Tiempo
América pierde y deja malas sensaciones en amistoso ante Rayados de Monterrey previo a enfrentar a Olimpia,https://www.diez.hn/futbolmexicano/1452977-498/amistoso-america-rayados-monterrey-dallas-texas-santiago-solari,"Los Rayados de Monterrey derrotaron 2-0 al América en partido amistoso disputado en Dallas, Texa s ante una buena cantidad de aficionados ya que en aquella ciudad de Estados Unidos ya se permiten los",28-03-2021 20:52,https://www.bing.com/th?id=OVFT.4QrLJJrlaX7SI4mxvDqwcC,Chile,diez.hn
Destacado periodista y fotógrafo pierde la batalla contra la COVID-19,https://www.latribuna.hn/2021/03/28/destacado-periodista-y-fotografo-pierde-la-batalla-contra-la-covid-19/,"Un destacado periodista y fotógrafo hondureño murió este domingo tras perder la batalla contra la COVID-19 en Tegucigalpa, capital de",28-03-2021 20:56,https://www.bing.com/th?id=OVFT.T0q3-dGu7TSBpv2KBp8ObS,Chile,La Tribuna
