name,url,description,datePublished,imagen,pais,Fuente
Honduras identifica presencia de variante alfa del nuevo coronavirus,https://abc17news.com/cnn-spanish/2021/06/24/honduras-identifica-presencia-de-variante-alfa-del-nuevo-coronavirus/,"urielblanco (CNN Español) — La Secretaría de Salud de Honduras informó este jueves sobre la circulación de la variante del coronavirus identificada como alfa, una “de preocupación que surgió en el Rei",24-06-2021 21:49,https://www.bing.com/th?id=OVFT.mFY2DobnoiV9wFd0Tb8Gyy,Chile,ABC 17 News
Buscan invertir fondos del RAP en el extranjero ante bajas tasas de interés,https://www.elheraldo.hn/economia/1474795-466/invertir-fondos-rap-extranjero-tasas-interes-economia-honduras,"Debido a la reducción de las tasas de interés por la pandemia en el mercado nacional, analizan oportunidades en las bolsas de valores que ofrecen bonos estatales y acciones de empresas calificadas",30-06-2021 21:04,https://www.bing.com/th?id=OVFT.Btj0dvm-oJOMu4dcB8Nh6C,Chile,El Heraldo
"Debido a la pandemia, mercados de Comayagua funcionan al 50%",https://www.elheraldo.hn/pais/1474797-466/pandemia-covid-mercados-comayagua-crisis-,Muchos comerciantes alquilaron los locales y otros los mantienen cerrados los siete días de la semana para no contagiarse del mortal covid-19 pues aún no les llega el turno de recibir vacuna,30-06-2021 21:50,https://www.bing.com/th?id=OVFT.KS38zkk6V9VsxQf0hUiJzi,Chile,El Heraldo
"Goles del ""Choco"" Lozano en la temporada pasada son considerados históricos y para el recuerdo en el Cádiz",https://www.diez.hn/legionarios/1474580-498/goles-del-choco-lozano-en-la-temporada-pasada-son-considerados-hist%C3%B3ricos-y,"El delantero hondureño no fue indiscutible en el once del Cádiz CF esta temporada, pero dejó momentos imborrables en San Mamés, Vadebebas y Mestalla.",30-06-2021 21:58,https://www.bing.com/th?id=OVFT.TfMZ-AENmlqrcitCz-S_BC,Chile,diez.hn
Vacunas en el país garantizan protección ante la cepa delta,https://www.laprensa.hn/honduras/1474777-410/vacunas-garantizan-proteccion-cepa-delta-honduras,"Salud amplió la quinta jornada de vacunación en el Distrito Central del 1 al 13 de julio para vacunar a 114,071 personas. Se vacunará mediante citas a los mayores de 60 años.",30-06-2021 22:00,https://www.bing.com/th?id=OVFT.cjROuzegguji5Csz3vBvry,Chile,La Prensa Chicos
Microbiólogos: Honduras no completará vacunación contra COVID solo con donaciones,https://tiempo.hn/microbiologos-donaciones-honduras-no-completara-vacunacion/,"TEGUCIGALPA, HONDURAS.- La portavoz del Colegio de Microbiólogos y Químicos Clínicos de Honduras, Miriam Aguilera, advirtió este miércoles que Honduras no completará el esquema de vacunación contra la",01-07-2021 02:02,https://www.bing.com/th?id=OVFT.zWAL6Ndt_00-MB_a-TBrFC,Chile,Tiempo
"Coronavirus: Honduras registra 7,005 fallecidos por el virus",https://www.radiohrn.hn/coronavirus-honduras-registra-7005-fallecidos-por-el-virus,"La cifra de fallecidos se elevó a 7,005 con la suma de 25 personas más que perdieron la vida a causa del covid-19",01-07-2021 03:20,https://www.bing.com/th?id=OVFT.BmGOdwM47qn6gnADXRxwdC,Chile,Radio HRN
Honduras supera las 7 mil muertes por COVID-19,https://proceso.hn/honduras-supera-las-7-mil-muertes-por-covid-19/,"El Sistema Nacional de Gestión de Riesgos (Sinager) reportó este miércoles 691 nuevos contagios y 25 fallecimientos por COVID-19, con ello Honduras superó los 7 mil decesos en 476 días de haberse",01-07-2021 04:34,https://www.bing.com/th?id=OVFT.XrdzhH7AyU_V2prOQntdkC,Chile,Proceso
Inversión extranjera en Honduras sufre drástica caída en primer trimestre,https://www.laprensa.hn/honduras/1474913-410/inversion-extranjera-honduras-sufre-drastica-ca%C3%ADda-primer-trimestre,"La inversión extranjera directa (IED) cayó 7 % frente al mismo periodo del año anterior hasta llegar a 311,4 millones de dólares.",01-07-2021 12:18,https://www.bing.com/th?id=OVFT.vHQvGsbuE4eUQnkaZDX0Ui,Chile,La Prensa Chicos
A dos décadas de la dolorosa derrota ante los ticos en el estadio Nacional,https://www.diariomas.hn/2021/07/01/a-dos-decadas-de-la-dolorosa-derrota-ante-los-ticos-en-el-estadio-nacional/,"Fecha histórica para los ticos que derrotaron 3-2 a Honduras en el estadio Nacional de Tegucigalpa, en donde la escuadra hondureña se complicó su clasificación al Mundial de Japón y Corea 2002. Paulo",01-07-2021 13:10,https://www.bing.com/th?id=OVFT.t3h8OCizK4ZnFL7-hL6cbi,Chile,Mas
"Después de la crisis de covid-19 en India, enfermedad del hongo negro deja ciegos",https://www.msn.com/es-mx/noticias/mundo/despu%C3%A9s-de-la-crisis-de-covid-19-en-india-enfermedad-del-hongo-negro-deja-ciegos/ar-AALFby6,"India ordenó en mayo un seguimiento más estricto de la mucormicosis, que agravó los problemas para pacientes con covid-19, especialmente aquellos en terapia con esteroides y con diabetes.",01-07-2021 14:16,https://www.bing.com/th?id=OVFT.a2CgjOED4_CWv0ZohUNjky,Chile,MSN
Honduras cerró junio con más de 7 mil muertes por coronavirus y cerca de los 263 mil contagios,https://hondudiario.com/covid-19/honduras-cerro-junio-con-mas-de-7-mil-muertes-por-coronavirus-y-cerca-de-los-263-mil-contagios/,"*** Las muertes sólo en 2021 suman un total de 3,771 a nivel nacional; los contagios en lo que va del año son 137,203. Honduras registró en las últimas horas 691 nuevos casos de coronavirus, alcanzand",01-07-2021 15:36,https://www.bing.com/th?id=OVFT.hpCEYtS_3JQqk5Mm5Of1GC,Chile,Hondudiario
Médicos insisten en salvar vidas aplicando las dos dosis de la vacuna anticovid,https://hondudiario.com/covid-19/medicos-insisten-en-salvar-vidas-aplicando-las-dos-dosis-de-la-vacuna-anticovid/,"***“Es mejor asegurar vidas y no tenerlas medio aseguradas como planea el gobierno, porque considero incorrecto el actual proceso de vacunación contra la Covid-19 en la que solo se garantiza la primer",01-07-2021 15:57,https://www.bing.com/th?id=OVFT.BsJupXvkXuSvsE1DJWeiri,Chile,Hondudiario
CERCA DE 2.5 MILLONES DE DOSIS DE VACUNAS HA RECIBIDO HONDURAS,https://ultimahora.hn/cerca-de-2-5-millones-de-dosis-de-vacunas-ha-recibido-honduras/,"Honduras ya ha recibido cerca de 2.5 millones de vacunas, entre donaciones y compras gestionadas por el Gobierno. Uno de los recibos más recientes fue el que obtuvo el  Gobierno de la República",01-07-2021 16:09,https://www.bing.com/th?id=OVFT.Q2G9bpHhhm1MPOpS37z24i,Chile,Ultima Hora
21 hondureños en la lista Engel,https://www.vtv.com.hn/noticia/21-hondurenos-en-la-lista-engel/,"El Departamento de Estado ha hecho pública la lista de los 21 hondureños en su mayoría funcionarios públicos y actuales diputados los nombres que figuran son los siguientes: Gustavo Alberto Pérez, act",01-07-2021 16:50,https://www.bing.com/th?id=OVFT.Kwv05rvLPMWkC81uBdkV_C,Chile,VTV
Cerrada por 15 días iglesia de Sabanagrande por aumento de casos de COVID-19,https://www.latribuna.hn/2021/07/01/cerrada-por-15-dias-iglesia-de-sabanagrande-por-aumento-de-casos-de-covid-19/,"Debido al alto contagio de COVID-19, cierran por 15 días la iglesia de Sabanagrande, Francisco Morazán, según informaron autoridades eclesiásticas.",01-07-2021 16:58,https://www.bing.com/th?id=OVFT.HuDSaVc6HanqMRtNo24xby,Chile,La Tribuna
HONDURAS / LIBERADA “ENGELS” SIN “PECES GORDOS” DEL GOBIERNO HERNÁNDEZ,http://www.web.ellibertador.hn/index.php/noticias/nacionales/3027-honduras-liberada-engels-sin-peces-gordos-del-gobierno-hernandez,"Después de generar altas expectativas con el listado “Engels”, finalemente este jueves el Departamento de Estado de los Estados Unidos, ha liberado los nombres de políticos corruptos del Triángulo Norte; en el caso de Honduras, no aparece ningún ...",01-07-2021 17:26,https://www.bing.com/th?id=OVFT.T36qXh1-jR96tMdJl0T6Pi,Chile,El Libertador
Plantilla del Vida se sometió a pruebas de covid-19 previo al inicio de la pretemporada,https://www.diez.hn/liganacionaldehonduras/1474907-498/plantilla-vida-se-sometio-a-pruebas-de-covid-19-pretemporada,Al menos 21 futbolistas atendieron la convocatoria de Fernando Mira para someterse a los exámenes de covid-19.,01-07-2021 18:23,https://www.bing.com/th?id=OVFT._9e8evNgTQ5usWgZI1m1ui,Chile,diez.hn
Despliegan brigadas de salud para atender a migrantes en el sureste de México,https://www.latribuna.hn/2021/07/01/despliegan-brigadas-de-salud-para-atender-a-migrantes-en-el-sureste-de-mexico/,"Tapachula (México), 1 jul (EFE).- Cientos de migrantes varados en municipio de Tapachula, en el sureste de México, reciben atención",01-07-2021 18:36,https://www.bing.com/th?id=OVFT.K4RzN72g9rqSnN5-k1gmmC,Chile,La Tribuna
"Honduras frente a avalancha de casos y muertos por COVID-19, advierte epidemióloga",https://proceso.hn/honduras-frente-a-avalancha-de-casos-y-muertos-por-covid-19-advierte-epidemiologa/,"Honduras está frente a una avalancha de casos positivos y muertes a causa de la COVID-19, advirtió Silvia Portillo, jefa del Servicio de Patología del Instituto Nacional Cardiopulmonar más",01-07-2021 19:19,https://www.bing.com/th?id=OVFT.wYdTMN2TqfrxlGFJTwNjCi,Chile,Proceso
Más de 100 mil persona acuden a vacunarse esta jornada,https://www.vtv.com.hn/noticia/mas-de-100-mil-persona-acuden-a-vacunarse-esta-jornada/,En el Polideportivo de la Universidad Autónoma de Honduras dieron inicio esta jornada a la vacunación de personas de la tercera edad contra la covid-19-,01-07-2021 19:47,https://www.bing.com/th?id=OVFT.6evQkXKEYbtyhn4K4lOoIy,Chile,VTV
Luis Fernando Suarez oficializa nómina de Costa Rica para Copa Oro 2021,https://www.diariomas.hn/2021/07/01/luis-fernando-suarez-oficializa-nomina-tica-para-copa-oro-2021/,"La selección de Costa Rica, ahora encabezada por el técnico colombiano Luis Fernando Suárez, presentó este jueves la nómina final con la que le hará frente a la Copa Oro, el torneo más importante de l",01-07-2021 20:04,https://www.bing.com/th?id=OVFT.y-6EAO96fQHFk8BrCQnQpy,Chile,Mas
Sinager anuncia más camas en hospitales y fortalecimiento de centros de triaje ante aumento de covid-19,http://www.elsoldehonduras.com/nacionales/sinager-anuncia-mas-camas-en-hospitales-y-fortalecimiento-de-centros-de-triaje-ante-aumento-de-covid-19/,Las autoridades de Sistema Nacional de Gestión de Riesgo (Sinager) anunciaron este martes el reforzamiento de las acciones para dar respuesta a la población hondureña ante el aumento de casos de la co,01-07-2021 20:29,https://www.bing.com/th?id=OVFT.EELVnCvwhzLBuFyi1I5-yS,Chile,El Sol de Honduras
Salud amplía la V campaña de vacunación contra el Covid-19 del 1 al 13 de julio,http://www.elsoldehonduras.com/nacionales/salud-amplia-la-v-campana-de-vacunacion-contra-el-covid-19-del-1-al-13-de-julio/,"La Secretaría de Salud a través de la Región Metropolitana del Distrito Central informó este día sobre la ampliación de la V campaña de vacunación contra el Covid-19 del 1 al 13 de julio, la meta a va",01-07-2021 20:43,https://www.bing.com/th?id=OVFT.6WcY-RebEQcZKaQyty5u6y,Chile,El Sol de Honduras
SIR SALVADOR MONCADA: COMBINACIÓN DE ASTRAZENECA Y PFIZER ES BUENA PARA COMBATIR EL COVID-19,https://ultimahora.hn/sir-salvador-moncada-combinacion-de-astrazeneca-y-pfizer-es-buena-para-combatir-el-covid-19/,"El hondureño Sir Salvador Moncada, dijo hoy que la combinación de las vacunas de AstraZeneca y Pfizer es buena y efectiva para combatir el COVID-19. Honduras ha recibido lotes de vacunas tanto de",01-07-2021 20:50,https://www.bing.com/th?id=OVFT.tNiyY3z2Qo4tRO6kZ-PjfS,Chile,Ultima Hora
