name,url,description,datePublished,imagen,pais,Fuente
"Ministro de Educación, reafirma:",https://www.vtv.com.hn/noticia/ministro-de-educacion-reafirma/,La meta del Gobierno a través de la Secretaría de Educación es llegar a 200.000 estudiantes con esa herramienta tecnología que se apega a los requerimientos internacionales de los nuevos modelos educativos de los que Honduras forma parte. Ante algunos ...,26-03-2021 16:58,https://www.bing.com/th?id=OVFT.sp_B5MIYMM1ku0_4HPYgTy,Chile,VTV
En 30% podrían aumentar los contagios de Covid-19 tras la Semana Santa,https://hondudiario.com/2021/03/26/en-30-podrian-aumentar-los-contagios-de-covid-19-tras-la-semana-santa/,"La portavoz de Colegio de Microbiólogos y Químicos Clínicos de Honduras, Miriam Aguilera calculó que, después de la Semana Santa, habrá un repunte de casos de Covid-19 del 30 por ciento. La vocera ase",26-03-2021 17:04,https://www.bing.com/th?id=OVFT.T4PlEwc-DRT37HhPK-zqiC,Chile,Hondudiario
Semana Santa abre la puerta a una tercera oleada de coronavirus en Honduras,https://hondudiario.com/2021/03/26/semana-santa-abre-la-puerta-a-una-tercera-oleada-de-coronavirus-en-honduras/,"El viceministro de Salud, Roberto Cosenza, advirtió este viernes que Honduras se encuentra amenazada por una tercera ola de coronavirus. Las declaraciones del funcionario se dan en un escenario previo",26-03-2021 17:53,https://www.bing.com/th?id=OVFT.7Y4ahZCRu9g1pJMF6jDhai,Chile,Hondudiario
Gobierno reitera que no hay autorización para celebración de conciertos y espectáculos públicos,http://www.elsoldehonduras.com/nacionales/gobierno-reitera-que-no-hay-autorizacion-para-celebracion-de-conciertos-y-espectaculos-publicos/,"Secretaría de Gobernación cancela concierto de RIC HASSANI y ASPIRANTE programados en Trujillo, Colón para Semana Santa.Las 18 Gobernaciones Departamentales tienen instrucción para prohibir espectácul",26-03-2021 18:48,https://www.bing.com/th?id=OVFT.NgLCe1yWBxgLCJ6v0Ki3qy,Chile,El Sol de Honduras
Aduanas de Frontera y Guardaturas Aéreas laborarán en horario normal durante la Semana Santa,http://www.elsoldehonduras.com/nacionales/aduanas-de-frontera-y-guardaturas-aereas-laboraran-en-horario-normal-durante-la-semana-santa/,Con la finalidad de brindar una óptima atención a los exportadores e importadores y de esta forma continuar con la fluidez del comercio en la región la Administración Aduanera de Honduras da a conocer,26-03-2021 19:03,https://www.bing.com/th?id=OVFT.2B09xl6UsYgL7_FrP9Q0eS,Chile,El Sol de Honduras
"Un año después de la primera muerte, pandemia del COVID sigue en Honduras",https://tiempo.hn/primera-muerte-pandemia-en-honduras/,"Actualmente los casos de COVID-19 siguen en alza, mientras los hondureños aguardan por una vacuna. TEGUCIGALPA, HONDURAS. Marzo de 2020 es un mes que estará grabado en la memoria de varios hondureños.",26-03-2021 22:03,https://www.bing.com/th?id=OVFT.loELFtGZWki6AF_HVFsU1i,Chile,Tiempo
Covid-19 reduce ventas de palmas para Domingo de Ramos en Honduras,https://www.radiohrn.hn/covid-19-reduce-ventas-de-palmas-para-domingo-de-ramos-en-honduras,"La pandemia de covid-19 que afecta a Honduras desde marzo de 2020 ha reducido este año las ventas de tiras palmas para su bendición el Domingo de Ramos en los templos católicos. ""Por ese virus uno viene con miedo a vender y han estado diciendo que no ...",26-03-2021 22:39,https://www.bing.com/th?id=OVFT.CY5q589GTWhDxzxBCJcXUC,Chile,Radio HRN
El BCIE hace un nuevo aporte a Honduras para centro de contención de COVID-19,https://proceso.hn/el-bcie-hace-un-nuevo-aporte-a-honduras-para-centro-de-contencion-de-covid-19/,"El presidente ejecutivo del BCIE, Dante Mossi, dijo que la COVID-19 ha causado una situación «muy difícil» en el país centroamericano, donde se reportan más de 185,000 contagios y cerca de 5,000",27-03-2021 01:02,https://www.bing.com/th?id=OVFT.cPfRbx-oCKvMu_kcleNh2i,Chile,Proceso
El BCIE dispone de 500 mil dólares para un centro de contención de covid-19 en Honduras,https://www.radiohrn.hn/el-bcie-dispone-de-500-mil-dolares-para-un-centro-de-contencion-de-covid-19-en-honduras,"Con este donativo, el BCIE ha otorgado a Honduras 2,4 millones de dólares en apoyo a las medidas de mitigación de la covid-19, añadió Mossi El Banco Centroamericano de Integración Económica (BCIE) informó este viernes sobre una nueva donación de ...",27-03-2021 03:32,https://www.bing.com/th?id=OVFT.ykDCzUbpDgdZkFjMBWrpWi,Chile,Radio HRN
"Suben a 4,536 los decesos por covid en Honduras y contagios llegan a 186,337",https://www.latribuna.hn/2021/03/27/suben-a-4536-los-decesos-por-covid-en-honduras-y-contagios-llegan-a-186337/,"Tegucigalpa, mar (EFE).- La cifra de muertos en Honduras a causa de la pandemia de covid-19 que sufre desde marzo",27-03-2021 14:12,https://www.bing.com/th?id=OVFT.UaPNev03ilQBxeuhHMsRJC,Chile,La Tribuna
PERSONAL DE SALUD DE SPS YA ESTÁN INMUNIZADOS AL 100% TRAS RECIBIR SEGUNDA DOSIS Y AGRADECE AL GOBIERNO Y A ISRAEL,https://ultimahora.hn/personal-de-salud-de-sps-ya-estan-inmunizados-al-100-tras-recibir-segunda-dosis-y-agradece-al-gobierno-y-a-israel/,"El personal de primera línea contra la covid-19 de los hospitales Mario Catarino Rivas, Leonardo Martínez y regional del Instituto Hondureño de Seguridad Social (IHSS), de San Pedro Sula,",27-03-2021 14:16,https://www.bing.com/th?id=OVFT.vCM-HETKklR8g2cw6674ji,Chile,Ultima Hora
OFICIAL: Héctor Castellon es el nuevo entrenador de la Real Sociedad para el resto del Clausura 2021,https://www.diez.hn/liganacionaldehonduras/1452729-498/hector-castellon-entrenador-real-sociedad-tocoa-honduras-clausura-2021-liga-nacional,"Con pruebas de covid-19 en proceso, el equipo de Tocoa espera contar con su presencia en su próximo juego donde ganar podrían dar un paso adelante para permanecer en Liga Nacional, pues son últimos en la tabla general y tienen pocos partidos para ...",27-03-2021 14:40,https://www.bing.com/th?id=OVFT.Tv3esA8ag7j-K1bnD1zcni,Chile,diez.hn
Se anuncia pírrica rebaja en los precios de los combustibles,https://www.elheraldo.hn/economia/1452674-466/se-anuncia-pirrica-rebaja-precios-combustibles-honduras,Lo anterior se derivará en leves rebajas de los precios de los combustibles que se consumen en Honduras. Así lo anunciaron los representantes de la cadena de comercialización del país. “Con las caídas,27-03-2021 14:47,https://www.bing.com/th?id=OVFT.y_ouJGSeFpTSXmm6MLuWIy,Chile,El Heraldo
Enfermera pierde la batalla contra la COVID-19 en SPS,https://www.latribuna.hn/2021/03/27/enfermera-pierde-la-batalla-contra-la-covid-19-en-sps-2/,"Una enfermera más ha perdido la batalla contra la COVID-19 en Honduras. Se trata de Suyapa Castillo, quien falleció este",27-03-2021 16:19,https://www.bing.com/th?id=OVFT.UikDm1dQoP0QD0sz4fvOAC,Chile,La Tribuna
Liga Triunfeña de Béisbol concluye primera vuelta,https://www.diariomas.hn/2021/03/27/liga-triunfena-de-beisbol-concluye-primera-vuelta/,"La Liga Mayor de Béisbol Triunfeña Carlos y Emilio Martínez, finaliza este fin de semana la primera vuelta del Campeonato Benito “La Pinta” Argeñal,",27-03-2021 16:30,https://www.bing.com/th?id=OVFT.Hzw2-tbRR_R_GIsmsljTJy,Chile,Mas
"Fallece por COVID-19, otra licenciada en enfermería en SPS",https://proceso.hn/fallece-por-covid-19-otra-licenciada-en-enfermeria-en-sps/,"Castillo estuvo ingresada por 20 días en el Instituto Hondureño del Seguro Social (IHSS), de San Pedro Sula, batallando contra la enfermedad, pero perdió la vida.",27-03-2021 17:51,https://www.bing.com/th?id=OVFT.e6QT0yDQrEwa2B4V2rundi,Chile,Proceso
Muere por covid-19 licenciada en enfermería Suyapa Castillo en SPS,https://www.elheraldo.hn/pais/1452786-466/muere-por-covid-19-licenciada-en-enfermer%C3%ADa-suyapa-castillo-en-sps,"Suyapa Castillo, quien estaba en primera línea de lucha contra la pandemia, laboraba en el Hospital Leonardo Martínez de la ciudad industrial",27-03-2021 19:33,https://www.bing.com/th?id=OVFT.4Kvn4n_soIkS-jJXiGc8iS,Chile,El Heraldo
Muere enfermera en la zona norte de Honduras por Covid-19,https://www.laprensa.hn/sanpedro/1452787-410/muere-enfermera-pandemia-covid-honduras-hondurena,"Otra profesional de la enfermería en San Pedro Sula, zona norte de Honduras, pierde su batalla contra el Covid-19. Se trata de Suyapa Castillo, quien murió en el Instituto Hondureño de Seguridad Socia",27-03-2021 19:37,https://www.bing.com/th?id=OVFT.9zn8axTRHHJkY-oHi675Si,Chile,La Prensa Chicos
"Un caso positivo por coronavirus en la selección de Honduras, según medios griegos",https://www.laprensa.hn/deportes/1452795-410/seleccion-honduras-grecia-caso-positivo-coronavirus-covid-19-griegos-amistoso,La selección de Honduras reporta un caso positivo por coronavirus. Foto Fenafuth. Malas noticias sobre la selección Nacional de Honduras llegan desde Grecia de cara al amistoso que la H sostendrá este,27-03-2021 20:15,https://www.bing.com/th?id=OVFT.XbxpSn1yFt8kxssJ1L5dpi,Chile,La Prensa Chicos
Jorge Benguché con Covid-19 y será baja de Honduras ante Grecia,https://www.diariomas.hn/2021/03/27/jorge-benguche-con-covid-19-y-sera-baja-de-honduras-ante-grecia/,"El delantero Jorge Benguché será baja de Honduras en el partido amistosos de este domingo ante Grecia, tras haber dado positivo en las pruebas de coronavirus. La noticia la confirmó la Fenafuth por medio de sus redes sociales, que detalló que el ...",27-03-2021 20:41,https://www.bing.com/th?id=OVFT.6h7QjkIe40NvYRbfBZLz6C,Chile,Mas
BCIE realiza nuevo desembolso de $500 mil para triaje de Juan Pablo II,https://tiempo.hn/bcie-donacion-500-mil-triaje-de-juan-pablo-ii/,"El BCIE informó sobre una nueva donación para Honduras, misma que será por un valor de $500 mil, destinada para un triaje de Tegucigalpa.",27-03-2021 20:46,https://www.bing.com/th?id=OVFT.CQDvISDwqJuKb-Gp65Z0My,Chile,Tiempo
